식당 이름,계정 ID,계정의 리뷰 수,방문 날짜,방문 횟수,인증 수단,리뷰 내용,리뷰 글자 수,리뷰 내 사진 유무
을밀대 평양냉면,klp****,116,2026.04.23,1번째 방문,영수증,남편하고 점심으로 을밀대 평양냉면이 유명하다 해서 방문했는데 먹어보니 슴슴한 맛이고 녹두전도 괜찮네요,56,False
을밀대 평양냉면,대한민국여권소지자,368,2026.04.18,1번째 방문,영수증,유명 해서 많이 들어 봤는데 처음 가봤어요. 국물은 시원하고 회냉면 맛있네요.🙂👍🏻,46,True
을밀대 평양냉면,dms****,33,2026.04.17,1번째 방문,영수증,"밖에 좌석도 많았어요 . 롱부츠에 치마 입었는데 식당안쪽으로 안내하더니 좌식인것도 모자라 너무 불편해 결국 밖으로 다시 신발신고 이동 날이 더워 일반 물 부탁드린다 말씀드리니 대답없이 2초쳐다보다가 물만 툭 던지고 가고 물티슈 여쭤보니 물티슈 없는데요? 라 말하고 옆에 다른테이블들한테는 친절하고 어리다고 무시하는건지 정말 여러므로 불쾌한 경험이었네요 웬만하면 이런댓글 안남기는데 최근 리뷰도 안좋고 배가 부른거같네요,",234,True
을밀대 평양냉면,hewpqlff1,8,2026.04.16,1번째 방문,영수증,"​평소 혼자서도 자주 찾던 단골집인데, 오늘 서비스는 정말 최악이었습니다. 성수기라 바쁜 건 이해하지만 인원수에 따른 서비스 차별이 너무 노골적이네요. ​주문을 받을 때나 음식을 주실 때 대꾸 한마디 없이 툭툭 던지고 가셔서 식사 전부터 무척 불쾌했습니다. 정작 옆 테이블 다인원 손님들에게는 웃으며 친절히 인사하시는 모습을 보니, 혼자 온 손님은 눈치를 주는 건가 싶어 어처구니가 없더군요. ​믿고 찾던 을밀대였는데 서비스는 물론 맛까지 예전만 못해 정말 속상합니다. 1인 손님을 홀대하는 태도에 큰 실망을 느껴 이제는 다시 방문하지 않을 것 같습니다",309,False
을밀대 평양냉면,emilee,127,2026.04.15,2번째 방문,영수증,주전자에 뜨거운 하얀 색 물이 나와 면수인줄 알았는데 간이 된 것이 육수인가 봅니다.,47,True
을밀대 평양냉면,무스마,66,2026.04.15,1번째 방문,영수증,맛있게 잘먹었습니다 육수도 일품이고 고기가 너무 맛있네요 1등입니다 줄도 길었는데 회전율이 좋아서 금방 빠지더라고요 5분에서 10분안에 들어가서 먹었어요ㅎㅎ 맛있네요,92,True
을밀대 평양냉면,ilillllilii,188,2026.04.12,14번째 방문,영수증,,0,True
을밀대 평양냉면,호란맘,2896,2026.04.12,1번째 방문,영수증,"평양냉면 맛집, 녹두전은 진짜 인생녹두전이에요, 넘 맛있음!!!!",36,True
을밀대 평양냉면,웰시사냥,17,2026.04.11,1번째 방문,영수증,꽉 차고 미친 밸런스의 평양냉면 평냉 입문자들에게도 추천 가능 할 맛,38,True
을밀대 평양냉면,Cadillac,1801,2026.04.08,2번째 방문,예약,"11:40 방문. 대기 없이 바로 입장. 수육 녹두 빈대떡 냉면 4개 122,000원 ! 살 얼음 빼서 달라 하면 육수가 좀 더 진하고 강한 느낌이라고 하네요!",89,True
을밀대 평양냉면,먹고걷고햇빛듬뿍,1961,2026.04.06,3번째 방문,영수증,"대흥역2번출구 직진 농협,씨유,태성목재건물 좌회전후에 직진하면 염리동주민센터 어서 50미터 앞쪽에있음 을밀대 마포점에가서 비빔냉면(16,000원)하고 같이 녹두전(13,000원)을 먹습니다 (29,000원)입니다 비빔냉면은 많이 맵냐고 물어보니 안맵다고 합니다 직접 먹어보니 팔도비빔면 정도입니다, 녹두전은 바삭 하게 크리스피하게 나옵니다, 가위로 자르니 쉽게 쪼개 집니다, 김치하고 냉면무는 필요없으니 먹기전에 반납을 해야 이런 한식음식점들이 오래갈것 같네요, 잘먹고갑니다 감사합니다 대한민국 방방곡곡 도시거리와 둘레길을 걸어다니면서 음식점 카페 빵집 박물관 기념관 소개하는 리뷰어입니다 ✅️ MY플레이스 리뷰어순위 TOP 30등 🌼🌸💚🩷 ✅️리뷰 총조회수 1,860만회 (0.1% 리뷰어)🌸🌼💜",390,True
을밀대 평양냉면,한식을 먹자,197,2026.04.05,2번째 방문,예약,거냉으로 부탁드렸는데 그냥 주셨어요~ 하지만 고기 퀄리티도 좋고 잘 먹었습니다,43,True
을밀대 평양냉면,Happy joy,638,2026.04.04,1번째 방문,영수증,"평양냉면으로 유명한 을밀대에 갔는데 역시나 웨이팅 줄이..... 8번째였는데 회전율이 빨라서 10여분만에 입장했어요 ^^ 각각 물냉면, 회냉면, 비빔냉면을 주문했어요. 맵찔이한테는 비냉 소스가 매웠지만 바삭 고소하고 감칠맛나는 녹두전 덕분에 맛있게 마무리했어요 ^^ 다음에도 녹두전은 필수에요 👍",165,True
을밀대 평양냉면,iceland25,64,2026.04.04,1번째 방문,영수증,거냉으로해서 먹었는데~~!! 넘맛있어요,21,True
을밀대 평양냉면,임금2621,78,2026.04.04,1번째 방문,영수증,국내산재료로 만드는 평냉...! 기대하고 갔는데 역시나 맛있네요 웨이팅이 많은 이유를 알겠어요 이날도 웨이팅 줄이 길었는데 매장이 워낙 넓어 회전율이 좋았습니다! 20분 정도 대기 후 들어갔어요👍🏻,110,True
을밀대 평양냉면,Gratia78,1961,2026.04.03,3번째 방문,영수증,,0,True
을밀대 평양냉면,치즈한스푼,66,2026.04.03,1번째 방문,예약,"변했네요, 최악입니다. 이번에만 그런건진 모르겠으나 면이 완전 불어서 나왔습니다. 냉면의 생명은 면인데 평냉 외길인생에 이런 면발은 처음입니다. 본점이 이제 을밀대 다른 지점보다 못하게 돼버렸네요.",110,True
을밀대 평양냉면,ang****,33,2026.04.01,1번째 방문,영수증,너무너무 맛있어요 ~ 늘 한결같은맛 💛,21,True
을밀대 평양냉면,강아지좋아고양이좋아,144,2026.03.31,1번째 방문,영수증,제일 좋아하는 냉면집이예요!,15,True
을밀대 평양냉면,diverhyun,80,2026.03.29,1번째 방문,영수증,배추김치 맛집 ㅋ 평양 냉면은 우래옥 !!! 맛집 리스트 바로 삭제!! 서울 놈들 추천 식당들은 믿을수 없음!!!ㅎㅎ,65,True
을밀대 평양냉면,프로리뷰져,688,2026.03.27,1번째 방문,영수증,맛나다 유명 맛집은 다르다는 걸 알게되었다 주전자로 주는 사골육수도 좋았다,41,True
을밀대 평양냉면,반포맛도리,1405,2026.03.26,88번째 방문,,1층 2층 옆집 뒷방. 크게 이렇게 네군데로 구분되어있어요.,33,True
을밀대 평양냉면,psickmsick,606,2026.03.23,2번째 방문,영수증,올해 첫 평냉은 을밀대에서. 날씨가 조금씩 풀리면서 가장 생각나는 음식은 '평양냉면' 그중에 작년 여름 가장 인상 깊었던 곳중 한곳인 을밀대에 다시 방문했습니다. 첫방문은 여름이 한창인 8월 정도 방문했었는데 7개월만에 재방문 입니다. 3시 쯤 방문했는데도 손님들이 꾸준히 들어옵니다. 평냉 두그릇 주문. 10분 정도 기다리면 테이블에 내어주십니다. 예전 방문과 다르게 꾸밈으로 올라간 고기가 부채살인지? 아롱사태인지 심줄이 두텁게 있어 쫄깃한 식감의 고기 입니다. 작년에 먹었던 고기가 더 제취향. ^^;; 제가 생각하는 을밀대의 가장 큰 매력은 두툼한 면발인데. 이번에 찐한 국물이 더 좋았습니다. like 평양면옥(?) ㅎ 맛있게 잘 먹고 갑니다~!,366,True
을밀대 평양냉면,cess2010,1214,2026.03.21,1번째 방문,영수증,"서울온 김에 을밀대...^^, 물냉면 면에도 맛이 느껴지네요...비냉은 쏘쏘~~~, 매장 내부는 레트로 감성이구요...복잡한 곳이라 평일에 오기는 쫌 무리인듯! 가격 물냉,비냉 ₩16,000원 ~~~.",112,True
을밀대 평양냉면,yumyum95,550,2026.03.21,1번째 방문,영수증,"오랜만에 본점에 방문했는데, 맛있네요. 곡물향 가득한 면발과 진득한 평양냉면의 국물까지 잘 먹었어요.",56,True
을밀대 평양냉면,녀니녀니,819,2026.03.21,1번째 방문,영수증,을밀대 넘넘 좋아요~~~!💓💓💓,17,True
을밀대 평양냉면,zl존도히,483,2026.03.15,1번째 방문,예약,을밀대는 평냉+녹두전 무조건임 하 또먹고싶어요 냉면은 말도 필요없고 녹두전도 꼭드세요 앞에서 조금 기다리는데 제 순서에 옆집으로 가세요~ 했는데 진짜 옆집에 옆집이라 써있음,96,True
을밀대 평양냉면,ililiiliiiliil,380,2026.03.14,2번째 방문,영수증,주차장 존재 맛으론 사오이시 가성비 포함 삼팔이시 겨울에도 은근 사람 존재 전은 냉면 다 먹고 시키는게 낫다 맛이 안 느껴짐,69,True
을밀대 평양냉면,김공유1988,32,2026.03.13,1번째 방문,예약,❤️♥️친구 덕분에 알게된 맛집! 언제와도 대기는 피힐수 없는 핫플😋,38,False
을밀대 평양냉면,천개의리뷰,60,2026.03.10,1번째 방문,영수증,먹었던평냉중에 젤맛나옹,12,True
을밀대 평양냉면,홍반장93,296,2026.03.10,1번째 방문,영수증,동네맛집. 여름에는 난리부루스지만 지금은 편안하게 냉면 즐기기에 좋은 시기. 유명세만큼 맛있지만 취향은 각자. 굵고 쫄깃한 면발은 내취향 ㅎㅎ,79,True
을밀대 평양냉면,naboko,53,2026.03.08,1번째 방문,예약,역시 을밀대이긴 한데 갈 때마다 맛이 조금씩 달라지는 듯하네요. 그리고 냉면에 얼음 좀 띄우지 마세요. 혀가 얼얼해서 냉면 맛을 느낄 수가 없어요.,82,False
을밀대 평양냉면,닥터Bae,573,2026.03.05,1번째 방문,영수증,냉면도 맛있고 녹두전 간이 슴슴하니 간이 전혀 없어 저는 좋았어요. 바싹하니 맛있습니다.,49,True
을밀대 평양냉면,주마요,220,2026.03.05,1번째 방문,예약,평양냉면이랑 녹두전 먹었어요! 좀 비싸다 생각했는데 다시 가고 싶을 정도로 맛있었어요 같이간 친구는 평냉이 처음이었는데도 맛있다고 했어요👍🏻 아직 날이 풀리지 않아서 그런지 웨이팅도 없었습니다☺️,109,True
을밀대 평양냉면,토순이엄마,329,2026.03.04,1번째 방문,예약,"냉면 성수기가 아닌 비수기 겨울인데도 일하시는 분들이 아주 많으셔서 놀랬고, 오후 4시쯤 방문했더니 한산했던 실내 기본 물냉면 주문했고 평양냉면 중에서 살얼음이 가장 믾지 않을까 살얼음이 동동 떠있어도 육향이 진함!! 씹을수록 구수한 메밀향이 너무 좋은 면 고명으로 올려진 소고기도 맛있었고 여태 을밀대 방문중 가장 맛있게 먹을 날 얼죽아보다 평냉이 나은걸 ㅋㅋㅋ 육향이 짙어서 평양냉면 초보자도 입문용으로 좋을듯",231,True
을밀대 평양냉면,Byeongsub,989,2026.03.01,1번째 방문,영수증,슴슴한 평양냉면집. 비냉보단 물냉이 더 맛있는 거 같아요~,32,True
을밀대 평양냉면,Highsol,170,2026.03.01,1번째 방문,예약,을밀대는 역시 마포 본점 웨이팅 있어도 순식간에 입장해요,31,True
을밀대 평양냉면,밤토리토리리,356,2026.02.26,1번째 방문,예약,마싯써요🤤,5,True
을밀대 평양냉면,계란말이48,891,2026.02.25,13번째 방문,영수증,겨울이라 포장해다 먹어도 풀어지지않고 좋네요,24,True
을밀대 평양냉면,iyowa,31,2026.02.24,1번째 방문,예약,초보라 저는 비냉시켰는데 비냉은 너무맛없었어요. 친구들이랑 평냉투어하시는분들 여기는 무조건 물냉시키세요. 물냉 맛있어요 역시 을밀대 (사진은 친구 물냉),85,True
을밀대 평양냉면,마구로 사시미,537,2026.02.23,1번째 방문,예약,굿,1,False
을밀대 평양냉면,깨비깨비깨비먹깨비,197,2026.02.22,1번째 방문,영수증,서울 인기 평.냉 맛집으로 불리고 있어서 가봤어요 강풍주의보가 뜬 겨울 일요일 6시넘긴 시간였지만 본관(?)쪽 이미 만석! 옆 건물 녹두전 붙이는 별관으로 안내받아 먹었어요 정*면*과 비교해보면 면은 여의도쪽매장이 더 식감이 좋았는데 육수는 을밀대 이곳이 더 슴슴하니 평양냉면 본연의 담백한 육향이 더 가득했던거 같아요 비빔냉면은 리뷰평이 좋은글이 없었지만 온김에 도전. 뭐죠? 평양냉면에 비해 기대감이 덜한거지.. 저는 비빔냉면 간이 자극적이지 않고 담백한 맛으로 맛있게먹었어요. 먹다가 겨자+무우채 넣고 섞고 김치를 싸서 자극적인 맛을 만들어봤는데... 매운거 선호하시는 분은 이렇게 먹어보시는것도 추천드려요! 녹두전도 겉빠속촉으로 고기식감도 크게느끼며 맛있게먹었답니다,376,True
을밀대 평양냉면,도레도에,238,2026.02.21,1번째 방문,,나 맨날 줄긴거 구경만 하다가 평냉 첨 먹어봤어여 한 입 먹고 이게 맞나 싶어서 한입 더 먹게 되는 맛이에여 비싸지만 가볼만한 곳인거 가태요,78,True
을밀대 평양냉면,둠칫 둠칫,897,2026.02.21,1번째 방문,영수증,주말인데 운좋게 빨리 들어갔음 자극없는 슴슴한 맛 담엔 녹두빈대떡도 먹어봐야지,43,True
을밀대 평양냉면,큐캬큐캬캬,568,2026.02.21,1번째 방문,영수증,제 입에 적수없는 우리나라 평냉 원탑! 아직 겨울이지만 웨이팅있구요. 오늘따라 더 직원분들 찬바람이 쌩쌩이던데 그래도 역시 제 입맛에 최고라 또 가겠네욬ㅋㅋㅋㅋㅋㅋㅋㅋㅋㅋㅋㅋㅋㅋㅋㅋㅋㅋ 조금만 맛없어지면 배신할꺼에요!👻👻👻,124,True
을밀대 평양냉면,슬갱스터,1417,2026.02.13,6번째 방문,영수증,"을밀대 사랑해,,♥️♥️♥️",15,True
을밀대 평양냉면,SANG HONG,484,2026.02.07,2번째 방문,예약,지난 18년간 변함없는 을밀대 민자 맛있어요,24,True
을밀대 평양냉면,거위의꿈43,776,2026.02.03,8번째 방문,영수증,마포 을밀대! 여름엔 극악의 웨이팅.... 겨울 역시 웨이팅은 없어도 늦은밤 시간인데도 만석이네요^^ 맛있게 잘 먹었습니다.,69,True
을밀대 평양냉면,구68,846,2026.01.31,1번째 방문,주문,겨울엔 평냉ㅋㅋ 사진은 되게 노랗게 나왔는데 실제론 투명함! 온육수도 맛있었고 육향이 강해서 평냉이지만 호불호가 클 것 같진 않음. 김치는 전이나 수육 주문해야 나옴!,93,True
을밀대 평양냉면,잔다르38,2302,2026.01.30,1번째 방문,영수증,녹두전 맛집 ^^ 냉면에 면보다 육수가 맛있는…,26,True
을밀대 평양냉면,하겐다즈매니아,784,2026.01.29,6번째 방문,,"겨울이 좋은 이유,,하나 더 을밀대 웨이팅이 없다! 갑자기 며칠전부터 을밀대 생각나서 남편한테 말하다 왔어용ㅋㅋㅋ 거냉 양많이 시켜서 한그릇 뚝딱 하니 넘 좋아요 저는 여러집 가봐도 평냉중에 을밀대가 젤 입에 맞아요 녹두전도 같이 먹으면 김치도 같이 나와서 좋습니다 두쫀쿠 가격 생각하면 한그릇 1.6도 크게 비싼것 같지도 않아요ㅋㅋ 마포 동네사람 저녁에 산책하다가 을밀대 근처 지나는데 얼마나 깨끗하게 청소를 하시는지,,,잘되는집은 다 이유 있다고 생각합니다. 좌식 뜨끈한 바닥에 앉아서 먹으니 좋았어요 남편은 함냉을 더 좋아하는것 같지만 전 무조건 평냉ㅋㅋㅋ 오늘도 맛있게 먹고 갑니다!",330,True
을밀대 평양냉면,wetttttttsom,39,2026.01.25,1번째 방문,예약,국물이 너무 연해요 육향 진하게 난다는 분들 신기하네요;; 육향 진한 스타일은 절대 아닙니다. 면도 평범해요..,62,True
을밀대 평양냉면,ToBeH,55,2026.01.21,1번째 방문,영수증,"한파를 뚫고, 방문!!! 최근 다녀온 서X 보다는 육수 맛과 향이 강하고, 진X평XXX 보다는 약한 그 중간쯤의 맛! 특이하게 육수에 살얼음이 동동~ 여름에는 진짜 좋을거 같아요 ㅎㅎ 면발은 얼음 때문인지 더 쫄깃한데, 양은 앞서 다녀간 2군데보다 훨씬 많아 좋았어요~ 온육수도 맛과 향이 좋았고, 수육 주문은 소, 대 2가지만 있었는데, 반접시 같은 1,2인분 메뉴도 생기면 좋을거 같네요 ^^",221,True
을밀대 평양냉면,모꿈,,2026.01.15,3번째 방문,영수증,,0,True
을밀대 평양냉면,초초는먹보,1801,2026.01.12,1번째 방문,영수증,평양냉면 먹어본 중에 면이 가장 쫄깃하고 육향이 입안에 돌면서 감칠맛이 좋아요! 살얼음 띄운 차가운 냉면은 겨울에 먹어야 제맛!! 밖에서 보는것보다 매장내부가 깔끔하고 좌석도 많아요 주차는 가게 앞이 아니라 뒷쪽 주차장이 있었고 재방문 할것이냐 물어보면 yes!!! 다음엔 국밥도 먹어보고싶어요 ㅎㅎ,167,True
을밀대 평양냉면,꼬리리이,1053,2026.01.10,2번째 방문,영수증,"평냉 전문가인 제가 제일 좋아하는 곳입니다 토요일 8시 대기 없고요, 거냉 양많이로 먹었습니다 아직 소주가 3천원인건 경이롭네요",71,True
을밀대 평양냉면,해짱의 진짜 리뷰,1435,2026.01.10,4번째 방문,영수증,너무너무 추운데 주말이면 생각나는 평냉! 남편과 소주 한 병 넘기며 한그릇 뚝딱! 언제나 굿,51,True
을밀대 평양냉면,Ydo9083,,2026.01.04,1번째 방문,영수증,평냉,2,False
을밀대 평양냉면,디노빠샤,903,2026.01.03,1번째 방문,영수증,겨울에만 먹을 수 있는 을밀대!! (여름엔 경쟁이 너무 치열해뇨..),38,True
을밀대 평양냉면,lucia170,85,2026.01.01,1번째 방문,영수증,평양냉면에 입문하게 해주는 을밀대! 오랜만에 다녀왔는데 역시 맛있어요 :),41,True
을밀대 평양냉면,지 토,,2025.12.31,2번째 방문,예약,,0,True
을밀대 평양냉면,하우론,33,2025.12.29,1번째 방문,예약,우마이 우마이 우마이,11,True
을밀대 평양냉면,먹키비스트,669,2025.12.28,1번째 방문,영수증,평양냉면 전통의 강자 을밀대 방문~ 가게가 넓어서 그런가 웨이팅 없이 들어왔습니다. 물냉으로 먹었는데 양도 많고 감칠맛 제대로 우러난 육수인데 호불호 타진 않을 맛이라 이래서 유명한가 싶더군요. 초보자들 와도 맛나게 먹을만 한거같아요. 평냉 잘하는 집들은 다 각자 자신있는 분야가 있는거 같습니다 ㅋㅋ 저는 여기 국물이 너무 맛났네요. 육수 제대로 우린 느낌? 거냉 이런걸 가서 알아서 빠른 시일내 다른 맛 느끼러 가볼까합니다 ㅎㅎ 완전 맛나기 먹고갑니다~,255,True
을밀대 평양냉면,보타니엘,389,2025.12.28,1번째 방문,영수증,오! 생에 첫 평양냉면~! 기대 1도 안했는데 맛있었어요!!! 음식을 먹고 건강해지는 느낌! 해장으로도 완벽 : )이모님들 너무 친절하시고 녹두전도 맛있었어용,88,True
을밀대 평양냉면,5h6,1369,2025.12.27,2번째 방문,예약,음식이 전반적으로 깔끔 거냉양많이를 해야한다함!,26,True
을밀대 평양냉면,해짱의 진짜 리뷰,1435,2025.12.25,3번째 방문,영수증,크리스마스 데이트! 너무너무 추운데 생각만해도 싸늘한 평냉이 먹고싶어 을밀대로~ 남편과 낮술 한 잔 기울이며 둘만의 메리크리스마스를 즐김^^,78,True
을밀대 평양냉면,포토그래퍼맨,2410,2025.12.21,1번째 방문,영수증,생각보다 평범해요~,10,True
을밀대 평양냉면,메메38,87,2025.12.19,1번째 방문,예약,"전부터 와보고 싶었는데 주변에서 술약속이 있어 다음날 드디어 왔네요. 물냉면과 양지탕밥을 주문했고, 물냉면은 간이 좀 되어있어 슴슴보다는 강한 맛이었네요. 오히려 양지탕밥이 따뜻해서 그런지 간이 안 되어 있는 느낌이라 소금/후추 간을 좀 해서 먹으면 좋습니다. 면을 풀어보니 양도 많고 시원하고 깊은 감칠맛이 꽤나 디테일하게 나서 끝까지 물리지 않게 먹을 수 있었네요. 고기도 양이 적어서 그렇지 맛도리입니다. 반찬들 중에 김치도 정말 맛있었고 온육수를 기본으로 주시는데 속 풀기엔 제격입니다. 11시 전에 들어와서 기다림 없이 들어왔는데 나올 때 보니 줄이 꽤 길더군요. 다행이었습니다.. 맛있게 잘 먹었습니다~~!!:)",348,True
을밀대 평양냉면,온누리은행,41,2025.12.17,1번째 방문,예약,언제나의 을밀대… 가격비싸지만 맛있어요,21,True
을밀대 평양냉면,상휘짱,575,2025.12.14,1번째 방문,영수증,몇년만에 오는 지. 자리 앉자마자 1분만에 갖다줍니다.ㅎㅎ 엄청 맛있게 흡입하고 왔어요~,49,True
을밀대 평양냉면,횬잇,412,2025.12.07,3번째 방문,영수증,평양냉면 매니아가 꼽은 최애 평냉집이에요 씹을수록 메밀의 구수한 맛이 올라오고 진짜 진짜 맛있어요! 여기 메밀전도 진짜 맛있어요 ㅋㅋ 서울살면 진짜 자주 갈텐데 서울갈때마다 꼭 들러요 ㅋㅋ,105,True
을밀대 평양냉면,보람을 모아,196,2025.12.01,1번째 방문,영수증,모두 국내산임을 강조해서 더욱 마음이 가던 을밀대 배뚠뚠하게 국물까지 비우고 나왔습니다 평양냉면 치고는 간이 있어서 입문자도 좋을것같아요 면한입 국물 한입 ~굿,89,True
을밀대 평양냉면,Rhjok86,148,2025.11.29,1번째 방문,예약,평냉은 언제나 좋습니다. 친절하시네요,20,True
을밀대 평양냉면,Cadillac,1801,2025.11.22,1번째 방문,예약,"아주 오랫만. 토요일 19시 방문. 앞에 3-4팀 대기 중이었고 운좋게 약 10분 대기 후 입장. 주문하자마자 거의 10초만에 (?!) 냉면 입장. 냉면2+녹두전 45,000원",98,True
을밀대 평양냉면,k2r****,1273,2025.11.22,1번째 방문,예약,아들이 평냉에 빠져드는것같네요 같이와서 녹두전 하나에 소주 한병 했습니다 늘 같은 맛 남녀노소 다양한 계층에서 찾아주는 평냉의 메카입니다,76,True
을밀대 평양냉면,nontitle,273,2025.11.22,1번째 방문,영수증,변함없이 맛있어요. 여름이 지나서 웨이팅 없이 먹을 수 있어 행복합니다 💛,41,False
을밀대 평양냉면,나는뼈가싫어요,41,2025.11.22,1번째 방문,예약,"멀쩡히 잊고 살았다 싶었는데, 육수 한 입 들이키니 그 기척이 능청맞게 살아 있어 좀 우습다.",52,True
을밀대 평양냉면,키무칸,190,2025.11.22,3번째 방문,영수증,"을밀대본점 평양냉면은 본점 밖에 안다닙니다. 육수도 면발과 고기고명의 차이가 확연하거든요. 17년 전에 대흥에 살때는 자주 안갔는데, 지방으로 이사 간 뒤로는 틈만 나면 옵니다. 오늘은 처음 리뷰를 써보네요. 오랜 단골의 첫리뷰, 을밀대 만의 고유한 스타일이 더욱 깊어져 가는 듯 해서 좋습니다. 오래오래 장사 해주세요 ^^ 너무 맛있습니다. 길 맞은편(kt자리)에 청년주택이 크게 생기던데 청년들의 입맛을 사로잡아 더욱 유명해질 것으로 예상합니다.",251,True
을밀대 평양냉면,계란말이48,891,2025.11.16,12번째 방문,영수증,비싸지만 맛있는곳,9,True
을밀대 평양냉면,휘아는 먹어볼까,14,2025.11.16,1번째 방문,영수증,평냉 러버입니다 서울 대표 평냉집 중 한 곳이죠 자주 먹는 곳인데 가끔씩 맛이 차이가 있긴해요 어떤 날은 면 향이 강하고 어떤 날은 육수 맛이 조금 더 강하고 그래도 가장 즐겨먹는 곳이긴 합니다,108,True
을밀대 평양냉면,KUMASSFW,754,2025.11.15,1번째 방문,,"★★★★⭐︎ 온육수는 설렁탕 사골육수맛인데 한여름보다 한겨울에 마시면 더 좋을듯 싶었습니다. 물냉은 강남역 분점에서 살얼음 기본으로 처음 먹어보고 이번 본점에서 거냉은 처음이었는데, 물냉 면발은 굵고 텐션이 조금 있는편으로 메밀함유량이 좀 다를듯 싶네요. 물냉육수는 육향이 강하면서 염도는 있긴한데 미미한듯 하고, 고기고명도 여태먹은 평냉중에서도 퀄리티가 굉장히 좋았고 배 고명도 굉장히 싱싱하고 반찬으로 내어주신 김치도 또한 굉장히 맛깔스럽네요. 녹두전은 같바속초로 굉장히 고소하고 속에 고기도 굉장히 알차게 들어있어서 강추! 개인적으론 면발식감이 조금 아쉬웠는데 그 외에 모두 버릴곳이 없었던 을밀대 본점 첫방문 대만족! 🍜✨",352,True
을밀대 평양냉면,ok9039,8,2025.11.15,1번째 방문,영수증,음식맛있어서 가끔 오는데 일하시는분들 너무 불친절하시네요 맛난음식먹으면서 기분 나쁘면 아무리 맛나도 또 오고싶지않네요,65,True
을밀대 평양냉면,닭털핑크,359,2025.11.15,1번째 방문,영수증,"살얼음 육수는 맑고 투명하기보다는 약간 탁한 빛깔을 띠며, 간이 제법 있고 육향이 진하며 깊은 감칠맛. 면은 다소 굵고 댕글탱글한 식감에 담백한 편. 같이 제공되는 따뜻하고 깊고 구수한 사골육수를 사이사이 먹는 것이 정석. 수육은 특이하게 차돌양지 부위로 얇게 썰어 나와서, 촉촉하고 부들부들한 식감과 본연의 육향에 담백함. 파채와 함께 겨자간장소스에 찍어 먹으면 풍미가 드라마틱하게 올라감.",219,True
