식당 이름,계정 ID,계정의 리뷰 수,방문 날짜,방문 횟수,인증 수단,리뷰 내용,리뷰 글자 수,리뷰 내 사진 유무
일등식당,망원동대박부동산,3685,2026.04.30,2번째 방문,영수증,좋아요,3,True
일등식당,예거슈니첼,6925,2026.04.26,10번째 방문,영수증,푸짐하고 자극적인 느낌이 없어서 좋아요,21,True
일등식당,굿끼니는제때먹어야지,671,2026.04.21,1번째 방문,영수증,굿,1,True
일등식당,미즈팝,320,2026.04.18,1번째 방문,영수증,요즘 스타일은 아니고 그냥 깔끔한 맛이에요.,24,False
일등식당,용맹톨,1368,2026.04.15,1번째 방문,영수증,좋아요,3,False
일등식당,실버스톤과루피맘,866,2026.04.12,2번째 방문,영수증,주말 저녁에 아내와 함께 마포구 망원동의 전설적인 맛집 일등식당에 다녀왔습니다. 이곳은 워낙 유명한 곳이라 기대를 많이 했는데 매장에 들어서자마자 느껴지는 정겨운 분위기와 맛있는 냄새 덕분에 식사 전부터 기분이 좋았습니다. ​우리는 뼈해장국을 주문했는데 뚝배기 가득 담겨 나온 고기의 양에 깜짝 놀랐습니다. 뼈에 붙은 살코기가 정말 부드러워서 젓가락만 대도 쏙 빠질 정도였고 국물은 자극적이지 않으면서도 깊고 구수한 맛이 일품이었습니다. 아내도 잡내 없이 깔끔한 맛이라며 인생 해장국이라고 칭찬을 아끼지 않더군요. 곁들여 먹는 김치와 깍두기도 적당히 잘 익어서 해장국과 환상의 궁합을 자랑했습니다. ​망원동 인근에서 든든한 한 끼 식사나 제대로 된 뼈해장국을 찾으신다면 일등식당을 추천합니다.,387,True
일등식당,코리안비버,1407,2026.04.12,1번째 방문,영수증,"요즘에도 웨이팅이 있는지 모르겠는제 점심 지나고 2시쯤 애매한 시간에 방문했더니 웨이팅 없이 먹을 수 있었어요. 메뉴는 단일 메뉴 뼈해장국 하나! 와이프는 일반, 저는 특으로 먹었는데 가격이 매우 착합니다. 8처넌, 1만1천원ㅎㅎ 가장 중요한 맛!은 우선 일반 감자탕 처럼 자극적인 스타일이 아니라 옛날 할머니가 끓여준 시래기국인데 진한 돼지 육수로 끓인거 같아요. 사진으로는 맹맹해보이지만 간이 딱 좋습니다! 그리고 여기는 무엇보다 뼈다귀 고기가 매우 부드러워서 좋았어요👍👍 다 먹을 때 쯤 또간집 풍자님이 알려준 후추팍팍팍 쳐서 먹으면 또 다른 맛이니 도전해보세요 :)",320,True
일등식당,Gratia78,1961,2026.04.04,1번째 방문,영수증,최근 먹은 뼈해장국 중에 가장 맛있는 맛이에요. 끝까지 깔끔 담백합니다.,40,True
일등식당,수원시장,803,2026.04.04,2번째 방문,영수증,,0,True
일등식당,QuartzBae,3,2026.04.02,1번째 방문,예약,"너무너무 맛있어요 고기가 부드럽고, 양도 많아요",26,False
일등식당,주대리의 은밀한 사생활,24,2026.03.31,1번째 방문,예약,"망원동 해장국 1티어 일등식당 이제는 너무 유명해져버려서 웨이팅을 해야하지만 그래도 점심틈새시장을 노리면 웨이팅없이 식사가능 여전히 담백하고 깊은국물에 잡내없는고기, 우거지가 일품 후회없는 한끼",108,True
일등식당,It from bit,432,2026.03.28,3번째 방문,영수증,"한결 같다. 이 가격에, 이 맛에, 이 양이면 전국구지. 한창 시간엔 합석할 수도 있음. 그럼에도 불구하고 계속 찾게 되는 곳. 잘 먹었습니다~ (따로 비치된 소스는 꼭 가져다 찍어드시길)",105,True
일등식당,상도라이아짐,3047,2026.03.27,2번째 방문,예약,맛있어요,4,False
일등식당,콜야,255,2026.03.26,1번째 방문,예약,와 그냥 너무 맛있음 동네 사람들이 냄비가지고 계속 오는 이유도 알겠음 나도 그 동네 살고싶어짐 이 뼈해장국땜에,62,True
일등식당,먹녀사,707,2026.03.21,1번째 방문,예약,오랜만에 일등식당 방문했어요! 고기소스 있어 좋았구요~~ 옛날맛에 비해 많이 담백해졌어요 옛날 일등식당 국물맛이 좀 사라진…? 그래도 맛나요! 🤩,81,False
일등식당,kkr****,886,2026.03.18,2번째 방문,영수증,최애 뼈해장국 가게,10,False
일등식당,망원동대박부동산,3685,2026.03.18,1번째 방문,영수증,망원동 최고의 맛집,10,True
일등식당,vhohgg8178,323,2026.03.13,1번째 방문,영수증,고기는 최고 부드럽다 국물은보통 반찬은 맛없다,25,True
일등식당,이으리,659,2026.03.08,1번째 방문,예약,혼밥하기 좋고 맛도 좋아요,14,True
일등식당,혼자밥,186,2026.03.07,4번째 방문,예약,오랜만에 방문한 일등식당에서 뼈해장국을 먹었고 야들야들 잘 분리되는 푹 고인 뼈들을 분리하면서 슴슴한듯 감칠맛이 넘쳐나는 국물을 조금씩 떠먹다가 뼈를 다 바르고 남은 살코기들을 공기밥에 밥말아 먹으면 완성됩니다. 밑반찬 아삭아삭 깍두기와 살짝익은듯한 김치도 양념맛이 좋아서 남김없이 다 먹었습니다.,166,True
일등식당,디노빠샤,903,2026.03.06,1번째 방문,영수증,재재재방문입니다... 웨이팅 열기가 좀 사그라져서 다행입니다.하하 암때나 편하게와서 먹을수있음 좋겠어요.. 유투버들 그만오세요....ㅎㅎㅎㅎ,78,True
일등식당,cro****,2255,2026.03.04,4번째 방문,영수증,맛은 굿...사람은 드글드글...ㅎㅎㅎㅎ...여전히 맛나요...,35,True
일등식당,김너지,310,2026.02.28,2번째 방문,영수증,늘 사람 많은 곳. 고기가 부드러워요. 일반은 양 많으신 분껜 부족할 수도 있어요. 포장은 좀 더 양이 많더라고요. 술도 아직까진 4천 원입니다 ✌️,83,True
일등식당,예거슈니첼,6925,2026.02.25,9번째 방문,영수증,맛있어요,4,True
일등식당,e과장,141,2026.02.22,1번째 방문,예약,"망원한강공원에서 런닝하고 아침식사로 먹기 좋습니다. 깔끔한 국물에 부드럽고 잡내없는 살코기가 넉넉합니다. 다만 밥은 다소 적게 나오고, 김치도 아쉽긴한데 뼈해장국 자체가 너무 좋아서 추천해요.",107,True
일등식당,It from bit,432,2026.02.21,2번째 방문,영수증,"사진 속 해장국은 특사이즈다. 많다. 기본 8000원, 특 11000원이다. 맛과 양에 비하면 요즘 물가에 저렴한 편이다. 소스가 테이블 마다 구비되어 있진 않다. 꼭 가져다 고기 찍어먹으시라. 확실히 다르다. 이른 시간에도 매장은 거의 만원이다. 사람 많은덴 그럴만한 이유가 있다. 잘 먹고 갑니다~",168,True
일등식당,지구인4154,2523,2026.02.21,5번째 방문,영수증,,0,True
일등식당,깜깜이50,1726,2026.02.15,2번째 방문,영수증,굿,1,False
일등식당,이땜땜이,1197,2026.02.08,1번째 방문,영수증,"해장국 8,000원!! 진짜 너무 맛있었어요. 고기도 부드럽고 국물도 맑고!!",43,True
일등식당,zuckerr,880,2026.02.07,1번째 방문,영수증,"유명하다고 해서 포장했는데, 양이 많아요.",23,True
일등식당,nks****,54,2026.02.06,1번째 방문,영수증,전부터 궁금했지만 가까이 산다는 이유로 멀리했던… 평일 늦은 점심 약간의 웨이팅 후 입장 ! 원래 좀 뜨겁지 않게 나오나 싶을 정도의 온도감이었는데 후에 다른 후기들을 보니 그건 아닌거 같더라구요.. 먹으면서 시래기도 맛있고 고기도 너무 부드러워서 다음엔 포장해서 집에서 뜨겁게 끓여먹자고 말할 정도로 맛은 기억에 남습니다. 후추를 좋아하지만 여기는 안넣는게 개인적으론 더 좋았어요🤓 잘먹었습니다🔥,222,True
일등식당,djs****,187,2026.02.03,1번째 방문,영수증,와정말 가격착하네요 푸짐하기도 하고요,20,True
일등식당,김설탕58,22,2026.02.03,1번째 방문,예약,여긴진짜 너무 맛있음,11,False
일등식당,sun****,1598,2026.02.01,3번째 방문,영수증,g,1,False
일등식당,씨지에스7,1938,2026.02.01,3번째 방문,영수증,g,1,False
일등식당,피러87,82,2026.01.31,1번째 방문,영수증,항상 아침일찍 포장해오는데 오픈시간이 늦춰진걸 모르고 갔다가 기다리는데 사장님이 고맙게도 오픈전인데 십여분일찍 포장해주셨네요^ 양도 많고 맛도좋아요. 😀,85,False
일등식당,아이미 IME,3629,2026.01.25,1번째 방문,영수증,친절하세요 가격도 착하고 양도적당해서 배부르게 먹었습니다 포장시 용기값있어요 냄비 가져오심 할인 쌉가능 😊,59,True
일등식당,skyLOVE,3582,2026.01.24,7번째 방문,영수증,역시 해장국은 일등식당 👍 살도 많고 부드럽고 뼈에서 쏙~분리도 잘 되요. 국물도 깔끔하고 시래기도 맛있어요. 오랜만에 공기밥 추가해서 순삭,78,True
일등식당,VIP44,1658,2026.01.23,2번째 방문,영수증,,0,True
일등식당,VIP44,1658,2026.01.18,1번째 방문,영수증,,0,True
일등식당,뀨81,820,2026.01.11,1번째 방문,영수증,가격도 착하고 맛나요♡,12,True
일등식당,하프문9,90,2026.01.11,1번째 방문,영수증,망원동의 귀한 맛집 일등식당 성시경님도 다녀가시고 자꾸 유명해지는게 안타까울 따름 ㅠㅠ 개인적으로 절반정도 먹은 후에 나머지 반은 살을 다 발라내고 후추 왕창 뿌려서 푹푹 퍼먹으면 최고 맛있어요,108,False
일등식당,냠냠쩝쩝1,174,2026.01.09,1번째 방문,영수증,"오랜만에 방문한 추억의 뼈다귀 해장국 전문점 일등식당!! 분위기, 맛, 가성비, 친절함까지 역시 일등입니다!!",61,True
일등식당,진지한내돈내산리뷰,138,2026.01.04,1번째 방문,예약,공영주차장도 자리가 없어서 자차보다는 대중교통을 추천해요 점심시간을 이용했지만 대기줄이 길었고 추운날씨에 딱 어울리는 음식이에요 김치도 맛있고 소스도 달짝지근해서 고기랑 잘 어울려요 담백한 감자탕 좋아하시면 입맛에 잘 맞을 것 같아요,130,True
일등식당,지금yr,30,2026.01.02,1번째 방문,영수증,왜??????왜 맛집이라는거죠?????고기는 잡내에 국물은 맹탕인데 시원한맛도 구수한 맛도 없는데 중간만도 못한 집인데....8천원도 아깝네요,79,False
일등식당,항상새로운나,1272,2026.01.01,1번째 방문,영수증,집에서 먹으려고 냄비 들고 출동 해서 2인분 포장해왔는데 양도 많고 개인적으로 좋아하는 국물이라서 또 방문해서는 매장에서 먹어보고 싶네요,76,True
일등식당,예거슈니첼,6925,2025.11.07,8번째 방문,영수증,자극적이지 않고 구수하고 담백한 느낌이라 좋아요,26,True
일등식당,한냠냠,2738,2025.11.05,13번째 방문,영수증,일등식당은 가성비며 맑은 국물맛 일등이요!! 요즘 날씨에 딱이에요,36,True
일등식당,jindorim,2089,2025.10.31,1번째 방문,영수증,맛있어요,4,True
일등식당,라떼시럽,2050,2025.10.31,1번째 방문,영수증,굿,1,True
일등식당,박정순 무궁화,6,2025.10.31,1번째 방문,영수증,맛나요,3,False
일등식당,효해gina,74,2025.10.25,1번째 방문,영수증,#망원 해장국,7,True
일등식당,guswn4285,2106,2025.10.18,1번째 방문,영수증,굿,1,True
일등식당,마이벗,1073,2025.10.15,4번째 방문,영수증,포장해오면 양이 많아서 2인분이 3인분쯤 되는것 같아요~ 온가족이 한끼 맛있게 먹을 수 있습니다 집에서 다시 15분이상 끓인 후에 먹어요 오늘도 맛있게 먹었어요 ~,91,True
일등식당,아이스초코29,1351,2025.10.15,4번째 방문,영수증,가성비 해장국집 포장해서 먹으면 양이 더 많아요(우거지 추가는 안되서 아쉽),42,True
일등식당,시켜줘마포구보안관,102,2025.10.11,1번째 방문,영수증,"[마포구 보안관 출동 일지] 사건 번호: 2025-10-11 / Case #F-017 사건 개요: 해장 아닌 구원 현장 기록: 메뉴는 해장국 하나, 깍두기에 소주 한 잔 마시면 해장국 바로 등장, 국물 한 술 뜨고 안주 나왔으니 짠 해야함, 뼈에 붙은 살 발라서 우거지랑 먹다보면 안도감이 밀려옴, 일등 해장국은 망원의 복지 증거물: 해장국(8천원으로 이 정도면 긴급구조예산 집행 수준) 특이사항: 소주 맥주 모두 4천원 수사 결과: 요즘 물가 미쳤지만 일등식당은 아직 제정신",266,True
일등식당,rla****,984,2025.10.10,1번째 방문,영수증,고기도 부드럽고 우거지 정말 맛있고 양도 넉넉해요. 여사님들 모두 친절하시고 매일 가고 싶네요. 정말 일등식당 답습니다!,67,True
일등식당,묘묘에요,1025,2025.10.10,1번째 방문,예약,8천원에 양도 푸짐하고 맛있습니다 깍두기도 괜찮고요 배추김치는 중국산인가요? 사장님으로 보이시는분은 남자분 불친절은 아닌데 많이 피곤하신지 입을 아예 안여시는듯.,90,True
일등식당,우이리1,1674,2025.10.10,1번째 방문,영수증,,0,True
일등식당,minaleeu,527,2025.10.09,3번째 방문,영수증,일등식당 맛나요,8,True
일등식당,NC라이더,1466,2025.10.01,1번째 방문,영수증,,0,True
일등식당,마포지키미1,880,2025.09.27,1번째 방문,영수증,동네에 오래 살았는데 처음 가 봤어요~ 성시경님이 와서 나름 주말에는 줄을 서서 먹더라구요~ 생각보다는 잡내나는거 싫어하시는분은 패스 하시고요~ 양 많고 술 좋아하시는분들 좋아할것 같아요~ 양이 어마어마~ 합니다 그러나 제 입맛에는 감자탕이 더 좋아요~ 거기 보다 대각선에 보이는 고ㅇ 감자탕집이 더 맛있습니다 사람마다 맛이 다 다르지만 전 그래요~ 거기에 파는 음식 대부분 다 괜찮아요~ 알바 아주머니 주문 실수하는 경우가 종종 있어서 주문만 잘 하면 돼요~~; 주문 다시 확인 하세요^^,274,True
일등식당,위니1209,218,2025.09.21,1번째 방문,영수증,주말이라 그런지 10분정도 웨이팅 했습니다 국물이 깔끔하고 맛있어요,37,True
일등식당,Endngs,340,2025.09.20,2번째 방문,영수증,뼈해장국 명품 맛집 30년전통 망원동 일등식당 여긴 정말 최고에요,36,True
일등식당,예거슈니첼,6925,2025.09.16,7번째 방문,영수증,해장국(특) 푸짐하고 야들야들한 고기도 많이 있어서 좋아요,32,True
일등식당,yrleee,267,2025.09.13,3번째 방문,영수증,한 달에 두번은 사다가 먹나봐요. 3인분 사면 가족이 실컷 먹어요. 용기 가져가서 음식 받아다 집에 와서 15분 끓여 먹으면 되구요.,74,False
일등식당,DirtySponge,355,2025.08.31,1번째 방문,예약,입에서 살~살~ 녹아요 ”뼈와 살을 분리해 주마“를 여기서 사용하게 될 줄 몰랐네요 우거지도 살살 녹습니다! 👽👍,63,True
일등식당,이매지1,1480,2025.08.19,1번째 방문,영수증,특은 안 된다고 하셔서 보통을 주문했는데 살코기가 실해서 든든하네요. 국물도 다른 뼈해장국집보다 덜 텁텁하고 깔끔했어요. 8천원이란 가격을 생각하면 가성비 너무 좋은 한 끼! 포장하는 경우에는 보통 가격에 특 정도의 양을 주신다는데 포장 손님도 많아서인지 미리 몇 개 포장을 해두셨더라고요. 근데 포장은 용기값 1천원이라고 하니 냄비나 그릇 가져가도 좋을 듯합니다!,204,True
일등식당,상큼햇살,16,2025.08.10,1번째 방문,예약,특을시켯음에도 잘게다져논 김치를 한스푼내와서 다먹고 달라하니 주기싫은 티를 내고 특은 고기많느나....다시는 가기 싫다 서빙하는아주머니가 먹는중에 눈치를 너무많이주심,92,True
일등식당,빈센트241,810,2025.08.07,1번째 방문,영수증,국물깔끔하고 고기 부드럽고 좋습니다.,20,True
일등식당,뚜뚜루81년식,1327,2025.08.05,4번째 방문,영수증,해장국 1등식당 특양이 미세하게 줄어든 기분?인데 맛있게 잘먹었어요,37,True
일등식당,실버스톤과루피맘,866,2025.08.03,1번째 방문,영수증,제가 먹어본 뼈해장국중 1등 국물맛이 잘 베어있는 아주 부드러운 고기 국물맛은 강하지 않지만 감칠맛이 최고 거기에 우거지 듬뿍 가성비 또한 최고 일반 8000원 특 11000원,98,True
일등식당,보리보리47,681,2025.08.02,1번째 방문,영수증,뼈와 시래기다 푹 삶아져서 어린이도 먹기좋습니다. 주차할 곳이 없어서 망원시장에 하고 왔어요. 매장이 조금 더웠습니다. 잘먹고 포장도 해왔어요. 장사하시는 어르신들 건강하세요.,98,True
일등식당,yrleee,267,2025.07.26,2번째 방문,영수증,주말이면 아침에 통을 들고 종종 사러 갑니다. 아침부터 한강에서 운동하고 식사하는 분들 많아요.,53,False
일등식당,예거슈니첼,6925,2025.07.23,6번째 방문,영수증,여기 뼈해장국 담백하고 맛있어요,17,True
일등식당,연꽃하,928,2025.07.09,4번째 방문,영수증,배가 많이 고팠는데 정말 맛있고 배부르게 잘 먹었습니다ㅎ,31,True
일등식당,Hyukee2,1274,2025.07.01,1번째 방문,영수증,왜 일등식당인지 알겠네요 국물 너무 담백하고 개운해요! 살코기는 너무 부드럽고 잘 발라져서 먹기도 좋아요!,59,True
일등식당,링을,104,2025.06.29,1번째 방문,영수증,남친 최애 감자탕집! 자극적인거 좋아하는 저는 쏘쏘!,29,False
일등식당,87홍삼,551,2025.06.28,1번째 방문,영수증,생각보다 평범 국밥집은 김치가 생명인데 김치도 아쉽네요,30,True
일등식당,둥둥찌둥,93,2025.06.28,1번째 방문,영수증,맑은 국물인데 그렇지 않은 깊은맛 ..! 아침부터 소주를 부르는 맛입니다. 김치도 맛있지만 깍두기가 좀 더 입에 맞았어요. 팔팔 끓어서 나오면 좋겠단 생각이 들어요. 금방 식어요 .. 오리지날 국물맛을 즐긴다음에 반정도 먹었을때 고춧가루랑 후추 넣어서 먹으니 또 다른 맛이에요 !! 고춧가루가 좀 매우니 적당히 맛 보면서 넣으세요 ! 후추맛 안좋아하는데 고춧가루+후추조합이 더 술을 부르는 자극적인 맛입니다. 웨이팅은 없었어요. 먹텐 짱 ㅠㅠ,247,True
일등식당,또리3671,3182,2025.06.28,2번째 방문,영수증,망원동뼈해장국맛집! 깔끔하고 된장국 느낌나는 육수에 우거지와 부드러운 뼈도 듬뿍 들어감 보통해장국이 단돈 팔천원인데 양 많고 특은 만얼마인데 양 차이가 꽤나요 반주하기에도 좋은곳~,100,True
일등식당,먹뷰실록,264,2025.06.25,2번째 방문,영수증,"간단리뷰 - 포장은 1인분 8000원에 특해장국 양으로 나오고, 대신 밥 반찬 소스는 없어요 / 포장용기 비용 1000원 추가 되요, 매장에 포장 손님 많아서 여러개 포장 되어 있어요 / 2인분 포장하니 포장용기 큰거에 가득 들어 있고, 집에서 큰 궁중팬에 넣어보니 가득 이네요~ / 뼈고기 개수 세어보니 8개 덩어리 들어 있네요. 가볍게 2개씩 먹으면 4번 정도 먹을 수는 있는데, 그래도 넉넉히 먹으려면 4개씩 2번 먹는게 나은듯 했어요.",247,True
일등식당,은무67,37,2025.06.22,1번째 방문,영수증,성시경 맛집이라서 오픈런 하러갔는데 이미 사람들이 한가득 그래도 운좋게 바로 앉았습니다 다른집과 다르게 조미료맛이 덜 나도 자극적이지 않아 약간 슴슴해서 맛있었어요 술안주로 딱입니다,101,True
일등식당,JK241,398,2025.06.21,1번째 방문,예약,고기 우거지 부들부들 최고네요. 국물은 시원 하고 인생 뼈다귀국,35,True
일등식당,일일다식,245,2025.06.19,1번째 방문,영수증,맑고 개운한 등뼈해장국이에요 자극없어서 아이도 잘 먹을 수 있는 스타일이구요 매운거 좋아하는 편인데 준비된 고춧가루 뿌려서 먹으니 칼칼하더라구요 잡내 전혀 없이 고기도 부드럽고 양도 넉넉해요! 8000원의 행복❤️,119,True
일등식당,로드스트,354,2025.06.17,1번째 방문,영수증,"시간이 쌓여 깊어진 국물, 망원동 골목 끝에서 만난 40년 전통의 뼈해장국집, 일등식당. 아침부터 저녁까지 끊이지 않는 손님 행렬이 말해주듯, 이곳은 단순한 해장국집이 아니다. 뽀얗게 우러난 국물은 한 숟갈만 떠도 속이 풀리는 듯 시원하고 묵직하다. 잘 삶아진 돼지 등뼈는 살코기가 부드럽게 발라지며, 양도 넉넉해 든든함까지 더해준다. 겉보기엔 소박한 공간이지만, 시간이 만들어낸 노련함과 정직함이 맛으로 느껴지는 집이다. 맵지도 짜지도 않지만, 뒷맛이 깊게 남아 다시 찾게 되는 그런 국물. 이른 아침 시장 상인들이, 늦은 밤 술 한잔 뒤 직장인들이 늘 같은 자리에서 위로받는 그런 식당. 일등식당, 이름값을 한다.",345,True
일등식당,디자인쟁이포에버,954,2025.06.14,4번째 방문,영수증,"주말동안 우리세식구 먹을 뼈해장국이 단돈 ₩16,000 이게 말이 되냐구… 게다가 맛은 자타공인 국내최고 일등 암튼 감사합니다. 오래오래 번창하셔요~~",84,True
일등식당,인어공주951,220,2025.06.13,1번째 방문,영수증,"동네 주민이여서 오래전부터 혼자 자주 왔습니다 그런데 요즘 성시경(먹을텐데) 때문인지 손님이 많아지기 시작(원래도 많았지만 줄을 서진않았거든요)하면서 기본 서비스가 참 맘에 안드네요 혼자오는 손님 무작정 4인테이블에 합석시키려고 하고 (별도에 양해없이)그래서 빈정상한 손님 가든 말든 신경 안쓰고(물론 사장님아니고 종업원 아줌마입니다) 이렇게 장사 하시면 결국 기존 손님들 다시 안올듯,).. 그리고 뼈다귀 세개중 한개에서 예전에 없던 이상한 맛도 나고(나머지 두갠 기존 맛 그대로) 여튼 그동안 쌓아온 입소문 지금 신경 쓰셔야 할듯.. 전 다신 안갑니다",310,False
일등식당,예거슈니첼,6925,2025.06.11,5번째 방문,영수증,개인적으로 이집만한 뼈해장국 아직 못본거 같아요,26,True
일등식당,누디19,39,2025.06.08,1번째 방문,영수증,"특1개, 보통+우거지추가 했는데, 보통2개 주시면서 다른테이블도 아니라해서 그냥 우리 먹으라고 하심; 그러면서 우거지추가한거 별도로 담아서 주신다고ㅎㅎㅎㅎㅎㅎ 그냥 내가 생각하는 해장국 맛이에요!! 다음은ㅜ 굳이 안먹어도 될 것 같아요",131,True
일등식당,김너지,310,2025.06.06,1번째 방문,영수증,매일 사람들이 줄서 기다리는 곳. 오후 두 시쯤 갔더니 앞에 한 팀 있었어요. 거의 저희 테이블에서 재료 소진되어 포장만 가능했어요. 특 먹고 싶었는데 재료 없어서 일반으로. 고기 너무 부드럽고 맛 좋은데 확실히 양이 적었어요. 반찬은 김치와 깍두기인데 정갈하고 맛 좋아요. 담엔 특으로 도전 🍚,165,True
일등식당,빵식빵식빵,275,2025.06.04,1번째 방문,영수증,"가격이 저렴하고 양이 푸짐해요. 가성비 좋아요. 국물은 다른 해장국들과 비교해 맑은 편이지만 그렇다고 맛이 담백하고 깔끔하기보단 고기도, 국물도 감칠맛 폭탄입니다. 이 부분이 상당히 호불호가 갈릴 것 같아요. 우거지는 질기지도, 너무 무르지도 않고 딱 좋아요.",145,True
일등식당,dkfk7353,1181,2025.06.01,1번째 방문,,국물 깔끔하고 맛있어요,12,True
일등식당,닥피생,499,2025.06.01,1번째 방문,영수증,"깔끔한 국물이 인상적인 망원동 일등식당 일요일 점심 1시에 여자친구와 방문하였습니다. 도착했을 때 웨이팅이 있었고 약 15분 정도 기다려 입장하였는데, 2시까지도 계속 웨이팅이 있었습니다. 너무 배가 고파서 해장국 특사이즈를 주문. 큰 등뼈가 석탑처럼 3덩이 올라간 비쥬얼이 인상적이었으며, 살코기가 많이 붙어 있어 배부르게 먹을 수 있었습니다. 국물은 일반적인 뼈해장국보다 맑고 가벼워 뒷맛이 깔끔하였습니다. 우리 커플이 좋아하는 후암동의 일미집 감자탕과 비슷한 느낌이었습니다. 최근 성시경의 먹을텐데에 출연 이후 손님이 더 많아졌다고 하는데, 식사 위주 손님이 많아 다행히도 회전율은 좋아 많이 기다리지 않아도 되네요. 중간 중간 동네 포장 손님이 많은 것을 보니 맛집 신뢰도가 쭉올라가네요 ㅎㅎ",391,True
일등식당,컨셉19,79,2025.05.29,1번째 방문,영수증,맛있는데 가성비도 좋아요! 너무 만족해서 부모님도 맛보시라고 포장도 했어요,41,True
일등식당,쎄라비1978,3007,2025.05.27,1번째 방문,영수증,"성시경 먹을텐데 여파로 갔음. 자극적이지 않은 엄마의 뼈해장국 같은데, 셀럽이 먹은 것과 고기는 다른 것 같네? 휴우...",68,True
