식당 이름,계정 ID,계정의 리뷰 수,방문 날짜,방문 횟수,인증 수단,리뷰 내용,리뷰 글자 수,리뷰 내 사진 유무
육산장 홍대본점,dls****,3,2026.04.30,1번째 방문,영수증,분위기가 좋아요!!! 대기없이 야장쪽으로 입장했어요 주말이나 금요일 저녁에 오면 대기해야 할 수도 있을거같아요!! 고기 정말 맛있고 직원분들 너무 친절해서 기분좋은 식사 했습니다 매장도 크고 분위기도 좋아서 친구들이랑 기분좋게 식사했습니다🤤 최고최고!!!,142,True
육산장 홍대본점,고은1199,44,2026.04.30,1번째 방문,영수증,우대갈비ㅜㅜㅜㅜ너무맛잇어용 자주올게요 짱짱!!,25,True
육산장 홍대본점,eun****,19,2026.04.29,1번째 방문,영수증,친구들과 식사하러 왔습니다~ 정말 맛있어요 추천합니다~~^^,33,True
육산장 홍대본점,월요일23,27,2026.04.29,1번째 방문,영수증,홍대에서 야장느낌 나는 삼겹살집 찾아서 방문했는데 깔끔하고 고기도 두껍고 좋아요❤️ 번창하세요~,53,True
육산장 홍대본점,하히잉,21,2026.04.29,1번째 방문,영수증,맛있어용 야외테이블 있어서 왔어요 굿!!,22,True
육산장 홍대본점,hsa****,23,2026.04.28,1번째 방문,영수증,가게 분위기도 좋고 구성이 알차서 좋네요 셀프바도 좋습니다!,33,True
육산장 홍대본점,raN12,5,2026.04.28,1번째 방문,영수증,홍대 쪽 삼겹살집 찾아보다가 리뷰가 넘 좋아서 방문했어요! 고기 맛도 좋고 가게 분위기가 좋아서 잘 먹고 갑니다ㅎㅎ,64,True
육산장 홍대본점,sjsj6677,12,2026.04.28,1번째 방문,영수증,고기 초벌해서 나와서 깔끔하고 매장도 청결해요 !!고기두 맛있고 조아용🫶🏻,41,True
육산장 홍대본점,밍시오,31,2026.04.28,1번째 방문,영수증,나중에 또 올게용 좋아요,13,True
육산장 홍대본점,슈크림보고수요일좋아,32,2026.04.28,1번째 방문,영수증,셀프바도 작지 않고 양도많아요 종류다양해용 밥 위에 햄 올려주는것도 좋고 소스도 많구 재방문의사 10000프로,61,True
육산장 홍대본점,120713,16,2026.04.27,1번째 방문,영수증,맛있어요!! 친구들이랑 조은 시감 보냇어요,23,True
육산장 홍대본점,Dddddddddddddddddddd38,11,2026.04.27,1번째 방문,영수증,고기 퀄리티 최고👍 육즙 가득하고 너무 부드러워요!!!! 직원분도 친절하시고 전체적으로 만족스러운 식사였습니다ㅎㅎ 재방문 의사 100!!!!,78,True
육산장 홍대본점,YY248,8,2026.04.27,1번째 방문,영수증,고기도 두툼하고 너무 맛있어요🥹👍👍 홍대 삼겹살 맛집이에요 또 방문하고 싶습니다&gt;&lt;&gt;&lt;!!,62,True
육산장 홍대본점,ilu****,13,2026.04.27,1번째 방문,영수증,비주얼 미침 그냥 개맛있었보임 맛있기도함,22,True
육산장 홍대본점,수규규규,10,2026.04.27,1번째 방문,영수증,너무맛있고 매장 분위기도 너무 좋아요!,21,True
육산장 홍대본점,수빈586,28,2026.04.27,1번째 방문,영수증,분위기가 미쳤어용!!! 캠핑 야장 분위기 뿜뿜이고 고기도 너무 맛있어용 데이트나 모임하기 모듀 좋아용💖,57,True
육산장 홍대본점,VpanoramaV,886,2026.04.26,1번째 방문,영수증,홍대 올리브영 팝업 왔다가 저녁 먹을 거 뭐 있나 하다 방문했어요! 외부/내부 선택할 수 있었는데 외부는 대기도 있기도 하고 개인적으로는 내부를 좋아하는 편이라ㅎㅎ 바로 입장 소스도 다양하구 고기도 맛있습니다! 특히 항정살 러버로서 굿굿 소스 중에 특제소스 있는데 이거에 빵가루 찍으면 완전 돈까스(?) 익숙한 맛인데 저는 이 맛이 좋아서 너무 잘 먹었습니다~ 다음엔 외부도 한 번 도전해 보고 싶네용,224,True
육산장 홍대본점,나는리아,41,2026.04.26,1번째 방문,영수증,글램핑 분위기에 고기도 맛있어서 좋아요~~,23,True
육산장 홍대본점,진덩덩이,5,2026.04.26,1번째 방문,영수증,날씨 좋은날에 야장하기 너무 좋아요 고기도 맛있고 곁들임 메뉴들도 알차서 잘 먹었습니다!ㅎ,50,True
육산장 홍대본점,blu****,2,2026.04.25,1번째 방문,영수증,고기 초벌해주셔서 넘 편하고 맛있어뇨!!! 기본반찬도 맛있습니다.,36,True
육산장 홍대본점,tae****,15,2026.04.25,1번째 방문,영수증,진짜 맛있어요! 고기도 맛있고 진짜 오랜만에 고기 먹는데 기억이 남을 정도로 좋아요! 다음에 또 올게요!,58,True
육산장 홍대본점,xgr****,2,2026.04.25,1번째 방문,영수증,매장 느낌이 정말 캠핑 온 것 같아서 분위기가 좋아요! 요즘같이 날씨좋을때 오기 좋은 것 같아용,53,True
육산장 홍대본점,잘먹겠습니당,50,2026.04.25,1번째 방문,영수증,분위기도 좋고 고기 질도 좋아요 최고!!,22,True
육산장 홍대본점,cho****,28,2026.04.24,1번째 방문,영수증,너무 맛있고 분위기가 좋아요!,16,True
육산장 홍대본점,yjk****,35,2026.04.24,1번째 방문,영수증,고기 질도 좋고 세트메뉴가 있어서 좋아요~,23,True
육산장 홍대본점,사자3594,57,2026.04.24,1번째 방문,영수증,육회맛있어요 생각보다괜찮아서 추천해요! 인테리어느낌이 넘 좋아요ㅎㅎ,37,False
육산장 홍대본점,예지808,11,2026.04.24,1번째 방문,영수증,대기 별로 안하고 들어왔어요!! 매장 실내 분위기 엄청 좋고 음식도 빨리나오고 고기 질도 좋습니다♥️♥️♥️하이볼도 맛있습니당,70,True
육산장 홍대본점,allright119,23,2026.04.23,1번째 방문,영수증,홍대 한복판에서 야외에서 여유를 즐기며 맛있게 먹었습니다!!,33,True
육산장 홍대본점,jee****,3,2026.04.23,1번째 방문,영수증,"직원분들도 친절하시고, 감성있음. 고기도 맛있음",26,True
육산장 홍대본점,wjd****,96,2026.04.23,1번째 방문,영수증,분위기가 너무 좋아요!!,13,True
육산장 홍대본점,joy****,6,2026.04.22,1번째 방문,영수증,처음 방문했는데 야외 공간도 잘 꾸며져 있어서 요즘같은 날씨에 방문하기 좋은 것 같아요,48,True
육산장 홍대본점,jsb****,25,2026.04.22,1번째 방문,영수증,분위기도 좋고 맛있게 먹구가요,16,True
육산장 홍대본점,miniou,11,2026.04.22,1번째 방문,영수증,분위기가 너무 좋아요.. 야장 느낌도 나고 아늑한 느낌도 납니다!! 친구랑 처음 방문했는데 너무 좋아서 다음에 또 오려구용 ㅎㅎ🥺🩵,73,True
육산장 홍대본점,tskim444,25,2026.04.22,1번째 방문,영수증,분위기 너무 젛고 음식 항상 맛있습니다 사장님 너무 친절하세용....❤️☺️,42,True
육산장 홍대본점,yj****,10,2026.04.22,1번째 방문,영수증,밑반찬도 잘나오고 고기도 초벌해서 나와서 금방 먹을 수있었어요 지금 날씨에 오기 너무 좋은 식당인 거 같아여!!,62,True
육산장 홍대본점,김정섭5973,8,2026.04.22,1번째 방문,영수증,네이버 지도 검색해서 왔는데 분위기도 너무 좋고 마싯어요,31,True
육산장 홍대본점,이은혜92,14,2026.04.22,1번째 방문,영수증,모임하기 좋아요! 분위기도 좋고 맛도 있어요. :),28,True
육산장 홍대본점,도란3,67,2026.04.21,1번째 방문,영수증,애인이랑 방문했는데 인테리어가 감성적이고 테이블이 매우 청결했어요. 공간도 넓어서 단체모임하기도 좋을 것 같아요! 고기 빠르게 초벌해주시고 반찬과 사이드가 여러가지라 골라먹는 맛이 있어서 좋았습니당🥺,111,True
육산장 홍대본점,럭키세븐777,5,2026.04.21,1번째 방문,영수증,여기 완전 맛있어요 담에 여친이랑 또올거같아요,25,True
육산장 홍대본점,레샾,37,2026.04.20,1번째 방문,영수증,직원분들도 너무 친절하고 맛있어요!! 분위기도 완존 즇네요❤️ 강추합니더 !!,43,True
육산장 홍대본점,수3063,37,2026.04.20,1번째 방문,영수증,삼겹살 진짜 맛있어요🥹,12,True
육산장 홍대본점,the****,13,2026.04.19,1번째 방문,영수증,진짜 맛있고 양도 많고 저렴한데 분위기도 미쳣어요 도심 속 캠핑! 추천드려요,42,True
육산장 홍대본점,듈리35,15,2026.04.19,1번째 방문,영수증,고기 양도 많고 맛있어요👍🏻 사이드 음식도 다 좋았습니다❤️,33,True
육산장 홍대본점,레모니845,39,2026.04.19,1번째 방문,영수증,고기가 초벌이 되서 나와서 자리에서 많이 기다리지않고 먹을수 있어서 좋았습니다👍👍 매장 분위기도 너무 좋아요!,61,True
육산장 홍대본점,유자9111,18,2026.04.19,1번째 방문,영수증,캠핑 분위기 낭낭하고 넘 좋앗어요!! 한판 시키니까 다 구워 주시고 몸에 고기 냄새 안 베일것 같아거 좋아요!,61,True
육산장 홍대본점,jryeon,66,2026.04.18,1번째 방문,영수증,홍대에 요런 분위기 맛집이 !! 담에 또 오려구용 ㅋㅎ,30,True
육산장 홍대본점,lil****,76,2026.04.18,1번째 방문,영수증,요즘같은 날씨에 밖에서 먹기 너무 좋아요,22,True
육산장 홍대본점,rla****,7,2026.04.18,1번째 방문,영수증,야장 분위기 너무 좋아요!!술이 술술 들어갈꺼 같은 분위기😚고기도 맛있고 사진은 깜박했는데 불닭볶음면 메뉴에 있어서 좋아요 역시 고기랑 잘어울려요 맛잘알 사장님ㅎㄹ,91,True
육산장 홍대본점,wbd****,40,2026.04.18,1번째 방문,영수증,처음 와봤는데 캠핑 분위기 좋고 거기도 부드럽고 맛있어요 강추!,35,True
육산장 홍대본점,개구ㄹl,20,2026.04.18,1번째 방문,영수증,야장 완전 분좋 ㅠㅠ 고기도 생각보다 맛있어용 치즈개존맛,31,True
육산장 홍대본점,규민585,29,2026.04.18,1번째 방문,영수증,모둠한판 먹었는데 배가 엄청부르네요.. 물론 불닭두 먹었지만~🥹🙏 야장으로 왔는데 더 더워지기전에 와서 좋았어용!! 집근처라 다음에 또 와볼게요 잘먹었습니다!,88,False
육산장 홍대본점,뚜뚜65,167,2026.04.18,1번째 방문,영수증,너무 맛있어요!! 분위기 진짜 짱 대박이에요 초벌 햐쥬셔소 굽기 편하고 양념도 많아서 좋앗숩니다,53,True
육산장 홍대본점,아발란치에,12,2026.04.18,1번째 방문,영수증,너무 맛있고 분위기 좋고 친절해요,18,True
육산장 홍대본점,주민이,4,2026.04.18,1번째 방문,영수증,"도심 한복판에서 캠핑 온 듯한 야장 분위기가 매력적인 고깃집. 고기는 구워 나와 편하고, 감성·맛 둘 다 무난한 편. 날씨 좋은 날 가볍게 분위기 즐기기 좋아요",89,True
육산장 홍대본점,26894,58,2026.04.17,1번째 방문,영수증,"고기 질이 신선하고 육즙이 살아 있어서 정말 맛있게 먹었습니다. 직원분들도 친절하게 응대해주셔서 기분 좋게 식사할 수 있었고, 매장도 깔끔해서 전체적으로 만족스러운 방문이었어요. 다음에 또 방문하고 싶은 고깃집입니다.",121,True
육산장 홍대본점,areummmm,52,2026.04.17,1번째 방문,영수증,고기가 부들부들 질이 너무 좋아용 ㅠㅠ 야장 하는 곳도 따로 있어서 캠핑 하는 분위기도 낼 수 있습니덩 잘 먹었습니당,65,True
육산장 홍대본점,cls****,80,2026.04.17,1번째 방문,영수증,원래 다른 식당 가려다가 냄새에 이끌려 들어왔습니다..! 야외 컨셉 너무 좋고 의자도 편하고 고기도 초벌되어 나와서 금방 먹을 수 있었어요.. 진짜 맛있고 비주얼도 대박입니다 ㅠㅠ 재방문의사 100%✨,112,True
육산장 홍대본점,suz****,34,2026.04.17,1번째 방문,영수증,분위기도 좋고 고기도 너무 맛있고 친절하세요! 모임하기 좋은거같아요&gt;.&lt; 홍대 고기맛집 인정!,58,True
육산장 홍대본점,yvu,4,2026.04.17,1번째 방문,영수증,야장하고 싶어서 검색해서 왔는데 분위기 너무 좋아요 ㅎㅎ 맛있고 깔끔해서 좋네요:)😃🤍,48,True
육산장 홍대본점,밍키리밍키키,24,2026.04.17,1번째 방문,영수증,"분위기 보고 들어왔는데, 넘 맛있게 잘 먹었습니다 !!",30,True
육산장 홍대본점,져니7187,14,2026.04.17,1번째 방문,영수증,캠핑장 분위기 좋았어요 잘먹었습니다 또 올거같아요~,28,True
육산장 홍대본점,파랑색바다,76,2026.04.17,1번째 방문,영수증,"6명 단체 방문했는데 테이블 넓어서 편해요! 고기도 절반까지 구워서 나와고, 다양한 이벤트가 있어서 좋아요! 맛도 조아요",67,True
육산장 홍대본점,shineka13,21,2026.04.16,1번째 방문,영수증,날씨도좋고해서 안그래도 맛있는 고기가 야외에서 먹으니 더 맛있네요^^ 또올게욥!,44,True
육산장 홍대본점,S jeong,58,2026.04.15,1번째 방문,영수증,남자친구랑 같이 방문했어요!! 정말 맛있게 잘 먹고가요~~,32,True
육산장 홍대본점,데브데드,20,2026.04.15,1번째 방문,영수증,아늑한 캠핑 분위기에서 잘 먹고 즐기다 가요~,25,True
육산장 홍대본점,do****,43,2026.04.14,1번째 방문,영수증,고기가 너무 맛있고 분위기도 끝내줘요!,21,True
육산장 홍대본점,융3118,34,2026.04.14,1번째 방문,영수증,야외 버너에서 구워먹는거구 지금 같은 날씨 좋은 날 오기 너무 좋아요!! 주문할때 메뉴마다 술 종류 하나씩 추가해놓은 것도 뭔가 웃겼어요🤣🤣 고기가 초벌해서 나와서 편하고 맛있게 잘 먹었습니다🫶🏻🔥🔥,111,True
육산장 홍대본점,bon****,18,2026.04.13,1번째 방문,영수증,음식이 너무 맛있고 소스도 여러가지 지나와서 좋아요! 셀프바에 야채도 싱싱해요!! 또 올거예요~~,54,True
육산장 홍대본점,dla****,6,2026.04.13,1번째 방문,영수증,홍대 야장 고깃집 찾다가 여기로 왔는데 분위기가 캠핑장 온 것 같고 여자친구랑 데이트하러 오기 딱 좋은 식당인 것 같아용,67,True
육산장 홍대본점,tra****,28,2026.04.13,1번째 방문,영수증,맛있어요!!! 야외 공간도 야장같이 하고 너무너무 맛있습니다 덕분에 잘 먹고 갑니당당 야외뿐 아니라 실내공간도 인테리어 고깃집이 아닌거같이 잘 해놓으셨어요! 모두 육산장으로 고공,99,True
육산장 홍대본점,강종아970,14,2026.04.13,1번째 방문,영수증,분위기 너무 좋아요!! 데이트 맛집!!,21,True
육산장 홍대본점,gwo****,30,2026.04.12,1번째 방문,영수증,맛있게 잘먹고 좋은 분위기 즐기다가 가요,22,True
육산장 홍대본점,낑깡꽁17,16,2026.04.12,1번째 방문,영수증,홍대 중심부에 야장이 있다니 너무 좋아요ㅠㅠ 분위기도 아늑하고 고기도 너무 맛있어요…♡ 초벌해 나와서 완전 편합니다. 덕분에 행복하게 주말 즐겼습니다 !!!! 재방문 의사 너무너무 있슴 !,105,True
육산장 홍대본점,뎡서,26,2026.04.12,1번째 방문,영수증,분위기가 좋고 고기가 맛있어요!!,18,True
육산장 홍대본점,땅기,25,2026.04.12,1번째 방문,영수증,캠핑장분위기에 야외에서 구워먹는고기가 너무맛있습니다. 분위기 좋고 고기도맛있고 인테리어가 너무 좋아요. 다음에도 꼭 방문예정입니다! 홍대오시면 여기추천,84,True
육산장 홍대본점,Youngwon22,59,2026.04.11,1번째 방문,영수증,홍대 자주 놀러오는데 매장 처음 방문해봤어요~ 구석지에 있는데도 사람들이 많고 야외에서 즐길 수 있어서 캠핑 온 기분이라 분위기도 넘 좋았어요. 고기도 정말 맛있게 먹었어요! 다음에 또 홍대에서 고기 먹게되면 여기로 올 것 같아요 ㅎㅎ,131,True
육산장 홍대본점,areumi55,100,2026.04.11,1번째 방문,영수증,넘 맛있게 먹고 갑니다^^ 다음에 또 올게요,24,True
육산장 홍대본점,hon****,20,2026.04.11,1번째 방문,영수증,분위기도 너무 좋고 저녁에 오면 너무 좋을 거 같아요 데이트 장소로도 너무 추천해요!! 야장이 너무너무 이뻐요 ㅠㅜㅠㅠ💕🥹,68,True
육산장 홍대본점,nacho7,11,2026.04.11,1번째 방문,영수증,모임때문에 방문하게 되었눈데 맛있게 잘먹었어요! 자리가 불편해서 옮기게 됐는데 직원분이 친절하게 응대해주셔서 감사했습니다!,68,True
육산장 홍대본점,과감한스페이스,14,2026.04.11,1번째 방문,영수증,"홍대 육산장 다녀왔어요🔥 고기 퀄리티도 좋고 전체적으로 깔끔해서 기분 좋게 먹고 왔어요! 양도 생각보다 넉넉해서 배부르게 먹었네요ㅎㅎ 직원분들도 친절하셔서 편하게 식사할 수 있었고, 홍대에서 고기 먹고 싶을 때 다시 방문할 것 같아요👍",131,True
육산장 홍대본점,둥칫냐옹,27,2026.04.11,2번째 방문,영수증,먹을게 많아서 너무 좋아요,14,True
육산장 홍대본점,소효빈,40,2026.04.11,1번째 방문,영수증,소 꼬들살 너무맛있게 먹었어요! 캠핑 분위기도 나고 맛도 좋고 너무 즐거운 데이트였답니다! 또 올게요❤️,58,True
육산장 홍대본점,최제윤,46,2026.04.11,1번째 방문,영수증,요새 날씨도 좋아서 바깥에서 먹으니 기분도 좋고 시원하네요 서비스도 좋아요~,42,True
육산장 홍대본점,노대19,12,2026.04.10,1번째 방문,영수증,리뷰보고 맘에 들어서 왔는데 역시나 분위기가 끝내주네요 고기도 너무 맛있고 최고네요~ 또 올게요,53,True
육산장 홍대본점,세현임,2,2026.04.08,1번째 방문,영수증,양도 많고 맛있아요 !! 친구 추천으로 와봤는데 좋아요 👍🏻👍🏻 매장도 넓고 직원분들이 친절해요,53,True
육산장 홍대본점,황지성23,39,2026.04.07,1번째 방문,영수증,"너무 맛있어서 사진도 못 찍고 먹었네요 ㅋㅋㅋ 고기 맛있어요😋 김찌, 된장술밥도 최고!!",49,True
육산장 홍대본점,lla47,4,2026.04.06,1번째 방문,영수증,고기가 초벌되어 나와 빠르게 먹을수 있어 좋아요! 주방쪽 화려한 불 포포몬쓰는 덤~,46,True
육산장 홍대본점,권포켓,46,2026.04.06,1번째 방문,영수증,우대갈비 먹고 싶어서 일부러 찾아왔는데 플레이팅부터 감동 ㅎㄷㄷ 고기도 실하니 맛있고 다음엔 다른 고기도 먹어봐야겠음. 셀프 볶음밥까지 싹쓸이 했어요 ㅠ 행복♡,89,True
육산장 홍대본점,유연한두더지,40,2026.04.06,1번째 방문,영수증,고기가 먹기 엄청 편하게 초벌되어서 나와용 김치냉칼국수는 무조건 드셔야합니다•••🤤 콘치즈랑 고기랑 반찬들 전부 맛있어요🥰❤️ 홍대 놀러올 때마다 올게요!! #홍대고깃집 #홍대맛집 #홍대육산장,107,True
육산장 홍대본점,젤42,18,2026.04.06,1번째 방문,영수증,캠핑하는 거 같아요!!! 친구들이랑 너무 맛있게 먹었어요 ✌🏻,34,True
육산장 홍대본점,채민5297,24,2026.04.06,1번째 방문,영수증,분위기 진짜좋고 넘 맛있습니다ㅠㅠㅠㅠㅠ 재방문의사 100😃💕,33,True
육산장 홍대본점,2038292,20,2026.04.05,1번째 방문,영수증,고기 맛있고 야외 좌석 있어서 너무 좋아영!!!!,27,True
육산장 홍대본점,dea****,14,2026.04.05,1번째 방문,영수증,분위기 넘 좋고 고기도 맛있네요~~ 봄 나들이 최고의 선택 육산장!!!,39,True
육산장 홍대본점,mmjj2478,26,2026.04.05,1번째 방문,영수증,캠핑 온것 같은 분위기네요!! 분위기 넘 좋고 밥에듀 햄 올려주시는거 넘 감동이에요!!🥹,49,True
육산장 홍대본점,우왕쿠왕,17,2026.04.05,1번째 방문,영수증,야외에서 먹는게 분위기가 좋아서 더더욱 맛있게 느껴졌습니다! 다음에 또 올게요,43,True
육산장 홍대본점,4294967296,40,2026.04.04,1번째 방문,영수증,맛있어요 !!🤤 캠핑장 온 것 같아여 💓,22,True
육산장 홍대본점,ohs****,36,2026.04.04,1번째 방문,영수증,고기가 맛있구 밑반찬들도 거를게 없어용 진짜 최고 같이 나오는 옥수수 감다살 ㅠㅠ 별이 다섯개입니당 !!,58,True
육산장 홍대본점,누누8674,62,2026.04.04,1번째 방문,영수증,사이드 구성부터 너무 알차고 맛잏어요!!,22,True
육산장 홍대본점,류여경,22,2026.04.04,1번째 방문,영수증,고기 맛있고 바깥공간 캠핑느낌이라 좋았어요~~ 불닭도 팔아서 맛있게 잘 먹구갑니다~,46,True
육산장 홍대본점,박진형5325,33,2026.04.04,1번째 방문,영수증,"분위기 너무 좋은데, 깔끔해요 메뉴도 저렴하고 고기도 맛있어요",34,True
육산장 홍대본점,서연3826,12,2026.04.04,1번째 방문,영수증,고기 너무 맛있고 반찬이랑 사이드도 다 훌륭해요 야장 분위기 최고입니다 추천해요 !!!,48,True
육산장 홍대본점,츄니다,31,2026.04.04,1번째 방문,영수증,냄새에 홀려서 들어왔는데 고기도 너무 맛있어요!!! 감사합니다💕💕,36,True
육산장 홍대본점,has****,13,2026.04.03,1번째 방문,영수증,와 가성비 대박이에요 !!! 이 가격에 이 양이라니 .. 그것도 서울 . 홍대에서 . 여러분 꼭 오세요 ~~!!,62,True
육산장 홍대본점,jiu****,8,2026.04.03,1번째 방문,영수증,매장도 넓고 음식도 엄청 빨리 나와요! 대기 없이 바로 들어갈 수 있고 맛있어서 다음에 또 올거같아요:),58,True
육산장 홍대본점,rhdiddldidhd,5,2026.04.03,1번째 방문,영수증,기본상차림완벽해요💖💖💖 넘맛있당꼭오세용~~!! ♡♡ 학교근처라 자주올게용~~♡ 서비스넘친절하세용^^!,56,True
육산장 홍대본점,wldk7812,33,2026.04.03,1번째 방문,영수증,서울 한복판에 이렇게 글램핑같은 느낌내면서 고기 먹을수있다니 신기해요! 분위기도 맛도 너무 맛있습니다!,57,True
육산장 홍대본점,wlsghks458,3,2026.04.03,1번째 방문,영수증,분위기 아주 귯귯 ㅎㅎㅎ 다음에도 한번 다시와야겠어욥~👍✌️😍🥰,35,True
육산장 홍대본점,도래미77,21,2026.04.03,1번째 방문,영수증,우대장갈비 진짜 맛있어요! 밖에 야장 공간도 너무 좋고 인테리어도 산장 느낌이어서 멋있어요!,51,True
육산장 홍대본점,소화낭자,29,2026.04.03,1번째 방문,영수증,"서비스도좋고 맛도좋아요,분위기 갑인 추천완젼",24,True
육산장 홍대본점,안뉴6346,26,2026.04.03,1번째 방문,영수증,지인분들과 함께 저녁먹으로 왔습니다 분위기가 너무 좋네요.,32,True
육산장 홍대본점,v732,19,2026.04.02,1번째 방문,영수증,분위기.짱!!!! 고기도 맛잇고 야장이라 너무 좋아요~~~ 셀프바도 좋고 맛잇게 잘먹엇어요~~~~~,55,True
육산장 홍대본점,프라푸치노93,125,2026.04.02,1번째 방문,영수증,아이랑 같이갔는데 고기가 넘나리 맛났어요. 도심속 캠핑느낌이라 초딩아이가 넘 씐나하고 고기도 완전먹방에 된장찌개에 밥한그릇도 뚝딱 ㅋㅋㅋ 또갈게요.,82,True
육산장 홍대본점,아고라7738,45,2026.04.01,1번째 방문,영수증,맛있게 잘 먹었어요 강추드립니다,17,True
육산장 홍대본점,phy****,12,2026.03.31,1번째 방문,영수증,구성좋고 야장이 잘 되있어서 먹기 좋은 분위기네요 고기도 맛있게 잘 먹었습니다ㅎㅎ,45,True
육산장 홍대본점,pp2387,48,2026.03.31,1번째 방문,영수증,분위기가 너무 좋아요!!,13,True
육산장 홍대본점,deb****,13,2026.03.30,1번째 방문,영수증,너무너무 맛있어요 ㅜㅠ 세트로 시키니 고기 부위도 다양하고 밑반찬들도 다 맛잇엇습니다. 무엇보다 야외라서 더 분위기 있게 재밋게 즐길 수 잇엇어요 !,83,True
육산장 홍대본점,나761,6,2026.03.30,1번째 방문,영수증,고기 너무 맛있게 먹었어요! 항정살 원래도 좋아하는데 여기서 먹으니까 더 맛있는 것 가타요 ㅎㅎ 밖에서 먹었는데 분위기도 좋고 친구들이랑 수다 떨면서 먹기 좋아요! 다음에 홍대 오면 또 방문할게요 ㅎㅎ 항정살이랑 삼겹살 강력추천하고 갑니다!,134,True
육산장 홍대본점,Qwe78900,19,2026.03.29,1번째 방문,영수증,야장 분위기도 좋고 !!!! 맛도 있어요!!!,25,True
육산장 홍대본점,Dtayhxt,130,2026.03.28,1번째 방문,영수증,직원분들이 친절하고 고기질이 좋아요~ 맛있어요!!,27,True
육산장 홍대본점,bas****,6,2026.03.28,1번째 방문,영수증,"주말 저녁에 방문했는데 분위기가 너무 좋아서 도심 속에서 잠깐 여행 온 느낌이었어요 🏕️✨ 웨이팅 없이 바로 들어갈 수 있어서 더 좋았고, 여유롭게 힐링하고 갑니다 🤍 홍대 오면 또 생각날 것 같아요! 다음에 재방문할게요 💖",125,True
육산장 홍대본점,kbk****,25,2026.03.28,1번째 방문,영수증,매장이 너무이쁘고 선선한 날씨에 최고에요+!!!,26,True
육산장 홍대본점,ker****,28,2026.03.28,1번째 방문,영수증,일단 양이 많고 고기 질이 좋아요 넘 맛있어용~~💓,28,True
육산장 홍대본점,므흐므므,27,2026.03.28,1번째 방문,영수증,주변에 평점 높은 곳으로 왔는데 역시 성공 고기 질이 좋고 진짜 맛잇어요. 테이블도 넓고 야채도 싱싱해요 야장분위기 최고에요. 다음에도 또 올게요!!,83,True
