가게 이름,계정 ID,계정의 리뷰 수,계정의 별점 평균,방문 날짜,별점,리뷰 내 사진 유무,리뷰 글자 수,리뷰 내용,카카오맵 리뷰다는 사람 레벨
살롱순라,여행자,57,5,2026-04-09,5.0,False,76,여기 은근 숨은 분위기 맛집 느낌이라 조용하게 밥 먹기 좋았어요! 음식도 과하게 꾸미지 않고 담백하게 나와서 편하게 즐기기 괜찮았어요:),실버 레벨
살롱순라,정지용,33,5,2026-04-09,5.0,False,80,종로에서 이런 분위기 나오는 곳 있는지 몰랐는데 완전 다른 느낌이었어요! 조용하게 먹기 좋고 음식도 담백하게 나와서 부담 없이 즐기기 괜찮았어요,실버 레벨
살롱순라,유미의,22,5,2026-04-07,5.0,False,105,요즘 핫하길래 궁금해서 가봤는데 확실히 이유 있긴 하네요 전체적으로 차분한 느낌이라 들어가면 자연스럽게 말도 조용해짐ㅋㅋ 메뉴도 흔한 한식이 아니라 살짝 변주된 느낌이라 색다르고 좋네요!!,실버 레벨
살롱순라,신진후,22,5,2026-04-07,5.0,False,73,한옥 느낌 살짝 섞인 인테리어라 편안한데 또 은근 고급짐 있음 음식도 생각보다 디테일하게 나오고 플레이팅이 예뻐서 눈부터 즐거움ㅎㅎ,실버 레벨
살롱순라,김가온,34,4.9,2026-04-02,5.0,False,60,지인과 오랫만에 만나는 자리라서 고민하고 왔어요!! 가게가 너무 예쁘고 직원분들 친절하시고 청결하고 좋아요~,실버 레벨
살롱순라,송지후,35,5,2026-04-02,5.0,False,96,음식은 비주얼부터 만족스러웠고 과하지 않으면서도 계속 손이 가는 맛이었습니다 ^^ 와인과 함께 즐기기 좋은 메뉴 구성이어서 기념일이나 특별한 날 방문해도 좋을 것 같아요~~,실버 레벨
살롱순라,eyejun,29,4.3,2026-03-29,3.0,False,50,분위기는 참 좋은데 음식 맛이 별로. 같이 간 분들 한마음으로 그돈씨를 외치고 옵니다...,실버 레벨
살롱순라,정민아,41,5,2026-03-25,5.0,True,61,매장도 깔끔하구요 음식도 플레이팅 예쁘고 맛도 깔끔해서 계속 손이 가더라구요 직원분들도 친절해서 좋았어요 ^^,실버 레벨
살롱순라,지율,43,4.9,2026-03-25,5.0,True,40,요리들이 다 정갈하게 나오고 간도 과하지 않아서 계속 먹게 됨니다 ㅎㅎㅎ,실버 레벨
살롱순라,우리,1,1,2026-03-21,1.0,False,28,이렇게 맛 없는 스테이크 처음 내가 더 잘 구울 듯,실버 레벨
살롱순라,유다미,53,5,2026-03-18,5.0,True,26,굿굿 이만한데 없는거 같아요 데이트 잘 하구가용,실버 레벨
살롱순라,전준자,44,5,2026-03-18,5.0,True,60,와 ♡ 분위기도 좋고 맛도 좋은 곳입니다! 살롱순라 번창하세요~ 다음에도 친구들이랑 모임하러 오겠습니다 :),실버 레벨
살롱순라,ssss,20,3.6,2026-03-14,3.0,False,69,피자는 축축하고 트러플 머쉬룸 피자인데 꿀을 뿌렸는지 달아요. 파스타에는 김치 맛? 이 나요. 그냥 분위기로 오는 곳 같아요,실버 레벨
살롱순라,Ian,99,2.5,2026-03-12,3.0,False,4,그냥저냥,골드 레벨
살롱순라,박현서,46,4.8,2026-03-11,5.0,False,116,친구랑 종로에서 놀다가 저녁 먹으려고 들렸는데 분위기가 생각보다 좋더라구요. 스테이크 주문했는데 굽기도 딱 좋고 고기 육즙도 살아있어서 만족! 한옥 분위기라 일반 레스토랑이랑 느낌이 달라서 더 기억에 남는 듯,실버 레벨
살롱순라,조나진,46,4.9,2026-03-11,5.0,False,96,서순라길 산책하다가 분위기 좋아 보여서 들어간 곳! 한옥 느낌이라 사진 찍기에도 좋고 은근 감성 있음ㅎㅎ 들기름 파스타 시켰는데 고소한 향이 확 올라와서 생각보다 맛있었어요,실버 레벨
살롱순라,울룰루,24,3.8,2026-02-28,1.0,False,12,여기 맛이 없어욤…ㅠㅠ,실버 레벨
살롱순라,꿀꿀이의 맛평가,38,3.7,2026-02-25,4.0,True,74,마르게리따 피자랑 감베리 명란 매콤 알리올리오 시켰는데 피자 진짜 존맛 ㅠ 완전 사르륵 넘어감 취저!! 가게 분위기도 엔틱하고 좋음!,실버 레벨
살롱순라,임지유,43,4.9,2026-02-25,5.0,False,47,인테리어도 독특하구 맛있어요 스테이크 질기지 않고 맛있구 피자 진짜 맛있네용 ♡^^♡,실버 레벨
살롱순라,LindsayJii,57,5,2026-02-25,5.0,False,43,데이트로 다녀왔는데 스테이크 굽기나 간도 적당해서 맛있네요! 인테리어도 이뻐요,실버 레벨
살롱순라,정지민,43,4.9,2026-02-04,5.0,False,133,친구 생일이라 살롱순라 예약했는데 신의 한 수였어요^^;;; 케이크는 따로 준비했는데 매장 분위기가 너무 좋아서 자동 감성 ON입니다 ㅋ 피자 종류 다양하고 리조또도 꽤 퀄리티 있어서 다들 만족! 단체보단 소수 모임에 더 추천해봅니다~~~,실버 레벨
살롱순라,장예리,53,4.8,2026-02-04,5.0,False,66,"트러플 피자는 향부터 고급지고, 자몽에이드는 상큼해서 클렌징 느낌ㅋㅋ 연인끼리 특별한 날 가면 진짜 기억 남을 곳이에요",실버 레벨
살롱순라,맘ㅁ보,83,4.8,2026-01-26,5.0,False,34,파스타 맛있음....ㅎ 직원들도 친절한 편이고 매장도 깔끔해요,실버 레벨
살롱순라,kuk1005,36,5,2026-01-26,5.0,False,124,"분위기가 아늑하고 은은한 조명 덕분에 이야기 나누기 딱 좋았어요😍 파스타는 소스가 진하고 면도 탱글탱글, 피자는 치즈가 쭉 늘어나면서 바삭하게 구워져서 둘 다 정말 만족스러웠어요ㅎㅎ 데이트 코스로 완전 추천할 만한 곳이에요",실버 레벨
살롱순라,니빠뜨롱나와라그래,234,2.7,2026-01-15,1.0,False,3,후.조,골드 레벨
살롱순라,가을❣️,4,5,2026-01-15,5.0,False,76,분위기가 너무 맘에드는곳인데 음식이 맛있어서 더 행복해지는곳이예요 스테이크 잡내없이 육즙가득 부드럽고 감바스 마르게리따피자 너무 추천해요,브론즈 레벨
살롱순라,우니,75,5,2026-01-14,5.0,False,66,스테이크는 미듐웰던이였는데 질기지 않고 맛있습니다 감바스는 전혀 느끼함 없이 완존 맛있어요 저희믄 마늘빵 추가했어요^^,실버 레벨
살롱순라,지후니,73,4.9,2026-01-14,5.0,False,37,전체적으로 음식도 맛있구 직원분들도 친절해서 기분 좋았습니다 ^^!,실버 레벨
살롱순라,김유진,88,5,2026-01-12,5.0,False,91,빠쉐진짜 맛있어요 ㅋ 피자에 꿀도 진짜 맛있음!! ㅋ 서순라길에 맛집중에 여기 찜해뒀습니다!! 메뉴여러가지있어서 자주자주 올라고용 ㅋ 인스타에 자랑 잔뜩했네요 ㅋㅋ,실버 레벨
살롱순라,찬이찬,80,4.9,2026-01-12,5.0,False,103,"두번째 방문, 예약하고 방문했는데 만족하고 갑니다 분위기가 모임하기에도 좋고 데이트하기에도 딱이에요 와인 한잔씩 하기에 다 좋은 메뉴들만 있어요 ^^ 가격 가성비도 좋고 양도 많은 편~",실버 레벨
살롱순라,이보선,109,5,2026-01-12,5.0,False,78,인테리어도 한옥 분위기라 좋고 메뉴도 깔끔하니 좋아요 일단 내부도 너무 잘 꾸며놓고 ㅜㅜ 직원분들도 친절합니다 인스타보고 온곳인데 만족합니다,실버 레벨
살롱순라,김지후,51,4.9,2026-01-09,5.0,False,58,살짝 웨이팅했지만 맛있으니까 갠춘!! ㅋ 재료들도 신선하고 맛있네요~~ 파스타랑 스테이크 찐찐 맛있습니다,실버 레벨
살롱순라,서다윤,61,4.8,2026-01-09,5.0,False,44,위치도 너무 좋고 데이트하기 좋아요! 피자도 화덕피자라 맛있었습니당 굿굿 ♥♥♥,실버 레벨
살롱순라,유성민,64,4.7,2026-01-08,5.0,False,90,서순라길 피자 맛집 실화냐구요? 한옥+유럽 무드라 분위기 끝판왕🔥 콰트로 피자 진짜 미쳤고 명란 파스타 꾸덕해서 찐 만족… 비주얼도 예뻐서 사진 오백장은 찍음ㅋㅋ,실버 레벨
살롱순라,김유리,65,4.9,2026-01-08,5.0,False,99,감성 충전엔 분위기 맛집이 최고지요… 화덕피자에 콜라 한잔으로 위로받았어요. 인테리어 예뻐서 속상했던 기분도 싹 사라짐 >3 < 진짜 최고입니다 메뉴도 금방금방 나오고 맛있어요~,실버 레벨
살롱순라,신민수,56,4.9,2026-01-08,5.0,False,115,"테이블 간 간격이 넓어 프라이빗한 느낌이 좋았고, 매장 안 조명 톤도 따뜻해서 음식 사진이 잘 나옵니다!!!! 명란 파스타는 짜지 않고 고소해요. 전체적으로 음식 간도 세지 않아서 부담 없이 즐기기 좋습니다",실버 레벨
살롱순라,장윤아,63,5,2026-01-08,5.0,False,60,한옥 외관인데 내부는 인테리어가 고급지네요 샐러드랑 피자 조합도 굿! 느긋하게 이야기하기 딱 좋은 공간이에요,실버 레벨
살롱순라,예원,16,4,2026-01-08,3.0,True,60,정확히는 3.5임 저 피자는 조금 별로였고 나머지는 맛있었음. 근데 위치가 위치라 그런지 좀 비싼 감이 있음,실버 레벨
살롱순라,냠냠,1,5,2026-01-07,5.0,False,67,찐맛집이에요!! 피자 화덕피자라 맛있음 분위기도 좋고 조용해서 대화하기 좋았어요 맛이 괜찮아서 이 근처 오면 또 오려구요,브론즈 레벨
살롱순라,kkku,63,5,2026-01-07,5.0,False,86,파스타는 크림이 부드럽고 풍미가 살아 있어서 만족스러웠고 리조또도 고소하고 풍미가 풍부해서 마지막까지 깔끔하게 즐기고 나왔네요 ㅎㅎㅎ 데이트장소 강추!!!,실버 레벨
살롱순라,dbrud2128,267,5,2026-01-07,5.0,False,67,파스타 먹으러 다녀왔는데 면이 쫄깃하고 소스가 진짜 맛있었어요!!! 스테이크도 육즙 가득하고 배불리 잘 먹고 왔습니다 😋,골드 레벨
살롱순라,신진아,25,4.8,2026-01-06,5.0,False,79,재방문하고플정도로 맛있었던 집이에요 생각보다 샐러드가 너무 맛있었습니다 모임때문에 방문했는데 진짜 만족했어요~ 가성비도 좋고 직원들도 친절해요,실버 레벨
살롱순라,성민지,30,5,2026-01-06,5.0,False,55,와인걸치기 좋은 곳~~!! 가격대비 진짜 만족스러운 곳이에요 분위기도 좋고 피자도 맛있습니당 ^_^,실버 레벨
살롱순라,정지유,106,4.9,2026-01-05,5.0,False,49,연초 모임으로 왔는데 다들 친절하구 좋네요~~ 음식도 맛있구 담에 데이트하러도 와야겠어요,실버 레벨
살롱순라,방서연,62,5,2026-01-05,5.0,False,65,여기 분위기 미쳤네요~~ 인테리어 덕분에 인생샷 건지고 사진찍어올렷더니 사람들이 어디냐고 다 물어봐요! 맛도 있었음!,실버 레벨
살롱순라,이혁주,21,5,2026-01-05,5.0,False,94,여태까지 먹은 이탈리아 양식중에 제일 맛났어요~ 고즈넉한 기와 밑에서 먹는 맛이 일품이었네요~ 다음에 또 오겠습니다:) 최애 맛집!! 여행갔던 이탈리아가 생각 났어요ㅎㅎ,실버 레벨
살롱순라,peace 2026,219,4,2026-01-03,5.0,True,163,맛 자극적이지 않고 무난합니다. 재료도 신선합니다. 감바스 맛있었어요. 국물 떠 먹게 오목한 개인접시를 주면 더 좋을 것 같아요. 가격대도 크게 높지 않아요 와인 가장 저렴한 거 주문했는데 부드럽고 맛있었습니다. 서순라길 산책하기에도 좋고 종묘 걷기에도 딱 좋은 위치라서 항상 손님이 넘쳐요.,골드 레벨
살롱순라,김지미,93,5,2026-01-02,5.0,False,61,모임으로 살롱순라 왔는데 너무 맛있어요 직원분들도 진짜 넘 친절^^ 와인도 한잔 하고~ 파스타 진짜 맛남!!!,실버 레벨
살롱순라,김미수,2,5,2025-12-08,5.0,True,31,제 최애 맛집♡ 피자랑 스테이크 샐러드랑 다 맛나용!!!,브론즈 레벨
살롱순라,박유미,2,5,2025-12-06,5.0,True,18,분위기최고 맛도 최고 친절도 최고,브론즈 레벨
살롱순라,Alice 한현정,1,5,2025-12-06,5.0,True,44,분위기도 좋고 맛도 좋아요~ 모임왔는데 넘넘 좋네요♡♡ 재방문 의사 있습니다~!,브론즈 레벨
살롱순라,임동석,1,5,2025-12-06,5.0,True,80,두번째 방문한 살롱순라 크리스마스 분위기에 맞춰서 너무 분위기도 좋아요 연말 모임 예약했는데 너무 만족합니다.! 음식 맛도 분위기도 최고입니다!,브론즈 레벨
살롱순라,희주,1,5,2025-12-05,5.0,True,79,제일 예쁨 봄에 방문했고 중간에서도 자꾸 가고 크리스마스에도 다시 방문했습니다. 음식이 맛있고 분위기가 모임이나 데이트하기에 딱 좋아요. ㅎㅎ,브론즈 레벨
살롱순라,다라,2,5,2025-12-05,5.0,True,43,"음식이 정말 맛있었고, 직원분들이 너무 친절해서 기분 좋게 식사할 수 있었어요",브론즈 레벨
살롱순라,왘,1,1,2025-11-30,1.0,True,208,스테이크 시키지 마세요 강한 불에 얼마나 대충 구웠으면 겉면은 이빨이 잘 들어가지 않고 입천장에 긁힐 정도로 딱딱했고 속은 제대로 잘 익지도 않았으며 가장 최악인 것은 스테이크가 차가웠습니다. 4만 6천원 씩이나 받으면서 스테이크가 차가웠다구요.. 솔직히 3만원도 아깝습니다 웬만하면 후기 안적는데 이건 적어야겠다 싶어서 남깁니다 파스타랑 피자만 시키세요 너무 실망했습니다,브론즈 레벨
살롱순라,후닝,1301,4.4,2025-11-24,5.0,True,60,밖에서 와인한잔하기 좋아요. 직원분들도 친절하십니다. 가격도 그리 안비싼편이네요~ 봄 가을 만끽하기에는 딱!,퍼플 레벨
살롱순라,미미,15,4.1,2025-11-20,2.0,True,71,그냥그래용… 명란 알리오올리오가 너무 뻑뻑해요 이런 파스타 처음먹어봐요.. 피자는 그냥그래요 기대를 좀 해서그런지 실망했습니다😿,실버 레벨
살롱순라,맛있으면 짖는 개,29,3.4,2025-11-14,3.0,True,149,왈왈왈왈왈 ⭐️⭐️⭐️⭐️⭐️💫 맛으로 왜 까는거지 하다가 문득 생각남 ㅇㅇ… 조금 까일 만 함 그렇다고 1점 수준은 아닌데 직원 응대가 아쉬운건 공감됨 안쪽 나무 테이블 갔는데 샐러드에서 소스가 흘러서 바닥으로 떨어짐 개선 여지가 눈에 보임 피자는 평타 꿀이 맛있음,실버 레벨
살롱순라,곰돌이,1,2,2025-11-12,2.0,False,94,맛은 있었지만 직원의 대응이 아쉬웠습니다. 이물질이 나왔는데 사과가 먼저가 아니라 리쿡해드리면 될까요? 부터 물어봐서 대처가 이게맞나싶었습니다...재방문은 안할것같아요.,브론즈 레벨
살롱순라,김밥러버,73,4.4,2025-10-31,1.0,True,57,진짜 핵노맛.. 맛없어서 남긴거 정말 오랜만이네요.. 분위기 보고 들어갔는데 제가 더 잘 만들겠어요..,골드 레벨
살롱순라,똑똑,249,4,2025-10-30,4.0,False,65,"넘나 예쁘고 설레는 곳 ㅎㅎ 파스타도 맛있어요. 낮, 밤 모두 예뻐요. 밤에는 옆에 서순라길 산책하면 딱 좋아요 ☺️",골드 레벨
살롱순라,밤식빵❤,62,4.5,2025-10-25,2.0,True,55,분위기는 좋습니다. 그런데 비싼 가격 대비 음식은 너무나 퀄리티 떨어져요. 한번 경험한 것으로 만족,실버 레벨
살롱순라,.,149,4.5,2025-09-27,5.0,False,16,종로 감성 물씬 느껴지는 맛집,골드 레벨
살롱순라,김지수,95,5,2025-09-23,5.0,False,54,살롱순라 처음 방문했는데 좋네요 !! 짭짤한 프로슈토랑 향긋한 루꼴라 조합 완전 대박입니다 ㅋㅋㅋ,실버 레벨
살롱순라,복숭아,23,3.1,2025-09-22,5.0,False,25,분위기 좋아서 맛 기대안했는데 맛있어요.. ㅜ,실버 레벨
살롱순라,이소미,46,4.9,2025-09-15,5.0,False,108,"서순라길 걷다가 분위기 좋아 보여서 들어갔는데, 인생샷 제대로 건졌어요ㅎㅎ 테라스 석이랑 내부 조명 다 너무 예쁘고 감성 넘쳐요. 피자도 쫄깃하고 맛있어서 눈과 입이 모두 행복했던 하루였어요^^",실버 레벨
살롱순라,객관안,111,4.5,2025-08-08,5.0,True,78,아니진짜 너무 맛있어서 놀람ㅋㅋ 분위기도 좋고... 근데 피자 속 저 얇은 베이컨은 좀 짰음. 그래도 지이이이이이이인짜 다시 생각날 것 같음,골드 레벨
살롱순라,선주,77,4.9,2025-08-06,5.0,False,117,"서순라길에 부모님 모시고 갔는데 너무 좋아하셨어요😊 한옥 느낌의 외관에 유럽풍 인테리어가 신기하다고 하시고, 크림 리조또도 부담 없이 드시기 좋았어요. 조용하고 고급진 분위기라 특별한 날 외식 장소로 추천드려요",실버 레벨
살롱순라,흠,133,3.9,2025-07-28,5.0,True,201,오마이갓 오마이갓 여기 왜 안 가심. 무조건 여기 가세요…. 저 빠쉐…도른놈이 매콤+누룽지 진짜 미쳤음. 그리고 고르곤졸라 치즈가 미침. 꿀에 트러플도 살짝 들어가서 넘 꼬숩고 맛있음. 피자 도우가 조금 더 바삭해도 좋을 거 같음. 서순라길 다른 맛집 다 별로였고 이제 여기 도장깨기 하려고요.. 예약 후 방문 했는데 다들 친절하시고 기분 좋게 먹고 갔습니다!,골드 레벨
살롱순라,이가음,94,4.8,2025-07-16,5.0,False,83,회사 동료랑 들렀어요~ 전체적으로 음식도 맛있고 플레이팅이 넘 이쁘게 나오네요 ^^ 와인이랑 먹기 좋아서 데이트로도 좋을 거 같네요 분위기 완벽!ㅋㅋ,실버 레벨
살롱순라,우왕,28,3.1,2025-07-03,3.0,True,71,"스테이크머쉬룸크림리조또 추천 스테이크 맛있는건 잘 모르겠고 가격이 비싸지만 맛있음 피자는 기대 ㄴㄴ so 무난,, 3.7점 정도",실버 레벨
살롱순라,사니뚜니,17,4.9,2025-07-01,5.0,False,98,인테리어가 독특해요 종로핫플핫플하더니 그 이유가 인테리어도 한몫하나봐요 테라스.자리도 이쁘고 정원도 꾸며져있어서 엄마랑 갔는데 좋아하시더라고요 예약도되서 편허고 맛도 괜찮습니다,브론즈 레벨
살롱순라,별점평균3.5점,85,3.5,2025-06-29,2.0,False,20,평범한 맛. 퀄리티 대비 비싼 느낌.,실버 레벨
살롱순라,통큰아몬드,72,3.9,2025-06-19,4.0,True,28,순라길 갈때마다 들르는곳. 맛있고 분위기도 좋아요.,골드 레벨
살롱순라,임재순,122,5,2025-06-17,5.0,False,119,시댁 식구들이랑 종로 나들이 갔다가 살롱순라 들렀어요~ 테라스 자리 너무 예쁘고 정원도 잘 꾸며져 있어서 어르신들도 좋아하시더라구요^^ 피자랑 리조또 시켰는데 아이들도 잘 먹고 음식 간도 세지 않아서 딱 좋았어요~,실버 레벨
살롱순라,맛사냥꾼,332,4.5,2025-06-08,4.0,True,143,은근 테이블도 많고 넓어서 서순라길에서 모임하기 좋은 레스토랑인 것 같아요! 실제로 단체손님도 많아보였습니다 미리 예약이 되니까 웨이팅 하지 않아도 되고 편했어요 가격은 조금 비싼 편인 것 같은데 맛은 괜찮았어요! 다만 조금 정신없고 시끄러운 편이긴 합니다,블루 레벨
살롱순라,최나윤,53,5,2025-05-29,5.0,False,63,음식은 전체적으로 간이 세지 않아서 더 마음에 들었고 특히 파스타 면발이 탱글해서 기억에 남네요~~~~ 잘먹고가요,실버 레벨
살롱순라,ㅇㅅㅇ,4,1.5,2025-05-26,2.0,False,78,가격에 비해 양이 너무 적고 파스타는 소스랑 면이 따로놀아서 생면먹는 느낌.. 감바스도 정체를 모르겠음.. 피자는 맛있음 인스타 감성용 식당,브론즈 레벨
살롱순라,え,68,3.9,2025-05-25,4.0,True,24,분위기가 넘 좋아요 맛도 무난무난 괜찮았어요,실버 레벨
살롱순라,kko,34,3.7,2025-05-11,5.0,False,33,이 근방 올때마다 방문하는 곳. 화덕 피자가 진짜 맛있어요.,실버 레벨
살롱순라,박아린,85,4.9,2025-05-09,5.0,False,108,가족과 오랜만에 외식 장소로 다녀왔는데 만족도가 높았습니다. 조용한 분위기에 정원이 있어 어른들도 좋아하셨고 음식은 전체적으로 깔끔하고 정성이 느껴졌어요. 특히 리조또와 피자 조합이 훌륭했네요👍,실버 레벨
살롱순라,황시연,131,4.9,2025-05-09,5.0,False,118,친구랑 낮에 간단히 먹으러 갔다가 분위기에 완전 빠졌음ㅋㅋ 테라스 자리 앉았는데 햇살 좋고 한옥 감성 뿜뿜~ 피자도 얇고 바삭한데 고소해서 혼자 반판 클리어했...ㅋㅋ 다음엔 저녁에 와서 하이볼 도전 예정입니다!,실버 레벨
살롱순라,강하영,108,4.9,2025-05-09,5.0,False,115,한옥 분위기 너무 고즈넉해서 걷기만 해도 힐링됐어요. 파스타랑 피자도 기대 이상! 로제 소스 부드럽고 해산물도 신선해서 와인 한잔이 절로 생각나더라고요. 조용한 데이트 장소 찾는 분들께 꼭 추천하고 싶어요~,실버 레벨
살롱순라,박정훈,27,3.8,2025-05-09,1.0,True,25,이빨 나갈것같습니다 최악! 고기즙만 먹고갑니다,실버 레벨
살롱순라,믜무,5,3.2,2025-04-29,1.0,True,261,베이컨버섯크림파스타랑 스테이크리조토 주문함. 파스타는 매우 평범하고 집에서도 만들어 먹을 수 있는 맛. 소스가 묽었음 리조토에 있는 스테이크가 매우 짜서 먹기가 힘들었음. 돈이 아까워서 다 먹음. 밥은 맛이 괜찮음 웨이팅 15분 정도 했고 캐치테이블 알림 와서 입장했는데 상 치우는 중이라고 잠시 기다려달라 함. 손님 입장했을 때 자리 안내할 직원이 안 보임. 직접 직원 찾아가야 자리 안내해줌. 감성으로 먹기에는 가격 매우 창렬. 인테리어는 예쁨. 재방문 의사 없음,브론즈 레벨
살롱순라,냉정한미식가,253,2.9,2025-04-25,3.0,False,16,분위기가 다함 맛은 그냥 평범,골드 레벨
살롱순라,윤지성,65,4.8,2025-04-18,5.0,False,143,고즈넉한 한옥에 유럽식 인테리어가 어우러진 이색적인 분위기에서 식사할 수 있어요 테라스 자리에서 햇살 받으며 먹는 루꼴라 피자와 명란 크림 파스타는 조화가 정말 좋아요 데이트나 소규모 모임 장소로 감성 가득한 곳 찾는다면 추천할 만한 컨셉 레스토랑이에요ㅎㅎ,실버 레벨
살롱순라,돌멩이,378,4.1,2025-04-17,3.0,False,52,분위기는 정말 좋습니다. 파스타는 재료나 디테일 측면에서 가격대에 비해 특색이 부족합니다...,골드 레벨
살롱순라,머라카노하루키,709,4.9,2025-04-16,5.0,True,12,테라스의 계절이 왔슴다,퍼플 레벨
살롱순라,🥸김무사🥸,193,3.3,2025-04-12,3.0,True,35,가성비는 아주 떨어지만 그래도 맛은 나쁘지않아 3점대가 살아있음,골드 레벨
살롱순라,임진아,51,4.9,2025-04-09,5.0,False,132,한옥 특유의 고즈넉함에 유럽 감성 인테리어가 더해져서 공간 분위기가 정말 멋진 곳입니다 명란 크림 파스타는 부드럽고 짜지 않아 아이랑 나눠 먹기에도 괜찮았어요 직원분도 친절하고 응대가 빠른 편이라 전체적으로 만족도 높은 식사였습니다 :),실버 레벨
살롱순라,지민이,73,4.8,2025-03-31,5.0,False,72,감바스에 반해서 자주 오는 곳인데 진짜 여기오면 무조건 반합니다 회전도 빠르고 분위기도 좋구~ 익선동에서 오기 좋은 곳입니다 :),실버 레벨
살롱순라,붕붕이,33,4.7,2025-03-29,5.0,True,127,후기 제일 많은 관자새우명란크림파스타랑 트러플머쉬룸피자 자몽에이드 애플망고에이드 먹었습니다. 가격이 좀 있지만 아깝지 읺게 메뉴 전부 너무 맛있게 먹었어요. 토요일 17시즈음 예약없이 바로 이용했습니다. 다음에 또 올거예요 :),실버 레벨
살롱순라,박수현,81,4.9,2025-03-19,5.0,False,89,한옥 감성이 물씬 나는 분위기 속에서 맛있는 피자까지 ㅎㅎㅎ 트러플 머쉬룸 피자 고소하고 풍미 대박💜💚💛 파스타도 부드럽고 맛있어서 또 가고 싶어요! 번창하십쇼,실버 레벨
살롱순라,릭앤모티,89,3.9,2025-03-17,3.0,True,30,그냥 그럼..웨이팅은 안 할듯 제로콜라 4000원 ㅠㅠ,골드 레벨
살롱순라,라이언,13,3.2,2025-03-10,1.0,False,87,맛은 그럭저럭이었는데 직원들의 서비스가 너무 불만족 스럽다 직원들의 대화가 손님들의 대화보다 더 컸다 서빙하시는분 말투도 너무 퉁명스러워서 재방문 안할듯..,실버 레벨
살롱순라,박성철,28,4.7,2025-03-06,5.0,False,77,한옥 감성이 돋보이는 분위기 좋은 레스토랑이에요. 파스타와 피자가 맛있고 와인과도 잘 어울려요. 감베리 명란 파스타 강추! 예약 필수예요ㅋ,실버 레벨
살롱순라,mrjobnson,3,1,2025-03-03,1.0,False,21,돈내는 손님한테 인사나 대꾸도 안하네?,브론즈 레벨
살롱순라,배은채,9,5,2025-02-14,5.0,False,116,"고즈넉한 분위기 속에서 감각적인 인테리어가 돋보이는 공간이네요~ 커피와 디저트 모두 섬세한 맛이 느껴졌고, 한옥 감성이 더해져 더욱 특별했어요. 여유로운 시간 보내기에 딱 좋은 곳이라 재방문 의사 100프로ㅋ",브론즈 레벨
살롱순라,김진하,169,5,2025-02-04,5.0,False,61,"감성이 가득한 공간에서 여유롭게 즐겼네요! ㅋㅋㅋ 사진찍기에도 너무너무 완벽했고, 음식들도 하나같이 맛있었어요",골드 레벨
살롱순라,레테,32,4.7,2025-02-02,5.0,True,66,"무화과 샐러드가 진짜 어마어마하게 맛있었어요. 생무화과가 이렇게 신선하고 달콤, 깨끗한 맛이라는 걸 처음 느껴봤습니다.",실버 레벨
