가게 이름,계정 ID,계정의 리뷰 수,계정의 별점 평균,방문 날짜,별점,리뷰 내 사진 유무,리뷰 글자 수,리뷰 내용,카카오맵 리뷰다는 사람 레벨
아시안테이블,이석준,1,5,2026-04-11,5.0,True,64,너무 맛있는 혜화 맛집이었습니다!! 푸팟퐁 커리 너무 맛있었어요 소프트크랩 식감 완전 최고 여자친구도 만족했습니다!,브론즈 레벨
아시안테이블,유성우,1,5,2026-04-11,5.0,True,43,혜화맛집 인정입니다. 가격이 저렴해서 별기대 안했는데 먹어본 타이중 젤 맛있음,브론즈 레벨
아시안테이블,주상현,2,5,2026-04-09,5.0,True,149,맛있어요!! 세트 가격으로 저렴하게 여러 음식을 즐길 수 있어서 좋았습니다! 완전 혜화맛집이에요! 타이 음식 먹을 수 있는 혜화 맛집 찾게 되어서 기뻐요! 또 올 것 같아요!!!!! 처음에 너무 맛있어서 책상 치다가 실수로 땡모반을 엎았어요!! 그정도로 맛있어요!!!,브론즈 레벨
아시안테이블,슈야언니,1,5,2026-04-08,5.0,True,95,정말 자주 오는 식당이에요!! 혜화 맛집입니다 ㅎ.ㅎ 팟타이가 진짜진짜 맛있고 가격대비 양도 많아서 늘 사람이 많아요 세트로 텃만꿍이랑 푸팟퐁커리까지 맛보는 거 추천드려용,브론즈 레벨
아시안테이블,북촌냐옹이,8,5,2026-04-05,5.0,True,57,이색적인 맛에 홀려서 먹다 찍었어요. 세트메뉴+쏨담추가해서 세명이서 배부르게 먹었니다. 또 올 게요~~,실버 레벨
아시안테이블,종은,1,5,2026-04-04,5.0,True,23,처음와봤는데 너무너무 맛있어요❤️❤️❤️🥰,브론즈 레벨
아시안테이블,cha,1,5,2026-04-04,5.0,True,20,"진짜 왕 맛있어요,,,, 하 또올게요",브론즈 레벨
아시안테이블,연,8,4.3,2026-04-03,5.0,True,131,일 중에 어디갈까 고민하다가 우연히 들린 곳!! 태국 현지에 온 것 같은 인테리어에 1번 마음에 들었고 메뉴가 다양해서 2번 마음에 들었고 마지막으로 음식이 맛있어서 3번 마음에 들었다!! 다음에 또 올게용~ #혜화맛집 #쌀국수 #커리,골드 레벨
아시안테이블,강훈승,2,5,2026-04-03,5.0,True,72,세트 메뉴로 해서 새우 튀김까지 먹었습니다. 너무 맛있었어용~~ 푸팟폰 커리는 특히 풍부한 맛이 일품입니다. 재방문의사 있습니다!,브론즈 레벨
아시안테이블,쥥이~️❤,359,3.8,2026-04-01,5.0,True,58,텃만꿍이었나? 새우 도넛처럼 생긴 거. 여튼 여기 오면 사이드로 항상 주문하는 거!! 이게 젤 맛있음ㅎㅎ,골드 레벨
아시안테이블,ㅇㅅㅇ,2,5,2026-03-28,5.0,True,99,팟타이가 너무 먹고싶어서 찾다가 왔는데 여기 태국 음식 진짜 맛있어요 혜화맛집으로 추천합니다! 그리고 카오카무 족발 덮밥도 먹기 힘든 메뉴인데 진짜 맛있네요 재방문의사 있습니다!,브론즈 레벨
아시안테이블,이진철,2,5,2026-03-28,5.0,True,69,태국 음식 혜화 맛집이었어요. 팟타이와 카오카무를 주문했는데 두 메뉴 모두 맛있었어요. 나중에 다른메뉴로 재방문 예정이에요.,브론즈 레벨
아시안테이블,최선은,2,5,2026-03-27,5.0,True,66,혜화 맛집 진짜 맛있어요!! 팟타이랑 커리 먹었는데 진짜 맛집!!☺️☺️😻😻 태국 갔었는데 그 맛이랑 진짜 똑같아요😉😉,브론즈 레벨
아시안테이블,박광복,1,5,2026-03-27,5.0,True,31,태국현지의 맛을 느끼고싶다면 추천합니다 😎 아주 맛있어요,브론즈 레벨
아시안테이블,이가혜,1,5,2026-03-26,5.0,True,9,너무 맛있어요~~,브론즈 레벨
아시안테이블,김재진,1,5,2026-03-21,5.0,True,25,너무너무 맛있어용 ㅎㅎ 혜화 맛집입니다!!☺️,브론즈 레벨
아시안테이블,수달덫,65,2.5,2026-03-20,5.0,True,65,진정한 혜화 맛집 개인적으로 생각해도 여기가 혜화에서 제일 태국음식 잘하는거같아요 너무 맛잇습니다 ㅠㅠ 내일 또와야지,실버 레벨
아시안테이블,기영,3,5,2026-03-20,5.0,True,57,와이프가 너무 좋아하는 맛집 같이왔는데 너무 맛있어요>0< 추천해용!! 다음에 또 올께요!!! 🙊🙊❤️,브론즈 레벨
아시안테이블,AIDEN,1,5,2026-03-14,5.0,True,35,식당 입구부터 이미 태국이네요. 음식도 트렌디하고 맛도 좋네요~,브론즈 레벨
아시안테이블,안세은,1,5,2026-03-12,5.0,True,91,분위기다 좋고 근처에 잘 없는 아시안 음식 혜화 맛집이에요~!! 대학가라 접근성도 좋고 음식도 맛있어요! 팟타이랑 땡모반 먹었는데 좋았어요 데이트 장소로 추천합니다,브론즈 레벨
아시안테이블,Chera,1,5,2026-03-11,5.0,True,39,혜화에서 태국 요리 찾기힘든데 좋은 곳이에요!ㅎㅎ 혜화맛집 추가입니다!,브론즈 레벨
아시안테이블,이현,1,5,2026-03-10,5.0,True,57,태국음식 먹고 싶어서 검색하다가 와봤는데 테이블도 크고 맛있네요. 텃만꿍 추천합니다. 혜화맛집입니다!!,브론즈 레벨
아시안테이블,김영빈,2,5,2026-03-10,5.0,True,107,"태국요리 맛집이자 혜화 맛집. 카오카무 강추합니다. 양이 정말 푸짐해서 소식가들은 둘이 먹어도 안 부족할 정도고, 간장소스 감칠맛이 돼지고기와 진짜 궁합이 좋습니다. 태국 특유의 향신료는 덤.",브론즈 레벨
아시안테이블,휘리릭,1,5,2026-03-09,5.0,True,83,"조용한 골목에 있는데, 문 밖에서부터 분위기가 눈에 띄어요. 들어오자마자 여행 온 듯 합니다! 음식도 맛있고, 추천 받아서 온건데 만족하고 갑니다!!",브론즈 레벨
아시안테이블,als,1,5,2026-03-09,5.0,True,9,팟타이가 맛있어요,브론즈 레벨
아시안테이블,황희성,1,5,2026-03-08,5.0,True,70,혜화에 연극보러 와서 가기 좋은 맛집이에요 등뼈쌀국수가 너무 맛있어요 새우살 엄청 많이 들어가요 데이트할때 코스로 넣기 좋은듯,브론즈 레벨
아시안테이블,오잉,7,4.4,2026-03-08,5.0,True,115,혜화맛집으로 알려진 아시안테이블! 태국음식 너무 먹고싶었는데 평이 좋더라구요. 족발덮밥 카오카무 처음 먹어보는데 맛있어요! 느끼한 거 못 먹어서 걱정했는데 소스랑 같이 먹으니까 잘 들어갑니당 종종 올 듯요~,브론즈 레벨
아시안테이블,ㄱ《 서울 ☆ 남자》■■,39,3,2026-03-07,5.0,True,34,나의 최애 혜화 맛집 중 한곳 !! 가격좋고 맛있고 분위기좋고,실버 레벨
아시안테이블,이은지,1,5,2026-03-07,5.0,True,92,혜화 맛집 검색하다가 먹어본 똠얌볶음밥인데 생각보다 훨씬 맛있었어요!! 똠얌 특유의 새콤한 향이 은근히 감돌아서 계속 먹게 되더라고요! 혜화 맛집다운 메뉴였습니다 👍,브론즈 레벨
아시안테이블,이하늘,16,5,2026-03-06,5.0,True,81,동네사람들이라면 다 알만한 혜화맛집. 직원들 데리고 갔는데 다 맛있다고들 난리 솔직히 혜화동 동남아 음식점중에 제일 낫습니다. 메뉴 전무 맛있음!,실버 레벨
아시안테이블,박예린,1,5,2026-03-05,5.0,True,69,새학기 맞이 친구와 왔는데 너무 맛있었어요😍😍 최고의 혜화 맛집!! 분위기도 좋아서 친구나 연인끼리 오면 좋을 것 같아요😀😀,브론즈 레벨
아시안테이블,얌냠뇸,1,5,2026-03-02,5.0,True,37,매장 넓고 분위기 음악도 좋고 음식도 맛있어요 !! ㅎㅎㅎ 추천추천,브론즈 레벨
아시안테이블,Y,2,5,2026-02-28,5.0,True,87,대학로 왔다가 방문했어요^^ 가성비와 맛을 함께 충족시켜준 곳이에요~ 분위기 좋고 직원분 너무 친절해요~ 이런곳 너무 좋아요^^ 기분좋게 잘~먹고 갑니다^^,브론즈 레벨
아시안테이블,이재호,1,5,2026-02-28,5.0,True,139,"첫방문임에도 다양한 좋은 후기 때문에 기대를 품고 방문했습니다. 신혼여행지에서 똠얌꿍을 맛있게 먹었던 터라 똠얌국수와 쌀국수를 주문했습니다. 이후 먹었던 적이 없어 기대반 우려반이었지만, 정말 맛있게, 좋은 기억 그대로 잘 먹었습니다~ 재방문 확정~",브론즈 레벨
아시안테이블,포플러26,1,5,2026-02-27,5.0,True,47,근처에서 공연보고 방문했는데 혜화맛집이네요. 음식 맛있고 가성비 좋아요! 태국음식 굿,브론즈 레벨
아시안테이블,응응,39,3.9,2026-02-26,5.0,True,60,넘넘 맛있어용!!! 또 오고 싶네요🥹🥹😍😍 이런 곳이 있을 줄이야! 소개해준 친구에게 넘넘 고맙네용! 🩵🩵🩵,실버 레벨
아시안테이블,흰수박,1,5,2026-02-25,5.0,True,22,혜화 맛집입니다! 친구들이 다 좋아했어요,브론즈 레벨
아시안테이블,^^,3,5,2026-02-15,5.0,True,60,대학로 놀러왔다가 혜화맛집 으로 나와서 검색해보고 왔어요! 저렴한 가격에 맛있어요 ㅎㅎ 다음에 또 올게요!!,브론즈 레벨
아시안테이블,_imlink,1,5,2026-02-14,5.0,True,77,음식이 정말 맛있고 양도 푸짐했어요. 직원분들도 친절해서 기분 좋게 식사할 수 있었어요. 분위기도 좋아서 다음에 또 방문하고 싶어용!!!!,브론즈 레벨
아시안테이블,뮤뮤,1,5,2026-02-14,5.0,True,67,혜화 맛집 찾아서 왔는데 넘 맛있게 먹고가요~ 앞으로 혜화 데이트 올때마다 찾게 될 것 같아요. 특히 팟타이 추천합니다!,브론즈 레벨
아시안테이블,소희,1,5,2026-02-14,5.0,True,31,너무 맛있어요 다음에 또 방문하겠습니다❤️❤️❤️❤️❤️,브론즈 레벨
아시안테이블,홍정화,10,4.9,2026-02-14,5.0,True,121,음식을 어떤 것을 시켜도 다 맛있네요. 음식도 맛있지만 직원분들도 매우 친절하셔서 먹으면서도 기분 좋게 먹을 수 있었어요.혜화에 이런 맛집이 있는 걸 이제서야 알다니ㅠㅠ 오래오래 사업 번창하세요! 혜화 맛집 인정이요!,실버 레벨
아시안테이블,.,1,5,2026-02-13,5.0,True,108,벼르고 벼르던 혜화 맛집 아시안 테이블에 드디어 와봤다☺️ 식사세트로 먹었는데 둘이서 배터지게 먹고도 제법 남겼을 정도로 양이 많고 맛있어요!🤤 식사 시간대에는 손님이 많은 것 같으니 참고하세용,브론즈 레벨
아시안테이블,태인오,1,5,2026-02-12,5.0,True,69,혜화 맛집 인정합니다. 똠얌누들은 처음드시는 분들은 새콤할 수 있습니다. 뿌빳뽕커리 아주 맛있어요. 텃만꿍도 꼭 드셔보세요.,브론즈 레벨
아시안테이블,박소영,1,5,2026-02-12,5.0,True,51,색다르고 맛있어요 ! 직원분들도 친절하고 추천합니당 혜회맛집인정이구 갓나온 튀김 넘 많있어용,브론즈 레벨
아시안테이블,염우진,1,5,2026-02-09,5.0,True,52,혜화 태국음식 맛집 !! 어떻게 겨울 수박에서 이런맛이 나나 싶은 땡모반 반드시 시키세요 ^^,브론즈 레벨
아시안테이블,김승태,1,5,2026-02-08,5.0,True,68,혜화 맛집이라고해서 방문했는데 인정입니다! 쌀국수도 맛있고 팟타이도 현지에서 먹는 맛이예요! 정말 맛있게 잘 먹고 갑니다!,브론즈 레벨
아시안테이블,강지완,1,5,2026-02-08,5.0,True,79,내부 분위기가 정갈하고 맛있는 냄새가 가득해요 이전에 방문했을때 모닝글로리가 너무 맛있어서 또 먹으러 왔어요! 엄마도 인정한 혜화맛집입니다~~,브론즈 레벨
아시안테이블,김지우,2,5,2026-02-07,5.0,True,47,여름에 와보고 너무 맛있어서 또 왔습니다! 커리 너무 맛있고 팟타이도 완전 추천합니다,브론즈 레벨
아시안테이블,김정희,1,5,2026-02-06,5.0,True,46,여기 맛집입니다. 너무너무 맛있어요!! 똠얌 역시 대박이네요 ㅋㅋㅋ 자주 올께요!!,브론즈 레벨
아시안테이블,곰도리,2,5,2026-02-04,5.0,True,383,"카오카무는 식감이 아주 부드러움. 젓가락만으로도 결이 자연스럽게 풀릴 정도라 먹기 편하고, 간장 베이스 소스가 은은하게 배어 있어 밥이랑 잘 어울림. 특히 같이 나오는 고추소스를 곁들이면 맛의 인상이 확 달라짐. 부드럽고 짭짤한 고기에 매콤하고 살짝 산뜻한 소스가 더해지면서 느끼함을 잡아주고, 전체적으로 훨씬 깔끔하게 마무리되는 조합. 무끄럽은 식감 대비가 인상적인 메뉴. 겉 껍질은 얇고 바삭하고, 안쪽 살은 촉촉해 전체적인 균형이 좋습니다. 기름기가 있는 부위지만 튀김 상태가 깔끔해서 전혀 부담스럽지 않았음. 그냥 먹어도 고소하지만, 함께 나오는 소스에 찍어 먹으면 단맛과 짭짤함이 더해지면서 맛이 한층 또렷해짐. 바삭한 식감과 이런 맛의 조합 덕분에 맥주와도 잘 어울리는 메뉴",브론즈 레벨
아시안테이블,김우섭,1,5,2026-02-03,5.0,True,77,혜화 맛집 아시안 테이블 진짜 너무 맛있습니다! 태국 현지에서 먹었던거 보다 더 맛있어서 놀랐어요 맛있게 잘 먹구 갑니다. 감사합니다 :),브론즈 레벨
아시안테이블,Way Maker,1,4,2026-01-31,4.0,True,69,성균관대 혜화 맛집 자주들러 식사하는 곳 모든 메뉴가 맛의 이국적 풍미를 더하는 곳 꼭 한번 한번 재방문 하는 곳 추천합니다,브론즈 레벨
아시안테이블,유림,1,5,2026-01-30,5.0,True,88,강레오가 심사한 대회에서 우승했다고 써져있어서 족발덮밥 먹었는데 정말 맛있어요!! 팟타이도 깔끔하고 한국에서 이런 맛을 먹을 수 있어서 행복합니다 #혜화 맛집,브론즈 레벨
아시안테이블,김미선 :),1,5,2026-01-30,5.0,True,78,"아이들과 함께 방문했는데, 6살 3살 아이도 맛있게 잘 먹었어요~ 배달로만 시켜 먹다가 와서 먹으니 더 맛있네요^^ 혜화 맛집으로 추천해요👍",브론즈 레벨
아시안테이블,규성,2,5,2026-01-28,5.0,True,69,처음와봤는데 너무 맛있어요 텃만꿍이라고 새우고로케인데 새우 엄청 듬뿍 들어가있고 쌀국수 고기도 많고 소스도 맛있어요 최고👍🏻,브론즈 레벨
아시안테이블,신디신디,1,5,2026-01-24,5.0,True,50,혜화 맛집이라고해서 왔습니다! 세트 양도 많고 다 너무 맛있어서 즐거운 식사였어요~~~~~,브론즈 레벨
아시안테이블,이현우,2,5,2026-01-23,5.0,True,111,연극보러 왔다가 모르고 방문 했는데 여기 찐맛집입니다. 지난 여름 방콕에서 먹었던 현지 음식 맛 보다 맛있어요! 가격도 적당하구! 주변 산다면 자주 올거같애요 특히 족발 덮밥은 양도 많으니 추천합니다,브론즈 레벨
아시안테이블,Kwangdeok Ahn,1,5,2026-01-20,5.0,True,75,"혜화 맛집이네요. 직장 동료들과 점심으로 먹으러 태국요리 찾다가 방문했습니다. 분위기, 맛, 가성비 모두 만족입니다. 또 오고 싶어요~",브론즈 레벨
아시안테이블,제이크,2,5,2026-01-19,5.0,True,37,처음 방문했는데 아늑한 분위기에 친절하고 맛있습니다. 강추합니다!!,브론즈 레벨
아시안테이블,김유민,1,5,2026-01-17,5.0,True,133,혜화 맛집입니다! 아시아 테이블 맛있어요~~~~~~~~~ 카오카무랑 밀크티랑 등뼈쌀국수 시켜먹었는데 너무 맛나네요 다음에도 또 오겠습니다 꼭 시켜드세요 강추에요! 운 좋게 웨이팅 없이 들어갔는데 시간대 잘 보고 예약해서 들어가시길 추천해요,브론즈 레벨
아시안테이블,박상민,1,5,2026-01-17,5.0,True,38,"등뼈쌀국수, 뿌팟퐁커리, 새우튀김 너무 맛있어요! 강력추천 등뼈칼국수",브론즈 레벨
아시안테이블,김정도,1,5,2026-01-16,5.0,True,76,다양한 음식을 먹을 수 있어서 좋았어요~ 모닝글로리 푸팟퐁커리 똠양꿍 이렇게 시켰는데 맛있게 잘 먹고 가요 완전 맛나고 분위기도 좋습니다,브론즈 레벨
아시안테이블,조선미,1,5,2026-01-16,5.0,False,32,혜화맛집 아시안테이블 푸파뽕커리 분위기도 좋고 맛도 좋아요,브론즈 레벨
아시안테이블,정병수,23,3.9,2026-01-11,4.0,True,79,가성비 좋은 맛집이네요. 오래 기다릴 정도는 아니지만 실패하지는 않을 맛. 취향을 타는 메뉴도 있음. 멀리서 이 식당을 위해 올 저도는 아님.,실버 레벨
아시안테이블,오주현,2,4.5,2026-01-10,4.0,True,64,"혜화 맛집 아시안 테이블☺️ 처음 와봤는데 매장 분위기도 좋고, 음식 퀄리티도 좋습니다 다음에 또 올 것 같아요👍🏻",브론즈 레벨
아시안테이블,신성희,1,5,2026-01-08,5.0,True,100,#혜화맛집#랭쌥맛집#태국음식맛집 임신중인데 태국음식 너무 땡겨서 왔어요 랭쌥 진짜 너무 맛있어서 공기밥도 말았어요 맘같아선 메뉴 다 먹어보고 가고싶어요 태국음식 강력추천해요~👍👍👍,브론즈 레벨
아시안테이블,하지원,1,5,2026-01-08,5.0,True,111,매장 분위기도 너무 좋구 음식도 정말 빨리 나와요!! 그리구 푸팟퐁커리가 14000원이라니.. 진짜 가성비 갑.. 또 오고 싶어요!!😊😊😊 그리고 새우고로게는 필수!!! 양도 많구 맛있게 잘먹었습니다,브론즈 레벨
아시안테이블,레이,2,4.5,2026-01-07,5.0,True,110,수업끝나고 저녁먹으러가고 혜화 맛집이 찾았다. 유학생이라 태국음식을 그리워해서 여기 아로이테이블 첫방문인데 최고다. 카우카무하고 무끄럽 주문했는데 완전 맛있다. 분위기도 좋고 여기한번 꼭 가보세요.,브론즈 레벨
아시안테이블,최재우,1,5,2026-01-05,5.0,True,116,태국 음식이 먹고 싶어서 혜화 맛집 중 태국 음식점을 찾다가 아시안테이블을 발견하여 오게 되었는데 음식이 너무 맛있고 가게 분위기도 좋아서 다음에 꼭 또 방문하고 싶다고 생각했어요! 맛있게 잘 먹고 갑니다~~,브론즈 레벨
아시안테이블,metacognition,364,4.8,2026-01-03,5.0,True,23,음식도 빨리나오고 다 맛있었어요 !!!^^,골드 레벨
아시안테이블,김예나,1,5,2025-12-31,5.0,True,51,매장 분위기도 좋고 직원 분들도 친절하세요! 음식들도 맛있었습니당 다음에 또 오고 싶어요!!,브론즈 레벨
아시안테이블,홍지협,1,5,2025-12-25,5.0,False,73,"진짜 태국에 온 느낌들어서 좋았어요! 데이트하기 좋은 장소이고, 현지에 온 느낌들어서 좋았어요! 끝나고 연극보기 좋은 위치에 있어용",브론즈 레벨
아시안테이블,ian Kim,1,5,2025-12-24,5.0,True,60,"혜화 맛집, 태국에 온듯한 분위기가 좋네요! 크리스마스에도 오기 좋은 곳이에요! 재방문 의사 200%입니다!",브론즈 레벨
아시안테이블,가나다,2,3,2025-12-20,5.0,True,26,푸팟퐁 커리 맛있어요:) 종종 오는 혜화 맛집!,브론즈 레벨
아시안테이블,죠스,1,5,2025-12-18,5.0,True,135,"처음 방문해보는데 가게 분위기도 너무 좋고 무엇보다도 음식이 너무 맛있어요 ㅠㅠ❤️ 족발덮밥 시켰는데 국물?이 깔끔하고 족발도 너무 부드럽고 ㄹㅇ 맛있어요 !! 혜화숨은맛집,, 인정합니다 다음엔 또 다른 메뉴 먹으러 친구랑 방문할게요 ㅎㅎㅎㅎ",브론즈 레벨
아시안테이블,미혜,3,5,2025-12-17,5.0,True,15,너무너무너무 맛있어요!!!😈,브론즈 레벨
아시안테이블,dkledk,3,2.3,2025-12-14,5.0,True,52,진짜 맛있아요 혜호ㅏ 맛집 인정!!! 새우가 너무 통통하고 음식 전반 퀄리티가 너무 높아요ㅠㅠ,브론즈 레벨
아시안테이블,이것저것,1,5,2025-12-13,5.0,False,83,"주말에 가족과 방문 아담한 가게인데 엄청 많은 사람에 놀랬네요 똠양꿍, 솜땀 맛있게 먹고왔어요 인테리어도 현지온듯, 직원들도 친절하셔서 아주 좋아요!",브론즈 레벨
아시안테이블,희함,1,5,2025-12-12,5.0,True,15,대학로 최고의 태식집❤️❤️,브론즈 레벨
아시안테이블,황명주,1,5,2025-12-09,5.0,True,106,오늘 처음으로 태국음식을 먹으러 왔어요. 혜화 맛집이라고 소문난 곳에서 처음 도전해봤어요. 같이 온 베트남 친구도 맛있다고 했어요. 한국인인 저도 맛있게 잘 먹었어요. 다음에 또 올게요 🤓👍,브론즈 레벨
아시안테이블,심주연,1,5,2025-12-07,5.0,True,86,“혜화 맛집” 태국에서 거주했어서 주기적으로 태국음식 먹어줘야돼서 찾아보다가 학교 근처라 와봤어요! 세트메뉴 있어서 좋고 넘 맛있어요~ 자주 생각날것같아요,브론즈 레벨
아시안테이블,S,3,5,2025-12-07,5.0,True,36,성대 맛집이네요. 맛있어요~ 분위기두 괜찮구요! 담에 또 올게요!,브론즈 레벨
아시안테이블,이의석,3,5,2025-12-06,5.0,True,44,분위기도 너무좋고 음식이 다 맛있어요~ 특히 족발덮밥 카오카무가 너무맛있어요~~,브론즈 레벨
아시안테이블,웨지감자,109,2.3,2025-11-29,5.0,True,55,벌써 N 번째 방문한 곳.. 혜화 맛집 인정합니다. 푸팟퐁 커리 맛있어요!! 분위기도 너무 좋아요!,실버 레벨
아시안테이블,전빈,1,5,2025-11-22,5.0,True,53,너무맛있어요 눈도즐겁고 태국음식의 진수를 맛볼 수 있었습니다! 커리랑 족발덮밥 다 맛있어요 ㅎㅎ,브론즈 레벨
아시안테이블,신희규,1,5,2025-11-21,5.0,True,95,"혜화 아시안 음식 맛집. 혜화 맛집 중 하나로 태국 음식 먹고 싶으면 자주 오는 곳입니다. 고기 덮밥 사라진게 너무 아쉽지만, 텃만쿵이랑 똠얌 누들도 맛있어서 강추요~~~",브론즈 레벨
아시안테이블,땡모반,1,5,2025-11-19,5.0,True,28,음식 너무 맛있고 깔끔해요! 재방문 의사 있습니다~,브론즈 레벨
아시안테이블,황주현,1,5,2025-11-16,5.0,True,49,가격.맛.너무괜찬고 직원분들도 친절하고 편안히 식사할수있어서 너무좋았습니다! 추천드려요~,브론즈 레벨
아시안테이블,??,2,3,2025-11-15,5.0,True,90,태국음식이 땡겼는데 후기가 좋아서 와봤어요 혜화 맛집인데 겉모습부터 찐의 느낌이었는데 맛도 좋아요 양이 엄청많은 느낌은 아닌데 다양한 메뉴가 있어서 맛보기 좋아요,브론즈 레벨
아시안테이블,Seo Sunkyoung,2,5,2025-11-15,5.0,True,124,혜화역 올 일이 있어서 혜화맛집 검색해서 찾아왔어요 분위기 너무 좋고 음식도 정말 맛있었어요 11시 조금 넘어서 왔더니 줄서지 않고 바로 들어왔는데 음식 나올때쯤 테이블도 꽉 차고 대기가 시작 되네요 혜화역 맛집 인정!!!,브론즈 레벨
아시안테이블,장재영,1,5,2025-11-14,5.0,True,45,음식도 맛있고 분위기도 좋아요~ 랭쌥 강추입니다 ㅎㅎ 양도 많고 맛있게 먹었어요!,브론즈 레벨
아시안테이블,ㅈㅎ,2,5,2025-11-12,5.0,True,81,주변에서 평이 좋아서 계속 와보려고 생각만 하다가 드디어 와봤는데 평이 왜 좋았는지 알 것 같아요 맛있고 분위기도 좋네요 다음에 또 와야겠어요!!,브론즈 레벨
아시안테이블,토비,4,2.8,2025-11-12,5.0,True,158,재방문입니다. 뿌빳퐁 커리랑 팟타이 먹어봤는데 둘다 맛있었어요. 뿌빳퐁 크랩이 부드럽고 달달한 커리랑 잘 어울려요. 다만 튀김이다보니 먹다보면 약간 느끼할 수 있으니 음료랑 같이 먹는 걸 추천합니다. 혼밥하기도 좋고 대학가라 가격대도 괜찮아요. 혜화 동남아 음식 맛집으로 추천합니다.,브론즈 레벨
아시안테이블,SJ,1,5,2025-11-09,5.0,True,67,"팟타이랑 카오카무 시켰는데 둘다 맛있었어요! 우선 가성비가 좋네요, 새우도 많이 들어가있고 족발 크기도ㅋㅋㅋ 혜화 맛집👍",브론즈 레벨
아시안테이블,oneonone,2,5,2025-11-07,5.0,True,58,이국적인 식당 분위기가 좋았습니다. 음식도 맛있었고 플레이팅이 되게 예뻤어요. 또 오고 싶은 식당입니다.,브론즈 레벨
아시안테이블,이신희,1,5,2025-11-04,5.0,True,73,혜화맛집이라고 해서 와봤는데 너무너무 맛있고 친절해용!! 고양이도 기웃기웃거리고 분위기도 너무 좋고 가게가 이뻐서 또 올것같아요!!,브론즈 레벨
아시안테이블,이하윤,1,5,2025-11-03,5.0,True,51,혜화맛집입니다 이 동네 살면서 꾸준히 한달에 한번씩은 가는 거 같아요! 팟타이 꼭 드셔보세요,브론즈 레벨
아시안테이블,김재성,1,5,2025-11-02,5.0,True,42,너무 친절하고 맛있어서 기분좋아지는 식당이에요. 혜화 맛집으로 추천입니다!!,브론즈 레벨
아시안테이블,행복을찾아서,2,5,2025-11-01,5.0,True,109,명륜당 놀러와서 아무 정보 없이 뭘 먹어야하나 엄청 고민하던 와중 찾은 아로이테이블 ! 저희는 세트메뉴 먹었는데 세가지 음식 다 맛있었어요!! 사람 많은 이유가 있네요 ㅎㅎ혜화 맛집 찐 추천이요!,브론즈 레벨
아시안테이블,방서연,1,5,2025-11-01,5.0,True,85,둘이서 메뉴 4개시켰는데 너무 맛있어서 다 먹었어요ㅎㅎㅎ 특히 까오까무!! 고기가 너무 부드럽고 국물도 짜지않고 간이 딱맞아서 계속 들어가는맛입니다!!!,브론즈 레벨
아시안테이블,양승용,1,5,2025-11-01,5.0,True,115,혜화에서 먹을 수 있는 아시안 음식 혜화 맛집이에요. 배달로도 시켜먹고 직접 와서도 먹는데 맛있어요. 분위기 있어서 데이트로 오기도 좋고 걍 친구랑 오기도 좋아요. 족발덮밥 (카오카무) 맛있음 카오카무 드셈,브론즈 레벨
