아시안테이블,이상헌,1,5,2025-10-31,5.0,True,90,식당 분위기부터 엄청 좋고 음식들이 다 맛있어요 ㅎㅎ 똠양꿍이랑 팟타이 먹었는데 똠양꿍은 먹어본 곳 중에서 제일 맛있는거 같네요😊 혜화 맛집으로 추천드립니다 !!,브론즈 레벨
아시안테이블,시은,3,5,2025-10-30,5.0,True,64,"맛있어서 타이 음식 생각날 때마다 종종 오는 곳입니다! 특히 팟타이, 푸팟퐁커리, 모닝글로리 볶음이 완전 제 취향😘",브론즈 레벨
아시안테이블,시니이,2,5,2025-10-30,5.0,True,58,처음 오는데 분위기가 넘 좋고 음식이 깔끔하고 맛있어요!! 똠얌꿍이랑 팟타이 다 맛있어요!! #혜화 맛집,브론즈 레벨
아시안테이블,김해영(강현 도율),1,5,2025-10-30,5.0,True,100,여기 분위기도 좋고 직원분들 엄청 친절하세요~~~혜화맛집입니다^^수박주스도 넘 예뻐요~~~아기자기 분위기 최고입니다^^~~~~맛도 최고입니다^^가본 태국음식점중에 젤 맛있어요^^♡,브론즈 레벨
아시안테이블,안예진,1,5,2025-10-29,5.0,False,66,진짜 찐 혜화맛집이에여!! 너무 맛있어요 혜화역에서 친구 만나면 꼭 여기와서 먹을꺼에욥!! 진짜 완전 추천드려요!!😊😊,브론즈 레벨
아시안테이블,성아,2,5,2025-10-29,5.0,True,66,와.. 우연히 들어왔는데 엄청난 맛집이었네요 새우튀김 쌀국수 푸팟퐁커리 다 맛도리에요 친절하시고 매장분위기도 좋아요!!,브론즈 레벨
아시안테이블,정우진,5,5,2025-10-28,5.0,True,59,아시안테이블이 혜화에서 유명한 태국음식 맛집이라고 해서 연극보고나서 왔습니다 홀도 멋있고 음식도 훌륭하네오,브론즈 레벨
아시안테이블,연우,1,5,2025-10-28,5.0,True,10,맛있고 친절해용!!,브론즈 레벨
아시안테이블,이윤기 Peter Lee,58,3.7,2025-10-25,1.0,False,68,음식 서빙하는 순서도 그렇고 예약 관리도 그렇고. 두번 오지는 않을것 같음. 학교 앞이라 학생들이 먹어줘서 가게 운영되는듯,실버 레벨
아시안테이블,악에받칠때만욕함,93,3.1,2025-09-22,5.0,True,30,존맛탱. 성대생이었으면 일주일에 한번은 갔을듯. 가성비,실버 레벨
아시안테이블,sb,2,3,2025-08-25,1.0,True,182,"🤬학교 다닐 내내 자주 갔던 식당이라 졸업식날 부모님 데리고 마지막으로 먹으려고 5일전쯤 예약하고 갔는데...자리가 없대요;; 예약했는데 자리가 없다는건 뭐죠? 사과 한마디 없고, 어리버리한 알바생은 어쩔줄 몰라하고 주방이랑 홀만 왔다리 갔다리🤣 아무도 사과도 안하고 나와보지도 않더라고요. 이런일은 태어나서 첨이라 황당하네요",브론즈 레벨
아시안테이블,DD,9,2.9,2025-08-25,5.0,False,16,자주오는 집이예요 맛잇어요!!,브론즈 레벨
아시안테이블,짱이,7,4.9,2025-07-31,5.0,True,82,똠얌꿍이랑 푸팟퐁커리 둘다 성공적이에요! 근데 향신료 잘 못 먹는 친구는 똠얌꿍 조금 어려워 했는데 태국 음식 좋아하는 사람이면 잘 먹을거 같아요!,실버 레벨
아시안테이블,제 평가는요.,352,3.7,2025-07-19,5.0,False,38,존맛탱ㅜ똠양꿍도 맛있고 푸팟퐁커리 넘 맛있어요 무엇보다 가성비가 좋음,골드 레벨
아시안테이블,수박,6,5,2025-07-18,5.0,True,31,맛있어요! 재방문인데 같이 온 친구들도 다 만족했어요👍🏻,실버 레벨
아시안테이블,김준영,1,5,2025-07-12,5.0,True,53,혜화에 몇 없는 팟타이 맛집입니다 가격도 저렴하고 직원분들도 친절하셔서 맛있게 먹을 수 있습니다,브론즈 레벨
아시안테이블,구교윤,1,5,2025-07-03,5.0,True,73,4번째 방문했는데 너무 맛있어요! 식당 내부도 너무 쾌적하고 분위기도 좋습니다! 특히 푸팟퐁커리는 너무 맛있어서 항상 시켜먹었어요!,브론즈 레벨
아시안테이블,20,30,4.8,2025-06-23,5.0,True,42,"사장님이 너무 잘생기셨고, 너무너무 맛있아요 😋😋 현지 보다 더 맛난..!!",실버 레벨
아시안테이블,시골쥐,25,3.9,2025-06-13,5.0,True,84,세트를 해야됨 무조건 세트에 같이 나오는 새우튀김? 고로케? 같은게 있는데 ㄹㅈㄷ임 진짜 맛있음 팟타이랑 볶음밥도 기대 이상이었음 재방문 자주하는 집임,실버 레벨
아시안테이블,김민석,26,4.6,2025-06-09,5.0,True,30,덕분에 기분좋게 맛있는 저녁식사 했습니다. 번창하세요.,실버 레벨
아시안테이블,백효은,1,5,2025-06-03,5.0,True,81,오랜만에 타이음식 먹으러 왔어요. 사람들 많아서 기다려 들어왔어요. 주문 들어가는 동시에 음식을 만들어 주시나 봐요. 혜화동 맛집 인정입니다. 😄,브론즈 레벨
아시안테이블,민서,4,4,2025-05-30,5.0,True,92,혜화 맛집이에요! 맛있고 가게도 깔끔해서 너무 좋은 것 같아요!! 친구랑 같이 방문해서 너무 맛있게 먹었습니다!! 다음에 또 올 것 같아요~ 👍 분위기도 너무 좋아요,브론즈 레벨
아시안테이블,주은서,1,5,2025-05-30,5.0,False,152,"풍팟퐁 커리랑 팟타이를 먹었는데, 생각보다 진짜 맛있었어요 ~! 풍팟퐁 커리 향이 진해서 밥이랑 같이 먹으니까 계속 손이 가더라고요~ 팟타이는 면발이 쫄깃하고 소스가 새콤달콤해서 입맛에 딱 맞았어요!! 전체적으로 자극적이지 않고 부담 없이 먹기 좋아서 또 가고 싶어요 :)",브론즈 레벨
아시안테이블,이현진,1,5,2025-05-28,5.0,True,55,맛있어요 완전 혜화 맛집 학교 다니면서 가성비로 먹기 딱 좋아요 가격도 착하고 맛도 좋은 집 ^_^,브론즈 레벨
아시안테이블,리리,5,5,2025-05-28,5.0,True,111,똠얌꿍하나 먹으러 상암에서 혜화까지 왔어용 ㅎㅎ 서울 여기저기서 먹어봤지만 여기 똠얌꿍이 젤 맛있어요.. ㅎㅎ 고수도 많이 주셔서 늘 만족하며 먹고 있습니다 !! 나시고랭도 토핑이 엄청 실해서 좋아욤,브론즈 레벨
아시안테이블,슽엘라,1,5,2025-05-27,5.0,True,58,혜화의 숨겨진 맛집이에요!!!! 태국 음식 땡기시면 고민없이 여기 오시면 됩니다~~~ 자주 방문할게요!!,브론즈 레벨
아시안테이블,최수경,1,4,2025-05-23,4.0,True,137,혜화맛집 인정!! 태국 여행을 다녀온 후 태국음식의 맛에 눈을 떴어요. 이곳저곳 갈때마다 태국음식점을 검색해보곤 했는데 혜화에 딱있어요. 분위기도 태국스럽고 맛도 한국인에게 맞게 요리하셨는지 더 먹기 편하네요~ 특히 모닝글로리는 꼭 잡셔보세요!!,브론즈 레벨
아시안테이블,알타리,2,5,2025-05-19,5.0,False,72,아시안테이블 너무 조아욤 ~ 태국 베트남 음식 생각날 땐 항상 여기로 오는것 같아용 ㅎㅎ 음식도 다양하고 분위기도 너무 좋습니다!,브론즈 레벨
아시안테이블,Amor vincit omnia,1,5,2025-05-12,5.0,False,50,집 근처 자주 오는 식당입니다. 맛 좋아요. 가성비 말할것도 없어요. 무조건 오면 됩니다.,브론즈 레벨
