식당 이름,계정 ID,계정의 리뷰 수,방문 날짜,방문 횟수,인증 수단,리뷰 내용,리뷰 글자 수,리뷰 내 사진 유무
혜화도담,보배01,39,2026.04.10,1번째 방문,영수증,혜화에서 약속 있어서 오랜만에 친구들이랑 왔어요!! 양도 너무 푸짐하고 갈비찜이랑 전이 진짜 맛있어요 ㅜ.ㅜ 재방문 의사 완전 있습니다!! 혜화 맛집 인정이요 ㅎㅎㅎ,92,True
혜화도담,hee****,27,2026.04.09,1번째 방문,영수증,김치찜이 무척 부드럽고 삼삼합니다. 가성비도 좋고 맛도 좋습니다.,36,True
혜화도담,김서빈78,8,2026.04.09,1번째 방문,영수증,올 때마다 늘 맛있게 먹는 혜화도담 !!! 아버지가 동네에 놀러오셔서 모시고 왔어요! 둘 다 대만족하고 갑니다,61,True
혜화도담,냠냠냐냐,20,2026.04.09,1번째 방문,영수증,너무 맛있어요 비주얼도 너무 좋습니다 두부가 은근 매력이니 꼭 드세요!,39,True
혜화도담,단돌잉,31,2026.04.09,1번째 방문,영수증,대학 사람들과 술마시러 왔는데 맛있고 좋아요 나이스 파전이 빠삭하고 좋아요,41,True
혜화도담,The Fixer,35,2026.04.08,1번째 방문,영수증,김치찜 2인 양이 암청 많아요! 여기 밥도 무한이고!! 반찬도 셀프로 가져다 먹을 수 있어요! 여러분 꼭 와보세요! 제가 감히 강추합니다!!,78,True
혜화도담,kim****,40,2026.04.08,1번째 방문,영수증,음식이 빨리 나오고 너무 맛있는데 사장님도 너무 친절하셔서 좋아요 혜화 맛집!,43,True
혜화도담,민재홍24,15,2026.04.08,1번째 방문,영수증,혜화근무중이라 마싯는 한식 먹으러 올때 생각나서 오는 곳입니다. 올때마다 만족하고 배부르게 먹고갑니다! 막걸리도 점심엔 서비스도 주시는데 근무때문에 못마시는게 한이네요,93,True
혜화도담,설아74,21,2026.04.08,1번째 방문,영수증,"고기가 매우 부드럽고 기름기가 적어서 깔끔해요. 국물을 마셔도 많이 짜지 않을 정도라 집밥 느낌이에요. 김치도 딱 적당히 익은 김치라 많이 시지도 않고 자연스러운 맛이에요. 최적의 김치찜. 밥 셀프라 양껏 먹을수 있고, 밑반찬도 맛있어요.",133,True
혜화도담,크래커34,14,2026.04.08,1번째 방문,영수증,우연히 지인과함께 왔습니다. 와....맛양. ㅁ정말 이런집 간만입니다!! 굿굿,43,True
혜화도담,abcdefghi000,6,2026.04.07,1번째 방문,영수증,말해 뭐해.. 김치찜은 여기가 1등이에요. 고기 양도 푸짐하고 김치 맛이 깊어서 국물 한 방울 안 남기고 다 먹었습니다. 반찬도 깔끔하고 신선해서 항상 기분 좋게 식사하고 가네요. 시험 끝난 날 친구들이랑 기분 좋게 막걸리 한잔씩 하고 갑니다~~,137,True
혜화도담,ded****,2,2026.04.07,1번째 방문,영수증,8시 쯤에 학교 친구들과 방문했습니다~~ 양도 많고 사장님도 친절하셔서 좋았어요! 한식 메뉴로 모임하고 싶으신 분들께 추천드,69,True
혜화도담,wog****,22,2026.04.07,1번째 방문,영수증,데이트하러 혜화왔다가 또간집에 나왔다는 도담왔는데 너무 맛있고 다음에도 재방문의사 있어요👍👍너무 맛도리!강추요~👍,63,True
혜화도담,나현5415,29,2026.04.07,1번째 방문,영수증,친한 언니랑 오랜만에 만나서 저녁 먹으려구 방문했는데 너무 맛있었어요!! 친절하시고 양도 많았어요 다음에 지인 데리고 또 올게요!!❤️,75,True
혜화도담,마지스,14,2026.04.07,1번째 방문,영수증,지인과 뮤지컬보기 전 들렸습니다. 김치찜이 집밥같이 맛있고 공기밥 무한에 대파전은 완전 바삭바삭 막걸리에 딱입니다,63,True
혜화도담,아요바요,342,2026.04.06,1번째 방문,영수증,엄마 생신이어서 가족모임으로 왔는데 정말 탁월한 선택이었어요. 김치찜 대파전 낙지볶음 갈비찜 메뉴가 다 맛있네요. 혜화동 대학로 제일 맛집입니다!!!,83,True
혜화도담,ght****,164,2026.04.05,1번째 방문,영수증,혜화와서 처음먹어본 김치찜…너무 맛있웄어요 비빔밥도 무조건 필수에요! 사장님도 너무 친절하시고 외국인들도 진짜 많이 와요👍🏻,69,True
혜화도담,ox****,96,2026.04.05,1번째 방문,영수증,운좋게 자리가 하나 남아있어서 들어왔는데 너무너무 맛있어용 사장님도 친절하시구 콜키지 무료에 점심엔 막걸리도 주시는 거 같아서 담번엔 막걸리 먹으러도 올게요... 두부도 뜨끈뜨끈 너무 맛잇어요 ㅜㅜ,110,True
혜화도담,wjkajtopgpo12,6,2026.04.05,1번째 방문,영수증,첫방문인데 넘 만족합니다!! 다음엔 막걸리 먹으러 오고싶어요ㅎㅎ,35,True
혜화도담,메르 씨,255,2026.04.05,1번째 방문,영수증,엄마랑 같이 왔는데 건강하고 맛있어용 사장님도 친절하셔서 좋아요,35,True
혜화도담,배고픈곰33,53,2026.04.05,1번째 방문,영수증,너무 너무 맛있어요 가족 모임하기 좋아요 사장님 하이닉스처럼 성가금 직원들 주시고 유럽여행도 다녀오세요,57,True
혜화도담,잠꾸러기2746,24,2026.04.05,1번째 방문,영수증,자주 오는 맛집입니다!! 대파파전이 특히 바삭하고 시간이 지나도 맛있어요~~,42,True
혜화도담,장래희망 뽀로로,33,2026.04.05,2번째 방문,영수증,제가 너무 사랑하는 혜화도담💕 항상 올 때마다 너무너무 맛있게 먹고 갔는데 리뷰는 처음 남기는 것 같아 죄송한 마음… 여기 김치찜은 둘이 먹다 열이 쓰러져도 모를 맛이에요ㅠㅠ 김치찜의 생명은 역시 김치!!! 이 집은 김치가 찐입니다!!! 항상 올 때 마다 갈비찜이냐 김치찜이냐 고민하가 김치찜을 시키게 된다는.. 그치만 언젠가!!! 갈비찜도 먹어 볼 거에요!!! 그리고 꼭꼭 두부도 드셔보세요!! 막걸리도 당연히 함께여야 하구요! 부모님도 꼭 모시고 다시 방문할 거에요! 다음에 또 봬요 사장님!,277,True
혜화도담,dkd****,18,2026.04.04,1번째 방문,영수증,저렴하고 맛있습니당,10,True
혜화도담,jun141957,50,2026.04.04,1번째 방문,영수증,김치찜에 고기도 많고 맛있어요! 대파전도 먹었는데 너무 맛있어서 한달에 두번은 옵니다👍👍,49,True
혜화도담,mmmaaannng9,23,2026.04.04,1번째 방문,영수증,여러번 온 맛집이에용 ㅎㅎ 넘 맛있으니 ㅊ추천합니다!,29,True
혜화도담,영아9679,28,2026.04.04,1번째 방문,영수증,혜화 올때마다 생각나는 맛집! 맛있게 잘 먹었습니다!,29,True
혜화도담,탄에,2,2026.04.04,1번째 방문,영수증,져는 이것보다 맛있는 김치찜을 먹어본 적이 없습니다. 사실 김치찜뿐만 아니라 파전도 막걸리도 다 너무 맛있어요😋😋 집만 가까웠다면 매일매일 오고 싶은 맛이에요!!! 짱,93,True
혜화도담,하마52,6,2026.04.04,1번째 방문,영수증,주변 맛집 검색해서 왔는데 역시 최고네요 김치찜은 원래도 좋아하는 메뉴인데다가 맛도 진짜 좋구요 더불어 야채전은 완전 강추!! 오늘 메뉴 선택 잘함 ㅋㅋㅋ,86,True
혜화도담,햇반32,5,2026.04.04,1번째 방문,영수증,맛집이라고 검색하고 왔는데 너무 친절하시고 맛도 좋아요 밥도 셀프바에서 자유롭게 먹을 수 있고 너무 좋습니다! 웨이팅도 금방 끝나서 들어갔어요~,80,True
혜화도담,bluehsp,36,2026.04.03,1번째 방문,영수증,"혜화역 오랜만에 오게 되서 맛집 찾았어요. 이 골목안에 이런 맛집이 숨어 있을 줄 몰랐어요^^ 점심 런치로 김치찜 먹었는데, 김치가 정말 잘 익어서 너무 맛있고, 고기는 완전 장조림 같이 야들야들 하면서 쭉쭉 찢어져요. 점심런치라 막걸리도 무제한으로 서비스 주시는 데 오랜만에 기분 냈어요. 기본 반찬도 너무 맛있는 거 보니 음식솜씨가 정말 좋은 집 같아요. 점심 때 왔지만 저녁에 온 것 같은 흥겨운 기분으로 식사하고 갑니다 ^^",241,True
혜화도담,cky****,15,2026.04.03,1번째 방문,영수증,고기도 야들하고 김치가 너무 맛있어요!!! 다음에 또 오고싶어용 ~~,38,True
혜화도담,hyj****,26,2026.04.03,1번째 방문,영수증,김치찜도 파전도 맛있어요!! 점심에 가면 막걸리도 무료고 너무 좋아요~,39,True
혜화도담,julie4327,24,2026.04.03,1번째 방문,영수증,"김치찜, 갈비찜 너무 부드럽고요, 안쪽에서 먹었는데 야장처럼 먹을수있어요 따뜻하게. 대파전은 무조건이에요. 야채튀김같고 술안주로 좋습니당~~~",79,True
혜화도담,sy0728,46,2026.04.03,1번째 방문,영수증,음식 빨리나오고 김치찜 낙지볶음 다 짱맛!!!,25,True
혜화도담,닭크수,22,2026.04.03,1번째 방문,영수증,오자마자 대기할뻔했는데 타이밍맞아서 바로입장했어요!! 음식 빠르게 나오고 무엇보다 너무 맛있습니다!!! 매장 깔끔하고 다 만족스럽네요!÷),77,True
혜화도담,파아란2915,39,2026.04.03,1번째 방문,영수증,"연극으로 유명한 혜화 맛집! 너무 맛있어요ㅎㅎ 벽에도 싸인이 가득하네요! 친구랑 같이 먹으러 왔는데 행복해요ㅎㅎ 평일 점심은 막걸리도 무료입니다! 대학로, 혜화, 낙산공원 오시면 꼭 들러야 할 맛집!! 고민 중이시면 꼭 오세요!!",128,True
혜화도담,하은쿵야,11,2026.04.03,1번째 방문,영수증,남자친구랑 혜화 데이트 와서 맛있는 한식집 찾다가 발견했는데 양도 많고 구성이 알차서 좋았어요 밥도 무한리필이어서 좋았습니다 맛있게 먹고 가요!!,81,True
혜화도담,dae****,9,2026.04.02,1번째 방문,영수증,"오랜만에 초등학교 동창들을 만나러 혜화에 왔는데, 혜화 제일 가는 맛집이 도담이라는 이야기를 듣고 방문하게 되었습니다! 음식 양도 푸짐하고 정말 맛있었어요!!",88,True
혜화도담,웰리스잉,34,2026.04.02,1번째 방문,영수증,평일 낮 막걸리 제공도 좋고 분위기도 너무 좋아요 ~ 사장님 친절하고 대파전 너무 맛나요 ! 늘 모임마다 찾는 장소입니다,67,True
혜화도담,재마니,12,2026.04.02,1번째 방문,영수증,직장이 혜화역 근처라 점심회식겸 식사로 들렸는데 분위기도 좋고 일단 맛있어요 김치찜이 너무 맛있고 파전 바삭바삭하니 좋네요 친절하셔서 회식이나 식사로 또 방문해도 좋을거 같아요,98,True
혜화도담,짱여사2531,380,2026.04.02,1번째 방문,영수증,맛있어요. 자주자주 올께요.,15,True
혜화도담,AC75,8,2026.04.01,1번째 방문,영수증,"장소, 분위기, 맛 세가지를 모두 잡은 곳 혜화도담 믿고 오셔도 됩니다! ❤️",43,True
혜화도담,Robin8399,15,2026.03.31,1번째 방문,영수증,정갈하고 맛있습니다~~! 대학생들 밥약하기도 좋아요,28,True
혜화도담,미인둥,130,2026.03.31,1번째 방문,영수증,연극보고 매콤한 한식이 땡겨서 방문한 혜화도담! 김치찜이.. 진짜 10시간 푹.. 끓인 깊은맛이나고 고기가 씹지않아도 입에서 사르르.. 녹아요 ㅜ ㅜ 두부는 선택이 아닌 필수!! 대파전이 달달~~ 바삭하니 막걸리랑 찰떡궁합!! 너무 맛있게먹고갑니다♡♡,140,True
혜화도담,챛채님,20,2026.03.31,1번째 방문,영수증,야들야들하고 달짝찌근한ㅠㅠ 김치찜은 여기말곤 없더라구요🥺✨ 올때마다 사람도 많고 엄마가 해준 김치찜 생각날 때 또 올게요~~~~!!,73,True
혜화도담,mas****,26,2026.03.30,1번째 방문,영수증,"친구와 함께 혜화에 왔는데, 맛있는 음식이 먹고 싶어 찾아왔어요^^ 만족스럽습니다",45,True
혜화도담,감정의 마천루,4,2026.03.30,1번째 방문,영수증,2인 김치찜 세트를 먹었는데 양도 많고 너무너무 맛있습니다! 다음에 또 오고싶을 정도로 만족스러워요 밥도 무한리필이고 막걸리 종류도 고를 수 있어서 너무 좋았습니다😀,92,True
혜화도담,별명뭘로지어줄까,18,2026.03.30,2번째 방문,영수증,여기만 오면 음식과 술에 취해서 갑니다~ 항상 맛있는 음식에 감사드려요! 항상 번창하시고 오래오래 장사해주세요👍,62,True
혜화도담,구룡마트,36,2026.03.29,1번째 방문,영수증,패스트푸드에요! 맛있는데 빨리 나와서 더 좋았어요 ㅎㅎ,30,True
혜화도담,정채연51,35,2026.03.29,1번째 방문,영수증,오랜만에 친구들이랑 만나서 연극보고 밥먹으러왔는데 김치찜이 진짜 너무 맛있어요! 밥은 먹을만큼 직접 담아서 먹을 수 있어서 좋아요. 고기도 부드러워서 맛있네요 저는 특히 파전이 바삭해서 맛있었어요! 직원 분도 정말 친절하세요💕,126,True
혜화도담,효뤂뤂,36,2026.03.29,1번째 방문,영수증,혜화 김치찌개 맛집 너무 맛있어요 ㅎㅎ 가족 모임하기도 좋고 맛도 최고에요 😘😘,44,True
혜화도담,jae****,6,2026.03.28,1번째 방문,영수증,남자친구랑 낙산공원 놀러왔다가 방문했어요! 고기랑 김치가 진짜 부드러웠어요~! 맛집다운 곳이었어요. 담에 또 올게요.,65,True
혜화도담,tributo,28,2026.03.28,1번째 방문,영수증,"갈비찜이 정말 인상적으로 맛있었던 곳이에요. 고기가 부드럽게 잘 익어서 입에서 살살 녹고, 양념도 과하지 않으면서 깊은 맛이 나서 계속 손이 갔습니다. 매장 분위기도 깔끔하고 편안해서 식사 내내 기분 좋게 머물 수 있었고, 직원분들도 친절하게 응대해주셔서 더욱 만족스러운 시간이었어요. 다음에도 꼭 다시 방문하고 싶은 곳입니다.☺️👍👍 아 그리고 밥도 셀프로 무료로 가져다 먹을 수 있어서 너무 좋아요! 나물이랑 김치도 정말 맛있고 화장실도 청결해서 좋았어요 ㅎㅎ",259,True
혜화도담,yuv****,39,2026.03.28,1번째 방문,영수증,연극 보러 혜화에 들럿다가 맛잇게 먹구갑니다 김치찜이랑파전 너무 맛잇어요!! 너무 맛잇어서 먹다가 사진 찍엇네요😀😀,64,True
혜화도담,곰고미rt,20,2026.03.28,1번째 방문,영수증,친한 언니와 생일기념으로 혜화에 맛난 갈비찜 먹으러 왔어요~~ 짜지도 달지도 않고 고기가 너무 부드러워요!! ㅎㅎ 너무 만족합니다. 재방문 의사 잇어요^-^,87,True
혜화도담,귤잼5,7,2026.03.28,1번째 방문,영수증,"3주 전쯤에 친구랑 처음 왔다가 너무 맛있어서 이번에 부모님이랑 두 번째 방문했습니다. 김치찜 소, 대파전, 두부 반 모 입니다. 김치찜에 고기가 정말 부드럽게 잘 찢어지고 간이 막 맵거나 달거나 짠 게 아니라 적당히 어우러지고 강하지 않아서 좋았습니다. 두부랑 같이 먹으면 또 두부김치로 즐길 수 있어서 좋았구요. 그리고 제 취향에는 대파전...!!! 대파전이 너무 맛있습니다!!! 꼭 드세요!!! 다 먹고싶은데 배가 불러서 다 못 먹는 게 슬픈 집입니다ㅜ 다음에 혜화 쪽 오면 또 올 예정입니다:D",280,True
혜화도담,귤조아91,57,2026.03.28,1번째 방문,영수증,남자친구랑 창경궁 놀러왔다가 김치찜막고싶어서 찾다가 왔어요~!!! 맛있는 김치찜먹고싶어서 왔는데 유명한만큼 짱 맛있어요 밑반찬도 맛있고 두부도 맛있어요~! 덕분에 맛있게 먹고갑니다 : )!!,106,True
혜화도담,샤뜨르쁑,31,2026.03.28,1번째 방문,영수증,남자친구랑 서울 놀러와서 혜화 도담 왔습니당🧏🏻🥹🩵3번째로 오는 도담인데 항상 웨이팅 하다가 들어옵니다.. 그만큼 맛있다는 걸 증빙할 수 있는 곳 ~!! 밥이랑 반찬도 무한리필 !! 김치찜이 진짜 미친맛이에요~ !! 경기도에서도 주기적으로 올라와서 먹는 이곳 !! 꼭 한번 와보세요~~!!,161,True
혜화도담,코댕85,87,2026.03.28,1번째 방문,영수증,빨리 먹고 싶은 생각에 가위질 몇번에 고기가 바로 숭덩숭덩 잘리더라구요..? 부드럽고 김치도 새콤하니 맛있었어요! 음식도 바로 나오고 두부도 따뜻하게 바로 먹으니까 최고였어요 잘 먹었습니다,105,True
혜화도담,an****,22,2026.03.27,1번째 방문,영수증,김치찜 먹고싶을 땐 항상 해화도담옵니다! 저렴한 가격에 맛있는 김치찜 많이 먹을 수 있어요❤️❤️ 만석일 때도 많은데 오늘은 대기없이 입장해서 좋아요☺️,85,True
혜화도담,zcl****,15,2026.03.27,1번째 방문,영수증,너무 맛있어요! 김치가 푹 익었고 고기가 양면 잘 배겼어요!!,34,True
혜화도담,고기원168,3,2026.03.27,1번째 방문,영수증,완전 맛있어요! 혜화에서 한식 맛집 찾다가 왔는데 음식도 빨리 나오고 밥도 제공되어서 좋아요!! 사장님도 친절하세요 ㅎㅎ,67,True
혜화도담,동햅,37,2026.03.27,1번째 방문,영수증,"김치찜 고기가 엄청부드럽고 맛있어요!!!!김치도 말뭐,,,진짜 맛있네용 밥은 셀프로 먹는거라 밥도 넉넉히먹고 2인시켰는데 양도 은근많아요!! 완전 혜자스러운곳 추천합니당",94,True
혜화도담,로LO,47,2026.03.27,1번째 방문,영수증,건강하고 든든하게 잘 먹었습니다 ㅎㅎㅎ 최고 !💜,27,True
혜화도담,Jay8836,54,2026.03.26,1번째 방문,영수증,작년에 왔었는데 갈비찜 너무맛있어서 기억해뒀다가 다시왔어요. 운좋게 대기 안걸렸고 혜화오면 꼭 다시오고싶은곳이예요 ^^ 😀,68,True
혜화도담,YEONU1,20,2026.03.26,1번째 방문,영수증,친구랑 날씨 좋아서 연극보고 혜화 맛집이라고 해서 찾아왔어요~~ 근처에 대학로라 그런지 가격도 저렴하고 밥더 무제한이네여!!! 맛있게 먹고갑니다~~,82,True
혜화도담,lieblich83,41,2026.03.26,1번째 방문,영수증,푸짐하고 맛있어요!!ㅎㅎ 매번 잘 먹고갑니다~,25,True
혜화도담,미소천사74,49,2026.03.26,2번째 방문,영수증,오랜만에 대학로 데이트~ 김치찜으로 유명한 혜화 도담에 갔는데 역시나 탁월한 선택이였네요~~^^ 김치찜도 고기가 부드럽고 간도 쎄지 않고 맛있어요~ 무엇보다 평일 밥이랑 막걸리가 무한리필되서 더더욱 혜자스러웠어요!! 앞으로 대학로 놀러올때도 혜화도담으로 와야겠어요~^^,150,True
혜화도담,윤722,9,2026.03.26,1번째 방문,영수증,혜화 놀러왔다가 또간집 나왔다구 해서 와봤어요 친구랑 둘이 왔는데 음식도 엄청 빨리 나오고 맛있어요! 식당이 대학로 근처라서 그런지 학생들 양껏 먹으라구 밥도 무제한이네요!!! 맛있게 먹고 갑니다 또 올 것 같애요,119,True
혜화도담,희30,43,2026.03.26,1번째 방문,영수증,친구들이랑 모임으로 왔는데 너무 좋았어요. 음식이 너무 맛있고 사장님이 너무 친절하세요!! 세트 메뉴로 시키시는걸 추천드립니다!!!,73,True
혜화도담,솔라리에35,35,2026.03.25,1번째 방문,영수증,친구랑 밥 먹으러 혜화로 방문했어요. 김치찜은 정말 최고였고 고기도 부드러워서 맛있었습니다. 특히 반찬이랑 밥 무한리필 된다는 점이 정말 좋았어요.,82,True
혜화도담,감사메신저 해피나우,21,2026.03.23,1번째 방문,영수증,친구와 오랜만에 대학로에 나와서 찾은 맛집이에요^^ 양도 넉넉하고 깔끔해서 좋아요~,46,True
혜화도담,도토리야도토리야,13,2026.03.23,1번째 방문,영수증,양도 많고 밤에 데이트 하기 딱이에요! 김치전+파전+막걸리 조합 최고!! 맛있습니다~:),49,True
혜화도담,thw****,7,2026.03.22,1번째 방문,영수증,뮤지컬 보러 왔다가 시간이 남아서 먹으러 왔는데 가족들도 완전 다 만족했어요!! 직원님들도 사장님들도 친절하셔서 좋았어요~~,69,True
혜화도담,yeon4111,44,2026.03.22,1번째 방문,영수증,또간집혜화편에 나와서 연극 보고 먹으러 와봤습니다! 밥이랑 반찬이 무한이라서 좋고 김치맛이 묵은지라서 밥도둑이었습니다👍🏼👍🏼 또 올 것 같아요!,80,True
혜화도담,삑삑씨,35,2026.03.22,1번째 방문,영수증,혜화 맛집 검색해서 왔어요~!! 김치찜 먹고싶었는데 넘 맛있네요☺️ 아이들도 좋아하는 계란말이 있어서 밥 잘먹는데 어둡다고 징징거려요🤣,75,True
혜화도담,옐2,29,2026.03.22,1번째 방문,영수증,맛있게 잘먹었습니다! 5시 맞춰서 왔어요!,23,True
혜화도담,조이73,38,2026.03.22,1번째 방문,영수증,혜화 놀러왔다가 성대 다니는 친구가 김치찜 맛집 있다고 해서 방문했어요!! 양 되게 푸짐하고 맛있어요!! 직원분들도 친절하시네요. 다음에도 또 방문하려구요~ 강추!,91,True
혜화도담,중기마눌74,65,2026.03.22,1번째 방문,영수증,공연보고 또온집 ^^ 김치찜은 예술이입니다 고기가 너무 부드럽고요 대파전은 미쳤습니다 !!!!!!!,55,True
혜화도담,Fffuck,20,2026.03.21,1번째 방문,영수증,생각날 때 늘 오는 곳입니다 음식들 깔끔하고 맛있어요 파전도 바삭하고 완전 맛있어요,46,True
혜화도담,har****,26,2026.03.21,1번째 방문,영수증,여기 김치찜 맛있어요. 고기랑 김치는 잘 익어서 젓가락으로 찢어지고 살짝 시큼하면서 감칠맛 폭탄 두부 반모는 리뷰 이벤트로 받았는데 뜨끈하니 양념장에 찍어먹으니까 막걸리가 술술 들어가네요,104,True
혜화도담,lee****,2,2026.03.21,1번째 방문,영수증,남편이랑 오랫많에 대학로 나들이나왔다가 지인이 맛이집이라고 추천해줘서 혜화도담에 방문했어요 저녁에 방문했는데 웨이팅이 있어서 좀기다렸다 자리에 앉을수 있었어요 소문대로 김치찜 대파전 너무 맛있어어요 직원분들도 다친절했습니다 또올게요 맛있게 잘 먹었습니다,141,True
혜화도담,디셈 Decem,875,2026.03.21,3번째 방문,영수증,대학로 한식 맛집 대추천 벌써 3번째 방문!!,25,True
혜화도담,무늬만프로94,47,2026.03.21,1번째 방문,영수증,오랫만에 찾은 도담... 사장님은 늘 친절하시고 음식은 역시나 맛있고 직원분들 늘웃는 얼굴로 맞아주시니 행복하고 배부르게 한끼 먹고갑니다 늘 번창하시길 기원합니다~~^^,94,True
혜화도담,온네1,12,2026.03.21,1번째 방문,영수증,밥 반찬 무료로 셀프바 이용 가능 김치찜 고기 엄청 부드러워요ㅠㅠ 자극적이지 않지만 맛있는맛 파전은 배불러도 뮤조건 시키세용 사장님 너무너무 친절하심🩷,84,True
혜화도담,인화36,3,2026.03.21,1번째 방문,영수증,남친 최애메뉴가 김치찜이라 검색하다가 오게 되었어요 웨이팅은 40분이라고 안내받았는데 15분 후 들어갔어요(테라스 존) 테라스라고 해서 추울줄 알았는데 난로도 있고 포장마차처럼 다 막혀있어서 안추웠습니다 김치찜 바로 나왔고 꽤 괜찮네요 파전이 생각보다 맛있어서 추천해요,150,True
혜화도담,OBND,1858,2026.03.20,12번째 방문,영수증,김치찜과 대파전 두부 달걀말이 조합 좋아요,23,True
혜화도담,djd****,78,2026.03.20,1번째 방문,영수증,양이 엄청 많아요 !! 막걸리랑 넘 잘어울려서 술술 넘어감 ㅠㅠ,35,True
혜화도담,hjhj79,29,2026.03.20,1번째 방문,영수증,대학로에 데이트하러 왔다가 대학로 맛집 혜화도담 추천받아서 방문했어요! 블로그 찾아보니 맛있다는 후기가 많아서 기대했는데 김치찜 가격도 너무 좋고 넘 맛있었어요!! 고기도 통고기에 야들야들 부드러워서 넘 맛있게 먹었슺니다!!,125,True
혜화도담,ls****,4,2026.03.20,1번째 방문,영수증,아내와 금요일 저녁 대학로 산책하다가 예약 없이 내원했어요. 음식 정말 맛나고 양도 푸짐합니다. 대파전 바삭함과 두부의 따뜻함이 정말 좋습니다.,80,True
혜화도담,min****,12,2026.03.20,1번째 방문,영수증,친구랑 같이 저녁 먹으려고 서울 종로 혜화도담 방문했어요! 김치찜이랑 두부 먹었는데 양도 많고 고기도 부드러워요👍 맛있게 먹고 갑니다~ 추천이요!,81,True
혜화도담,Cos21,60,2026.03.19,1번째 방문,영수증,가족들과 따뜻한 한끼하러 방문했어요^^ 대학로점 방문했구 2인 김치찜 세트 시켜서 먹었네요^^ 김치찜은 조금 작아졌지만 맛은 여전했어요^^,77,True
혜화도담,dus****,56,2026.03.19,1번째 방문,영수증,연극 보고 와서 너무 맛있고 너무 든든하게ㅜ먹었어용 혜화에 또 오면 꼭 먹을 것 같아요 가성비 값!,55,True
혜화도담,won596,5,2026.03.19,1번째 방문,영수증,대파전 양도 엄청 많구 김치찜도 너무 맛있어요 모임 내내 너무 맛있게 먹다 갑니다!!!! 웨이팅도 금방 빠져서 많이 안 기다리고 입장했어요,77,True
혜화도담,냐옹이치치,40,2026.03.19,1번째 방문,영수증,저의 또또또또또간집 혜화도담!!!!!! 너무너무 맛있어요 ㅜㅜ 직원분들도 친절하구 좋아용 굿굿,52,True
혜화도담,이진권69,25,2026.03.18,1번째 방문,영수증,회식인데 혜화에서 너무 맛있었어요,18,True
혜화도담,00001329,35,2026.03.17,1번째 방문,영수증,김치찜이랑 낙지볶음이 매콤하니 맛있습니다 막걸리도 맛있어요 또 올게요~,39,True
