호호식당 대학로,이성희65,52,2025.12.27,1번째 방문,영수증,아이들과 함께 방문했는데 인원이 있어 어렵겠다싶었는데 다행히? 자리가 생겨 방문할수있었어요. 돈까스. 감자튀김.치킨? 스끼야끼 등 골고루 시켜 먹어봤는데 정말 맛있네요~^^ 아이들때문에 살짝 민폐? 일까 걱정하며 먹었지만 눈치없이? 잘 먹었어요~♡,138,True
호호식당 대학로,말차라떼00,166,2025.12.25,1번째 방문,영수증,음식 하나하나 정성이 느껴지는 식당입니다!! 파스타는 소스가 과하지 않고 면이 잘 어우러져서 끝까지 맛있게 먹었고 돈카츠는 겉은 바삭하고 속은 촉촉해서 정말 만족스러웠어요 ㅎㅎ 고기와 곁들임 반찬들도 신선했고 전체적으로 플레이팅도 예뻐서 기분 좋게 식사했어요❤️ 분위기도 조용하고 편안해서 재방문 의사 있습니다!,174,True
호호식당 대학로,킨케이트,15,2025.12.19,1번째 방문,영수증,서울대학교병원 진료 올 때 마다 매번 사람이 많아 다른데 갔었는데 오늘은 일찍와서 성공했네요. 히레카츠 엄청 부드럽네요. 소스보다 와사비랑 소금에 찍어 먹는것도 좋을듯 해요 다음에 또 올게요.,107,True
호호식당 대학로,에프맘,358,2025.12.18,2번째 방문,영수증,"대학로에 갔다가, 호호식당 들립니다. 오늘은 한우함박스테이크 주문합니다. 함박위에 계란있네요. 계란을 터트리면서 먹는 것.. 맛있죠^^. 이 조합을 아시는군요. 같이 나온 절임류가 오이, 생강, 당근인데 초절임인데 신선해서 찍어봅니다. 생강을 비트에 물들인 것 같은데 괜찮은 아이디어입니다. ㅋ",164,True
호호식당 대학로,rorty79,16,2025.12.17,1번째 방문,영수증,아이와 가끔씩오는혜화역 둘만의데이트에오늘은 유명한 호호식당왔는데 웨이팅없이바로 앉을수있었어요 평일이지만사람이많았는데 럭키비키네요 음식은 정갈히 맛났어요 점심시간이라 품절메뉴가많아 좀아쉬웠지만맛나게 잘먹고 즐겁게 데이트잘했습니다,126,True
호호식당 대학로,hms****,283,2025.11.12,9번째 방문,예약,"네이버 예약 후 이용하니 너무 편해요. 사케도로동, 연어 사시미 둘 다 연어가 잘 숙성돼서 쫀득함이 느껴지는 식감이고 맛있어요. 올 때마다 연어는 꼭 시켜 먹어요. 붓카케 우동은 저희 입맛엔 싱거웠어요. 일식은 좀 짠 듯한 간으로 먹는 걸 좋아해서요.",140,True
