식당 이름,계정 ID,계정의 리뷰 수,방문 날짜,방문 횟수,인증 수단,리뷰 내용,리뷰 글자 수,리뷰 내 사진 유무
계향각,빼드걸,1999,2026.04.01,1번째 방문,영수증,"중요한자리라 음식사진은 못찍었습니다만, 넘 맛있었습니다. 꼭. 다시 가겠습니다.",44,True
계향각,zja****,196,2026.03.21,1번째 방문,영수증,처음 방문하시는 분들도 찾기 쉽게 입구가 딱 제가 계향각입니다 합니다(인터넷으로 몇번 검색했더니 바로 찾을 수 있었어요) 입장과 동시에 교수님을 찾게 되더라구요 실물 영접~ 너무 감격스러웠어요 맛터사이클 출연하셨을 때부터 팬이거든요 식기들이 귀엽고 주전자 예뻐요 식기들 덕분에 대접받는 느낌이 첫 번째로 들고요 음식들 하나하나 맛있고 덜어 먹을 수 있는 젓가락 놓아주십니다 새심한 배려가 돋보입니다 오이냉채는 선택이 아닌 필수구요 동파육 부드럽습니다 볶음밥 간이 세지 않아 모든 음식과 잘 어울렸습니다 빠스 정말 대박입니다~ 모든 음식이 맛있어서 행복한 한 끼를 하고 왔습니다 감사합니다 😀,330,True
계향각,혼밥하는 판다,48,2026.03.13,1번째 방문,영수증,"캐치테이블 앱으로 예약해서 방문했고 동파육, 솬롱새우찜, 총유반면, 디저트로 복숭아빵 먹었습니다. 동파육은 굉장히 부드러워서 식감이 좋았고 솬롱새우찜은 마늘소스와 새우가 궁합이 좋았고 복숭아빵도 식후로 먹기 좋았습니다. 전날 급하게 예약해서 사전예약 메뉴를 주문하지 못했는데 시그니쳐 메뉴를 먹지 못해서 그게 아쉬웠습니다. 그래도 충분히 맛있었습니다.",196,True
계향각,DDreview,914,2026.03.07,1번째 방문,영수증,"신계숙셰프님 팬이어서 예약하고 다녀왔어요 그 어디서도 맛볼 수 없는 특별한 음식들에 감동 또 감동💛🫢 이제 다른 중국집 어떻게 가라고 이렇게 맛있고 퀄리티 높은 음식을 하시는건지,,,,,, 솬차이탕면은 시원한 국물이 별미였고 연근디저트 차갑게 먹는 거 완전 강추 강추 ❣️ 셰프님 넘 친절하시구 직접 사진도 찍어주세요😉🩶",179,True
계향각,pip****,11,2026.02.26,1번째 방문,영수증,맛있게 잘먹었어요. 쉐프님과 직원분들도 친절하세요.,28,True
계향각,오브네 OVENE,34,2026.02.22,1번째 방문,영수증,나만 먹고 즐기게 더 유명해지지 말아다오 vs 그래도 신계숙 셰프님 잘되고 식당이 유명해져야 좋은거지 라는 마음속의 갈등... 정말 동파육 여기저기 먹어보지만 국내에서 여기만큼 현지와 같은 맛있는 동파육을 만드는 곳이 있긴 할까 의문이네요 아직 캐치테이블 예약 난이도가 쉬운 편이라 안도하며 다니는 중인데 중식 즐기시는 분들 중에 안가보신 분들은 꼭 가보세요 동파육이 흐드러지는게 아니라 입에서 거의 녹는 수준이에요 해삼주스도 해삼 퀄리티 이정도 나오는 업장 우리나라에 그렇게 많지 않습니다😭 오리 주문도 필수.. 생선찜 소스는 상큼하고 매콤한게 아주 쉽게 설명하자면 동남아 음식을 연상케 합니다 못올린 사진이 많은데 하여튼 제발 와서 드셔주세요 셰프님도 너무나 유쾌하고 친절하고 젠틀하시답니다😊,389,True
계향각,난다신난다73,460,2026.02.15,1번째 방문,영수증,동파육 부들부들해요. 1인 4입 먹을수있는 크기구요. 팔보오리는 잘라주시는데 한두숟가락 정도 먹을 수 있어요. 해물누룽지도 제대로더라구요. 전체적으로 양이 적긴한데 맛은 있어요. 중식이긴 하나 짜장 짬뽕 그런거 있는 집 아니니 참고하세요. 신계숙님과 예약 상담 전화받는 분 서빙하는 분 모두 매우 친절하셨어요.,173,True
계향각,The Aid,3756,2026.02.14,1번째 방문,영수증,"26.02.14. 토요일 오전 11시 30분에 예약 후 방문했습니다. 예약은 캐치테이블 앱에서 했습니다. 미리 예약해야하는 메뉴 두 가지 중 한 가지인 팔보오리(4인분 180,000원)만 예약했고, 나머지는 당일에 주문했습니다. 7명 방문해서 디저트 포함 총 9가지 정도 메뉴 주문했고, 엄청 배부르게 먹었는데, 조금 덜 주문해도 괜찮을 것 같습니다. 동파육은 기름진 편이라 인당 1개 보단 2~3명이서 1개 정도 주문하면 좋을 것 같았습니다. 왕태수팔보두부, 삼선누룽지탕, 팔보오리 메뉴가 호응이 좋은 편이었습니다. 밑반찬이 따로 나오지 않아서 오이냉채 같은 새콤한 메뉴를 주문해서 같이 먹어야 합니다. 주차는 발렛(발렛비 4천원 외 주차비 별도) 가능하고, 화장실은 가게 내부에 남녀 구분되어 있습니다",394,True
계향각,이승현712,1720,2026.02.07,1번째 방문,영수증,너무맛있게 진짜 음식이란 이런것이구나........ 정말 맛나게 만족 2만프로 하고 갑니다,50,True
계향각,피키봉키,63,2026.02.03,1번째 방문,영수증,"예전 세계테마기행에서 보고 반했던 분이 이번에 흑백요리사 나오셔서 너무 반가웠고 직접 매장도 운영하신다는걸 알게됐네요. (뒷북;;) 꼭 와보고 싶었는데, 오늘 즉흥적으로 예약없이 오픈런 방문했어요. 맵찔이지만 산초,마라 좋아해서 용감하게 마라갈비시켜 쪽쪽 먹고 있었더니, 대표님 직접 오셔서 이 메뉴는 이십대들이 좋아하는 메뉴라며ㅎㅎ 그치만 저도 이십대기분? 너무 좋았답니다. 포장해가고 싶을정도로 맛있었어요! 다니시며 직접 인사도 다 해주시고 내일 또 오라고 농담도 하셨어요. 진짜 내일 또 가고싶은 맛집. 술도 꼭 곁들여서 더 다양한 메뉴 먹으러 갈게요! 증교는 말할것도 없고 마지막 특이한 '조'로 만든 디저트도 맛있었어요.",352,True
계향각,그럴수도이찡,129,2026.01.28,1번째 방문,영수증,"🧡동파육2인(44,000) 넘무너무~ 부드럽고 적당히 달아서 맛있어요 🧡라즈지(35,000) 는 매운거 못 드시는 분들은 조금 힘들 수 있는 맵기인데 맛있습니다ㅎㅎ 🧡해선볶음밥(18,000) 밥 메뉴가 요거뿐이라 시켰어요 굿!! 🧡증교(16,000) 속이 알차고 담백하며 사이드로 강츄 🧡오이냉채(5,000) 는 생각보다 양이 많고 오이 좋아하시면👍🏼 🧡총유반면(14,000) 간이 적당하고 쫄깃해서 맛있어요 강츄 룸을 제외하고 테이블이 많은편은 아니지만 간격이 적당하고 매장이 깔끔해 대화하기 좋습니다ㅎㅎ 만족스러운 식사였어요😍",296,True
계향각,커피러버75,460,2026.01.25,1번째 방문,영수증,다행히 예약이 수월해서 거리가있었지만 부지런히 달려가 방문했습니다. 고수.오이냉채도 깔끔했고 동파육 탕수갈비도 역시 비교불가! 팔보오리는 하이라이트로 손색이 없었습니다. 그리고 우럭생선찜의 고추토핑은 볶음밥과 함께 먹으니 더 완벽했어요. 콜키지는 첫1병 무료인것도 감사했구요. 심지어 와인잔을 두개나 깼는데 차지안하시더라구요! 서비스.음식 모두 친절하고 흠잡을데가 없네요.,208,True
계향각,hto****,17,2026.01.18,1번째 방문,영수증,"세번째 방문입니다. 음식맛은 오늘이 가장 좋았으나, 전체적인 경험은 가장 아쉬웠어요. 룸에서의 식사는 처음이였습니다. - 룸 안 에어컨 / 난방시설 먼지가 너무 심했어요ㅠㅠ - 보울 서빙하실때 손을 안에 집어넣고 가져오신다던지 가장 불편했던건 전반적인 접객이였습니다. (특히 여자서버분) - 메뉴 설명 숙지가 매끄럽지 않았습니다. - 음식 배분과 서빙도 매끄럽지 않은데다 오더 들어간것 누락도 몇번이나.. - 의도는 아니였겠지만 불편하게하는 응대와 말투 - 음식 간 텀이 지나치게 길어 흐름이 계속 끊겼습니다. 이전 두번 방문때 접객도 음식도 뛰어났었어서 지인들을 데려간 자리에서 아쉬움이 더 컸습니다. 저렴한 가격도 아닌데.. 음식 맛과 가격에 걸맞게 접객과 서비스에 신경쓰셔야할것같아요.",386,True
계향각,잠탱32,96,2026.01.18,1번째 방문,예약,쉐프님 인사도 해주시고 유쾌하세요. 식전부터 직원분들이 이것저것 챙겨주시고 메뉴 설명 잘해주셨습니다. 음식은 다 너무 신선한재료로 정성껏 해주신 것이 맛에서 느껴집니다. 중식은 느끼하다는 편견을 버리게 되었습니다. 증료랑 찹쌀소갈비찜 꼭 드세요. 틀 이층입니다. 양 충븐합니다.,155,True
계향각,태리보거드,185,2026.01.18,1번째 방문,영수증,"맛은 괜찮았어요 몇가지 불편한게 있었네요 서비스질이 좋지 않았고, (여성 두분 ) 저희가 받아야할 소스 쟁반을 식사 하시는 모르는 옆테이블에 잠깐 올려두고 서비스 하는것도 이해가 도통 어렵네요 식사는 너무 늦게 나왔습니다 누라된 오더도 있었어요",136,True
계향각,맛객리우,238,2026.01.15,1번째 방문,영수증,"전체적으로 슴슴한 (일부 메뉴 빼고, 생선은 자극적) 간인데 그 안에 또 깊은 맛이 납니다. 채소류가 너무 맛있어서 꼭 시켜야 할 것 같고 신계숙 셰프님 계속 돌아다니시면서 설명해주고 주문 받으시고 너무 친절하세요. 다른 직원분들도 친절하시구!",136,True
계향각,삼오오엔,1042,2026.01.14,1번째 방문,예약,예약없이 가서 혹시나 하고 갔는데 식사 가능하다고 해서 운좋게 들어갔어요 브레이크 타임 전이라 간단히 식사류만 주문 했어요. 라즈지는 마라탕맛과는 다른 진짜 마라맛이라 얼얼하고 맵지만 먹고 속이 불편하지 않았어요. 술을 부르는 맛입니다. 절인 배추가 들어간 탕면은 이게 중국요리인가 싶을정도로 마치 한국식 묵은지 김칫국 맛이 나서 신기했어요. 노계육수라고 하셨는데 닭내나 기름기하나 없고 배추와 어울려서 시원한 맛이 일품이었습니다. 볶음밥도 고스고슬했고 간이 삼삼했지만 라지즈랑 먹으니 합이 맞았습니다. 주문하고 음식기다리는 동안 신계숙교수님이 불쑥 오셔서 인사를 먼저 해주셨어요. 깜짝놀랐는데 농담도 해주시고 나갈땐 사진요청에 흔쾌히 응해주셨습니다. 직원분들도 친절하고 정중한 어투로 서빙해주셨어요,391,True
계향각,나몰라라86,412,2026.01.11,1번째 방문,영수증,흑백요리사2 출연한 쉐프님이있는곳. 맛있습니다.,26,True
계향각,지니소장,703,2026.01.07,1번째 방문,영수증,흑백요리사보고 대구에서 혼자 먹으러 옴. 부드러운 동파육. 깊은 맛의 삼선탕수육 ㅎㅎ맛있고 친절하심,55,True
계향각,리자몽의역습,6,2026.01.03,1번째 방문,영수증,음식이 너무 맛이 없었어요. 동파육은 술맛이 엄청 강하게 났습니다. 양도 무척 적고요. 라즈지는 짜고 한 입 먹으면 입안이 얼얼해져서 매운 맛과 짠맛만 납니다. 비싸도 맛있고 좋은 음식이면 괜찮았을텐데 전체적으로 정말 아쉬웠네요.,128,True
계향각,쿠키앤크림마미,383,2026.01.02,1번째 방문,영수증,생일기념으로 중식 좋아하는 남친때문에 방문햇는데 생각지도못한 사장님의 퍼포먼스는 잊지못할것같아요 음식이 느끼하기보다 단백해서 하나도 남김없이 모두 먹을수잇엇다는게 리얼 팩트예요!,99,True
계향각,abc6174,178,2025.12.31,1번째 방문,영수증,해선볶음밥 동파육 오이냉채 총유반면 고구마 빠스시켰는데 총유반면 제외하고 전부 강추예요! 총유반면은 넘배불러서 덜맛있게 먹었을지도...? 해선봌음밥은 별거없어보이는데 진짜 마싯써요 계속 들어감!! 쉐프님이 직접 서빙도 해주시고 사진도 찍어주시고 넘나 대접받는 느낌💓 다음엔 특별한 날 예약하고 가족들이랑 같이가고싶어요😆,178,True
계향각,mihtatit,663,2025.12.31,3번째 방문,영수증,라즈지 짱 교수님 짱,11,True
계향각,수호천사90,548,2025.12.28,1번째 방문,영수증,"가격은 좀 비싼편 이지만 맛은 어디에서도 먹어볼 수 없는 맛!!!!! 실망하지 않아요. 생일 이라 자녀들이 데리고 갔는데 맛 있어서 과식 했어요. 단지 좀 아쉬웠던 건 반찬류는 오이냉채, 연근냉채 두가지 만 있는데 오이냉채 오천원인데 두번 주문해서 먹었는데 맘놓고 먹으면 10번은 주문 하겠더라고요.아삭하고 맛 있습니다.음식의 느끼함을 다 잡아줘요. 메뉴가 다양해서 선택 폭이 넓어서 추천 할만합니다.",224,True
계향각,cut****,46,2025.12.25,1번째 방문,영수증,팔보오리 찹쌀소갈비찜 홍고추생선찜을 먹었는데요 아주 건강한 맛에 처음 접해보는 음식이라 새로운 경험이 되었어요 즐거운 시간이었습니다!,74,True
계향각,꾸르맛집탐방가,1185,2025.12.21,1번째 방문,예약,"연말을 맞이해서 엄마랑 특별한 음식을 먹고 싶어 미리 전화로 예약하고 방문한 계향각♡ 귀한 손님께 대접하는 음식이라는 팔보오리는 미리 예약해야 되는 메뉴여서 미리 예약하고 방문! 동파육, 팔보오리, 다진홍고추생선찜 그리고 고구마 빠스까지 너무 맛있게 잘 먹었습니다♡ 따로 짜사이 같은 반찬이 없어서 고수나 오이, 연근 냉채를 같이 주문하는 걸 추천:) 신계숙 교수님도 뵐 수 있어서 더 영광이었어요! 흑백요리사2 효과로 이제 예약이 어려울듯하지만ㅠㅠ 재방문 의사 있어요♡",263,True
계향각,민8275,85,2025.12.20,1번째 방문,영수증,진짜 맛있어요,7,True
계향각,Djgj,2072,2025.12.18,1번째 방문,영수증,긍정적잉 밝은 에너지 셰프님께 좋은 기운 받아갑니다 음식도 너무 맛있고 접객도 훌륭해요,48,True
계향각,한입만3,171,2025.12.18,1번째 방문,영수증,"강북맛집에 전문가인 삼촌의 추천으로 왔던 곳인데 팔보오리 맛에 반해서 다시 방문했구요. 정성들인 오리요리라 적어도 하루전에 예약시에 주문해야해요. 오리안에 영양밥이 있구요. 오너쉐프님이 나오셔서 잘라주시고 맨처음엔 뜨거운차와 같이 주시는데, 나중엔 요리로 몸이 더워질때 또 찬물도 주셔서 그 세심함이 보이셨어요. 동파육은 티라미수처럼 사르르 입에 녹구요. 사진엔 없는데, 연근 야채요리 꼭 같이 드세요. 새콤달콤한 장아찌같아서 오리요리나 고기요리랑 어울려요. 생선찜도 우럭인데 산뜻하고 슴슴한 간을 선호하는 저에겐 딱 좋았어요.",295,True
계향각,Yoooooj1,237,2025.12.17,1번째 방문,예약,흑백요리사 나온 멋진 쉐프님 보러 방문! 음식은 맛있으나 양이 좀 적은편이에요 그래도 동파육이랑 볶음밥 정말 맛있게 먹었어요 😀,71,True
계향각,라자,960,2025.12.14,1번째 방문,영수증,아주 멋진 요리집. 일반적인 중국음식점에서 먹을 수 있는 메뉴는 없습니다. 무 수프와 동파육은 정말 인상적입니다. 팔보두부도 먹기 편하고 고소한 맛으로 누구든 좋아할 거 같아요. 라즈지는 매운 거 못 드시는 분들은 주의가 필요해요. 생선찜은 면 추가 필수. 신계숙 교수님이 직접 배워오신 고추양념이 킥입니다. 후식 빠스도 단 맛이 자극적이지 않아서 마지막까지 좋았습니다. 가능하면 여러분이 가셔서 다양하게 시켜서 드시기를 권합니다.,241,True
계향각,pms****,717,2025.12.13,4번째 방문,영수증,송년모임으로 신계숙쉐프님 식당에 다녀왔어요 찹쌀소갈비찜이 특이하게 맛 있네요 왕태수팔보두부도 보양식으로 맛 있구요,63,True
계향각,멍93,13,2025.12.06,1번째 방문,영수증,모든 음식에 정성이 가득 담긴 요리를 찾는다면 여기!! 어쩌다 급 결성으로 가게 된 곳이라 예약도 못하고 가서 빠르게 치고 나왔지만 다음에 예약하고 전통 중식 요리를 즐기러 다시 오겠습니다 친절히 신경써주셔서 감사했습니다,123,True
계향각,해리와놀자,600,2025.12.06,2번째 방문,예약,"오늘 계향각에서 오이냉채, 라즈지, 솬촤이탕면, 증교까지 네 가지 메뉴를 제대로 즐겼어요. 오이냉채는 상큼하게 입맛을 열어주고, 라즈지는 겉바속촉 매콤함이 너무 중독적이에요. 솬촤이탕면은 얼큰하면서도 깊은 맛이 매력적이고, 증교는 담백하게 마무리하기 좋았어요. 전 메뉴 맛의 밸런스가 좋아서 재방문하고 싶은 집입니다. 분위기까지 편안해 데이트·모임 모두 추천합니다!!! 1병 콜키지프리!!",217,True
계향각,두리두리두두,275,2025.11.25,1번째 방문,예약,어디서 쉽게 먹어볼 수 없는 특색있는 요리가 많고요 음식이 전반적으로 굉장히 부들부들 야들야들해요 팔보오리도 미리 예약해서 먹었는데 누룽지통닭의 고급 오리버전? 같았고요 ㅋㅋ 동파육은 진짜 부드러워서 입에 넣기도 전에 녹고요 ㅋㅋ 수자우육이 엄청 매운데 조개빵 같이 시켜서 찍어먹으면 엄청 잘 어울리고 맛있어요 셰프님이 엄청 유쾌하시고 반갑게 배웅해 주셔서 마지막까지 기분이 좋았어요,214,True
계향각,Nurmir,1600,2025.11.11,3번째 방문,영수증,혜화역에서 누군가를 대접해야 할 때 이보다 좋은 선택지는 적지,34,True
계향각,bla****,96,2025.11.04,1번째 방문,영수증,"여기를 찾게 된건, 네이버 지도 중식으로 검색하고 또한 유뷰트에서 나와 버린이슈가 있습니다. 이집은 일반적인 중식당 이상인것 같습니다. 일단 메뉴를 보시면 생소한 이름들이 있습니다. anyway, 맛을 얘기 보자만, 해선볶음밥.. 아 이게 바로 황금볶음밥이구나 적정한 익힘의 탱글한 해산물 그리고 아스파라거스의 씹히는 맛의 조화는 황홀하다…. 돼지처럼 혼자 만두도 먹었습니다. 시키길 잘했네여 뭥가 익숙한듯 안 익숙한 속과 바로 찜기에서 꺼내먹는 맛, 하지만 만두는 역시 만두피 얇지도 두껍지도 않은 그 두께감이 잘 시켰습니다. 보아하니 방도 있고 좋은 술도 있어보이고, 중요한 모임에 소중한 사람들과 다시 방문 하고 싶습니다. 잘먹었습니다. 그리고 먹진 않지만 주신 오이요리 서비스 마음만 받을께요!! ㅋㅋㅋㅋ",398,True
계향각,저혈압20,40,2025.10.31,1번째 방문,예약,미식과 서비스로 정말 즐거운 저녁을 보냈습니다!,26,True
계향각,yon****,2,2025.10.19,1번째 방문,예약,"시그니처 메뉴라 할 수 있는 동파육이랑 삼선누룽지탕, 증교, 디저트로 팥앙금찐빵 먹었는데 정말 다 맛있었습니다. 특히 메인으로 먹었던 동파육이랑 누룽지탕은 제가 다른 곳에서 먹어본 같은 메뉴들 중에서 가장 맛있었습니다. 누룽지탕의 재료들 정말 신선하고 맛있어서 아직도 생각나네요. 맛있는 중식 드시고 싶은 분들께 강력추천합니다.",183,True
계향각,에피파니29,592,2025.10.04,1번째 방문,예약,홀에서 먹으면 요리 매연이 고스란히 느껴져서 재채기나고 힘듦...친절은함. 재방문의사 없음,50,True
계향각,가딘98,493,2025.10.03,1번째 방문,영수증,일반적인 중국요리와는 좀 다른 요리가 많아 색달라서 좋았어요 라즈지는 약간 얼얼해지는 닭요리로 조개빵과 같이 먹으니 잘 어울렸어요 삼선누룽지탕은 신계숙교수님이 직접 부어 주셔서 기분 좋고 진짜 맛있었어요 교수님 실물이 더 예쁘시고 날씬하셔서 놀랐어요~,140,True
계향각,비행시도,5,2025.09.27,1번째 방문,예약,정말 친절하고 맛있게 먹었습니다 주문이 잘못들어가서 한마리가 나왔는대 반마리 가격으로 해주셔서 더 맛있게 먹었습니다 이런 생선찜은 계향각에서 밖에 못먹습니다 신계숙 셰프님도 뵐 수 있어서 더 좋았습니다,112,True
계향각,C A,7,2025.09.13,1번째 방문,영수증,"푸딩처럼 부드러운 식감의 동파육과 다진 고추 소스의 향과 풍미가 살아 있는 생선찜, 빠스까지 전반적으로 만족스러웠으며, 차후 방문 시에는 팔보오리 경험해 볼 예정입니다.",94,True
계향각,복있는 사람84,13,2025.09.12,2번째 방문,예약,"다음 방문을 기대할 만큼 충분히, 훌륭한 맛이에요",27,True
계향각,아지곰,17,2025.09.04,1번째 방문,예약,,0,True
계향각,neojk,14,2025.08.29,1번째 방문,예약,너무 맛있게 잘먹었습니다. 😀,16,True
계향각,짱이1963,1320,2025.08.17,1번째 방문,영수증,"동파육도 맛있지만, 해선볶음밥이 진짜 맛있어용~^^",28,True
계향각,드라군86,18,2025.08.13,1번째 방문,예약,"아들 21번째 생일 기념으로 다녀 왔음. 방문 전 주말에 재방송으로 라디오스타에 신계숙 선생님 출연하신 내용 보고 갔는데, 선생님께서 오셔서 인사해 주셔서 새삼 구면같아 좋았습니다. 아들이나 저나 저 생선찜 너무 맛있게 먹었고 서비스도 푸짐하게 주셔서 너무 고마웠습니다. 먹느라 미처 사진 못 찍은 동파육, 볶음밥, 솬차이탕면도 너무 맛났습니다. 다음에 방문해 다른 메뉴 먹어보고 싶네요.",217,True
계향각,Coco35,15,2025.07.18,1번째 방문,예약,가족 모임을 위해 예약을 하고 신셰프님 워낙 유명한 분이고해서 모처럼 중국 음식 즐기러 왔어요. 룸이 있었다는 걸 알았다면 룸으로 예약할 걸 그랬어요. 실내는 크지 않았지만 너무 분위기 잡고 예식차리며 조용히 먹어야 하는 곳이 아니라 편하게 대화하며 먹을 수 있는 분위기라 너무 좋았어요. 중국 본토 음식이라고해서 혹시나 향이 강하거나 하면 어쩌나 저으기 염려 했었는데 기우였네요. 음식이 건강한 맛이고 전혀 향신료가 강하지 않고 먹고 나서도 속이 편안한 것이 모든 게 좋았어요. 신셰프님도 중간중간 나오셔서 인사하고 맛있냐고 물어도 봐 주시고 원하시면 사진도 찰칵! 흡족하게 식사를 하고 왔습니다. 가족 모두 생선요리 먹으러 또 오기로 했어요.,361,True
계향각,덕패밀리,1633,2025.07.02,1번째 방문,영수증,"캐치테이블과 네이버 예약 가능 시간이 다르고 네이버에서도 가능한 시간이라고 나오는데 안 돼서 전화로 예약했습니다. 콜키지 프리인 점과 특색 있는 음식들을 맛볼 수 있다는 점, 친절한 응대가 좋았습니다. 그리고 전반적인 음식들 간이 참 좋아서 대부분 맛있게 먹었습니다. 다만 저녁 첫 손님으로 가서 한동안 손님이 저희 뿐이었는데 주방 쪽에서 손님이 있다는 걸 전혀 의식하지 않은 듯 너무 크게 떠들었다는 점이 가장 아쉬웠고 빠스를 주문했는데 리뷰에서 본 것처럼 쇼맨십을 보여주지 않았던 점, 탕수갈비 고기가 다소 질겼던 점, 주문하고 싶었던 오리 요리가 없었던 점도 아쉬움으로 남습니다. 그래도 다음에는 화이트 와인을 가지고 다시 방문해서 돼지 냉채와 생선 요리 등 새로운 메뉴를 맛보고 싶습니다.",389,True
계향각,psk0516,49,2025.06.29,1번째 방문,예약,"맛있네요 ㅎㅎ 메뉴 도장깨기 하러 또 방문할 예정입니다. 일단 재료 퀄리티가 굉장히 좋은게 느껴지고, 매장청결, 음식맛, 전반적인 서비스 뭐 흠잡을게 없네요. 작은 불편이 있었다면 식사내내 작은 초파리 한마리가 알짱댔다는거...ㅋㅋ 그거 빼고는 넘 만족스러웠네요 고구마 빠쓰까지 포장해왔어요 ㅎㅎ",165,True
계향각,hahihuheho2,1430,2025.06.21,1번째 방문,예약,"팔보오리 라는 요리를 처음 먹어봤어요. 북경오리는 많이 봤어도 요건 흔하지 않죠 기름기를 쫙 뺀 오리 안에 각종 8가지 재료를 넣어 만드는데 만드는 데 반나절 이상이 소요된다 하더라구요. 정성이 가득 느껴지는 요리였습니다. 이거랑 특히 오이무침이 입맛을 돋워줘서 맛있게 먹어요. 동파육, 연근무침, 솬차이탕면은 특별히 기억에 남지는 않았어요 기본제공되는 밑반찬이 없는 것은 아쉬웠습니다 직원분들 전부 너무 친절하시고 요리에 대한 설명도 잘 해주셔서 좋았습니다",256,True
계향각,먕먕먕먕 먕먕먕먕,8,2025.06.15,1번째 방문,예약,"오이 냉채, 동파육, 찐교, 생선요리, 고구마빠스 진짜 맛있었어요",36,True
