혜화도담,하루하루260,67,2025.12.29,1번째 방문,영수증,원래 저녁을 동대문으로 넘어가서 먹으려다가 그냥 이근처에서 아무거나 먹자 하고 급하게 찾은 곳이었어요! 마침 브레이크타임이 끝나가고 가까워서 왔는데..!!!! 양도 많고 너무 맛있어요 대파전도 너무 바삭거리고 두부는 말해뭐해 너무 고소하고 김치찜 고기는 너무 부드럽고 김치까지 완벽! 그리고 제가 마침 논알코올을 찾고있었는데 화이트 제로가있어서!!! 더더 좋은 저녁이네요👍 추천입니다 추천!!!,220,True
혜화도담,고양이공예샘,79,2025.12.28,1번째 방문,영수증,매번 지나갈때마다 사람이 꽉차서 아쉬웠는데~~ 오늘은 웨이팅하고~~ 기다리며 먹으러 왔어요^^ 역쉬~~~ 기다라 보람이 있던 곳이랍니다. 김치침도 맛나고~~ 특히 고기가 야들야들~~~ 대파전은 첨 먹어봤는데~~~ 우와~~~ 도톰하고 맛나요^^ 밥도 무한리필이라 더욱 꿀맛이였어요~~~ 웨이팅도 생각보다 쑥쑥~~~ 빠져서 지루하지 않게~~ 맛있게 먹었습니다. 계속 계속 번창하세요^^/,214,True
혜화도담,han****,27,2025.12.26,1번째 방문,영수증,양도 많고 맛도있어요~ 김치하나가 그대로 들어있고 반찬도 원하는 만큼 밥도 원하는만큼 먹을 수 있어서 좋았습니다! 최고최고,68,True
혜화도담,징5355,19,2025.12.26,4번째 방문,영수증,"지금 한 4번째 방문인데, 리뷰는 또 처음 써보네요!! 항상 사람 많아서 아직까지도 여전히 맛있구나 뿌듯한 마음이 드네요. 여전히 김치 가득 든 김치찜 먹고 싶음 오고있어요. 저렴한 가격에 한식 드시고 싶으면 오세요!!",122,True
혜화도담,min****,54,2025.12.25,1번째 방문,영수증,"밥 무한리필, 콩나물과 김치까지 다 주는게 좋아요. 김치찜 고기가 살살 녹고, 대파전이 특색있게 맛있어요! 묵은지가 아주 맛있습니당. 리뷰로 받은 두부도 맛있게 먹었어요~",95,True
혜화도담,좀웃기는민트42,15,2025.12.25,1번째 방문,영수증,남자친구랑 크리스마스날에 방문했는데 음식 모두 맛있었어요!! 파전도 두툼한데 바삭하니 너무 맛있고 김치찜도 고기가 야들야들 하고 김치도 너무 맛있고 완전 밥도둑이에요ㅎㅎ 밥이 셀프라는 점도 얼마든지 먹을 수 있어서 좋았구! 남자친구랑 만족하면서 아주 맛있게 먹었어요!,149,True
혜화도담,bassirt,19,2025.12.24,1번째 방문,영수증,도담 얼마만인지! 역시 도담입니다. 고기 살살녹고 김치 정말 맛나요! 대파전은 바삭하고 김치찜이랑 궁합이 최고에요 대기줄보고 어제 포기했는데 오늘은 6시전에 도착하니 다행히 입장했어요. 김치찜은 도담이죠👍😍,115,True
혜화도담,sks****,14,2025.12.22,1번째 방문,영수증,오늘 지인 추천으로 처음 방문했는데 왜 유명한 식당인지 바로 알았습니다 고기는 가위가 필요 없을 정도로 부드럽고 김치도 너무 맛있게 먹었습니다 대파전은 무조건 시켜드세요 근 5년동안 먹었던 전 중에서는 가장 맛있었습니다 번창하세요~,129,True
혜화도담,이브리데이,29,2025.12.21,1번째 방문,영수증,양이 많고 고기 잡내도 안나서 넘 맛있게 먹었습니다! 김치찜 오랜만에 먹었는데 적당히 매콤해서 맛있어요 파전도 양이 많고 빠삭해요~! 그리고 직원분이 굉장히 친절하세요 세트메뉴 추천해주셔서 좀 더 저렴하게 먹을수있었습니다 ㅎㅎ,126,True
혜화도담,맛있는것만먹는다파,16,2025.12.20,1번째 방문,영수증,"일단 너무 너무 친절하셔요 💛 바쁘신 와중에도 이렇게 친절하신 게 쉽지 않은데 친절하신 직원분들과 복작북적 사람들 온기 속에서 맛있게 식사하고 갑니당. ㅎㅎ 음식도 너무 너무 너무 너무 맛있어서 무조건 또 올거예요 ㅠㅠㅠㅠㅠㅠㅠㅠㅠ 김치찜의 김치와 고기와 국물이 너무 조화롭고 딱 아는 그 맛이고, 대파전은 정말…. 쏘 스페셜… ㅠㅠㅠㅠㅠㅠㅠㅠㅠㅠㅠㅠㅠㅠㅠㅠ 전 단독으로도 먹으러 오고싶은..? ㅎㅎ 감사합니다 사장님 번창하세요~!!!!!!!🙇🏻‍♀️",252,True
혜화도담,zffzto,7,2025.12.19,1번째 방문,영수증,이 근처에서 자취해서 자주 가는데 늘 양도 푸짐하고 너무 맛있어요! 막걸리 종류도 다양해서 막걸리 좋아하시는 분들에게도 추천입니다 👍 가족과 함께 먹어도 부족함 없이 맛있습니다 😋 저녁에는 사람이 많기 때문에 미리 예약하고 오는 게 좋을 거 같아요!,139,True
혜화도담,픔319,56,2025.12.07,1번째 방문,영수증,"골목골목 지나가다 발견했는데 사람 북적 분위기 좋아보여서 들어왔어요! 한식 좋아하는데 너무 맛있고, 양도 많아요! 전이 특히 맛있어서 소주 먹다가 막걸리 추가했네요 ㅎㅎ 다음엔 김치찜도 먹으러 다시 오려구요! 친절하시고 화장실도 나쁘지않아요 :) 웨이팅 많이 하더라구요 맛집입니다!",157,True
혜화도담,soso8570,11,2025.12.06,1번째 방문,영수증,여기가 파전이 미쳤어요 김치찜은 평범하면서 약간 단느낌이 있고 전은 바삭바삭하고 끝없이 들어가요 엄청 큰데 이걸 다 먹을 수 있어요 막걸리랑 같이 먹으면 그 기름진 맛과 파와 구수하고 단 진짜 제가 먹었던 파전 중 제일 제 취향이었습니다 재료가 아낌 없이 들어가서 김치찜만 먹으면 부족할 수 있는데 파전과 막걸리까지 먹으면 충분해요 추천합니당🙈,192,True
혜화도담,cindyinny,30,2025.12.05,1번째 방문,영수증,김치찜이랑 대파전이 너무 맛있어서 재방문한 곳이에요 :) 김치찜에 고기도 듬뿍이고 대파전은 두툼 바삭해요 두꺼운데 어쩜 이리 바삭한지 계속 생각나는 맛이에요💕 다음에도 재방문할게요👍❤️❤️,105,True
혜화도담,tbs,32,2025.12.04,1번째 방문,영수증,"어디갈지 고민하다 김치찜 맛집 있다고해서 왔어요! 대기 없이 바로 입장했구 음식도 빨리 나왔어요 ! 포천막걸리, 김치찜, 파전 시켰는데 막거리는 깔끔하고 술이 술술 들어가요 ㅋㅋㅋ 김치찜 살코기도 젓가락으로 잡자마자 사르르 녹고 김치도 맛있어요!! 파전도 바삭바삭하니 맘에드네용 덕분에 아주 맛있는 저녁 보낼 수 있습니닷!",180,True
혜화도담,먹을거에진심,96,2025.11.30,1번째 방문,영수증,한식이 땡겨서 방문했어요! 리뷰가 너무 좋아서 웨이팅 있을까봐 걱정했는데 점심시간 피크는 지나서인지 다행히 바로 입장했어요ㅎㅎ 가위도 주셨는데 아주 푹 잘 익어서 가위질이 필요 없었습니다 &gt;_&lt; 김치도 맛있어요🥰 밥도 무한이고 전도 유명해서 다음엔 저녁에 방문하려고 합니다!!,160,True
혜화도담,RBHAR,43,2025.11.29,1번째 방문,영수증,일단 사장님이 너무 친절하세요!!! 주말 점심에 와서 웨이팅이 꽤나 있었지만 그래도 로테이션이 잘 돌아서 금방 들어왔어요!!! 그리고 기다릴만한 맛이에요 ♥ 너무 맛있어요&gt;.&lt; 혜화 올 때 이곳을 일순위로… ♥,123,True
혜화도담,렛츠 Lets,138,2025.11.28,1번째 방문,영수증,"&lt;북촌도담&gt;과 ""김치찜""을 비교하자면, 북촌은, 오모리찌개 스타일로 맵지않고, 새콤 짭쪼름한 김치에 고기가 다소 뻑뻑 했다면, 여기 혜화는, 일반적인 스타일의 살짝 매콤한 김치찜 입니다. 개인적으로는, 북촌의 김치찜 스타일이 좋지만, 대파전과 같이 먹기에는 혜화의 살짝 매콤한 스타일이 더 나은 듯 해요. ""김치찜""은, 기본에 충실한 맛. 4.0점 ""대파전""은, 맛 자체가 뛰어난 건 아니지만, 과자처럼 바삭바삭한 식감이, 끊임없이 젓가락을 들게 만듭니다. 4.5점",266,True
혜화도담,Tomek,516,2025.11.27,1번째 방문,영수증,"겨울을 알리듯 새벽부터 세차게 내리던 비 탓에 하루 종일 몸이 으슬으슬했습니다. 이럴 때 가장 먼저 생각나는 것은 뜨끈한 국물이 주는 포근한 위로입니다. 그 간절함에 이끌려 혜화도담을 찾아 점심으로 김치찜을 선택했습니다. 오랜만에 맛본 김치찜은 기대 이상의 감동을 안겨주었습니다. 깊게 숙성된 김치 특유의 풍미가 국물에 그대로 녹아들어 있었고, 푹 익혀 부드러워진 돼지고기와 어우러져 최상의 감칠맛을 냈습니다. 이렇게 깊은 맛을 마주했을 때, 막걸리 한 잔이 빠질 수는 없겠지요. 혜화도담에서 무료로 제공되는 시원한 막걸리 한 잔을 곁들이니, 밖에 내리는 비와 차가운 날씨마저 김치찜의 뜨거움과 참으로 조화롭게 느껴졌습니다. 정갈하게 차려진 다양한 밑반찬 또한 한 끼 식사로서의 만족감을 채우기에 부족함이 없었습니다",400,True
혜화도담,Agreetoyouropinion,1468,2025.11.23,1번째 방문,영수증,"리뷰가 좋아서 선택한 곳인데 , 리뷰보고 오길 잘했네요. 소박하고 따스한 정겨움이 느껴지는 맛. 엄마의 손맛같은 김치찜 정말 맛있어요. 대파전도 푸짐하니 아주 좋아요. 오늘 점심 정말 ㅋ닥월한 선택이네요.",114,True
혜화도담,솔직한 언니,740,2025.11.12,1번째 방문,영수증,서울 혜화동 돼지갈비찜으로 유명한 혜화도담 방문했습니다. 달달하고 고소한 돼지갈비찜! 바사삭!!! 대파전~~ 끝내주게 맛있습니닷!!! 역시 혜화맛집으로 유명한 이유가있네요~♡ 다응메도 달달한 돼지갈비찜~ 바사삭 파전먹으러 또 오겠습니닷!!!,134,True
